Restaurant,Reviewer,Review,Rating,Metadata,Time,Pictures,7514,ner_results
Eat India Company,Varun MotawalA,"Pathetic!!! A group of 20 people from work visited this place, we didn't have great expectations, at the same time we didn't foresee a terrible experience that it eventually would turn out to be. Half of us were seated close to the glass facing the Gachibowli road, thanks to their incredible maintenance, the ac was so poor, we were all sweating profusely. We weren't served starters for atleast 40 minutes. The choice of plates and their maintenance is extremely poor to say the least. The food (starters, main course, desserts) tasted so bad that most of us were content just eating curd and ice cream. We will never be going back to this place.",1,"25 Reviews , 7 Followers",9/13/2018 1:16,0,,"{'food': ['starters', 'main course', 'desserts'], 'drink': []}"
Eat India Company,Sriram Sumaithangi,"Horrible place
Nothing for vegetarians
Service is awful
Paneer was not properly cooked
Corn cubes were hopeless
We had to wait for an hour to get vegetarian starters
The main course for vegetarian dishes was empty",1,"3 Reviews , 1 Follower",9/12/2018 14:18,0,,"{'food': ['Paneer', 'Corn cubes'], 'drink': []}"
Eat India Company,Bhavik Parikh,"Had been here on my birthday and opted for unlimited dinner and have to say till then my birthday was going great because the food was real disappointment including soup, starters, main course and dessert.",3,"32 Reviews , 1446 Followers",9/10/2018 16:49,0,,"{'food': ['soup', 'starters', 'main course', 'dessert'], 'drink': []}"
Eat India Company,Vedant Killa,"A group of 4, we decided to visit this place on Saturday evening. The location is quite on the main road, however, the parking and the entry is terrible. They can surely improve in this aspect as it can be a big turn-off.🤦🏻‍♂️

After entering the restaurant, we were quite impressed with the ambience and the decor. It had a very India taste to it. They had old locks, keys, doors and other wooden stuff adding to the rustic look. 😍

Coming to the food, there is a plethora of options on their menu. Instead of going through it all, we decided to quickly take recommendations and order it with the bearer. Hariyali Paneer Tikka and Corn cubes made for the perfect starter combination. Corn cubes cannot be missed here. My friend ordered a Chicken starter which was quite average though. Moving to main course, we wanted to keep it simple with rotis and a few curries. Paneer Lababdar, Mushroom curry and Nizami Handi seemed like good choices. Food was decent.

The service was not impeccable. It ca surely be improved. Also, they did not even serve finger bowls at the end of our meal. Quite a surprise. 😑

The price point is a little on the higher side- probably much more than average. 😅😅 It can be a great negative. They accepted gold on food, so yay!

Overall, a good experience, but probably not one worth visiting again.",3,"86 Reviews , 216 Followers",9/9/2018 22:56,2,,"{'food': ['Hariyali Paneer Tikka', 'Corn cubes', 'Paneer Lababdar', 'Mushroom curry', 'Nizami Handi'], 'drink': []}"
Eat India Company,Bukka Shesha Kiran,"Good selection of dishes in the menu.The best thing about this place is it's ambience and serving.

Dambaru the steward who has given the service to the best. 

Thanks to the team who have organized really good.
Not but the least the brownies was to yummmmmmmmmmmmmmmmy


We enjoyed a lot :)",5,"2 Reviews , 27 Followers",9/7/2018 14:32,0,,"{'food': ['dishes'], 'drink': ['drinks']}"
Eat India Company,Khushi Singh,"I went in for a late night dinner after work. I was happy with the service provided. Best part about this place is their interior. The antique royal doors, old locks and vintage pictures hanging on the wall and ceiling added to the charm. Quality and quantity is almost worth the price. The ambiance is perfect for a peaceful sumptuous meal. I would definitely suggest this place.",4,"21 Reviews , 125 Followers",9/7/2018 13:19,0,,"{'food': ['dinner'], 'drink': []}"
Eat India Company,Amul Chittalkar,"If you’re wondering what to do on Sunday then head to Eat India Company, Gachibowli. Eat India Company has been one of my favorite restaurants in Hyderabad since years. Now they’ve opened a new branch in Gachibowli. Yay to all my office folks. Everything from the ambience to the décor, to the music is wonderful. The quality and taste of the food over the years has been consistent. I love love love Indian food and they have some delicious dishes if you’re a meat lover. Everything from shorba to kebabs to nalli ki nihari to dum biryani is sooooooo yum!

On Sundays, the branch at Gachibowli teams up with Urban Asia to host a special brunch from 12 pm to 3 pm. Urban Asia is another brilliant kitchen for Asian food. If you love Chinese and Indian food, you cannot miss this brunch. They have more than 27 dishes with veg and non-veg options plus desserts. Apart from this, they also had chaat and sushi as well when I went. All this at 888 per person only. What a steal deal. My favorite five dishes from the menu are hara bara kebab, chicken angara, kang pao fish, mutton rogan josh and of course the Dal Bukhara [for those of you who don’t know, this is a velvety makhani style dal that is not spicy but packed with flavor].

Make sure to book your table in advance. Another good tip in case you’re someone who wakes up late or you forget to book a table is to go after 2pm cause it’s usually not crowded at that time. Let me know how you like it! Thank me later.",5,"23 Reviews , 61 Followers",9/6/2018 12:07,0,,"{'food': ['shorba', 'kebabs', 'nalli ki nihari', 'dum biryani'], 'drink': []}"
Eat India Company,Avin Seth,"A family dine in place great ambiane tasty food 🥘 nice view and awesome ambiance. The place has an ancient indian look with old locks, supari cutters, old doors on walls and ceiling are amazing. Its a lovely experience.

Cheers Rakshita Nath",5,"197 Reviews , 1383 Followers",9/2/2018 14:08,3,,"{'food': ['vindaloo', 'biryani', 'paneer tikka'], 'drink': ['chai', 'buttermilk']}"
Eat India Company,Yum Yum YUMMY !,"This place has two restaurants in it. One is Urban Aisa, and ankther one is ETC. Ambience and entrance was good . Food quality and presentation was too good. Ordered chicken , and mutton biryani here . Taste was good , not awesome. Will visit again ✌️

Overall Experience : 4/5

Ambience - 4.5/5
Seating -3/5
Food Quality - 5/5
Taste - 4/5
Service -5/5
Value for money - 4/5",4,"89 Reviews , 202 Followers",9/1/2018 21:45,9,,"{'food': ['chicken', 'mutton biryani'], 'drink': []}"
Eat India Company,Shivam Shrivastava,"Just love this place. If you are looking for proper north indian place then this is the place. Zomato Gold takes you to different places and this was one of them. Tried Paneer butter masala, butter chicken, dal makhani along with breads and pulav. Definitely worth a visit.",4,"22 Reviews , 33 Followers",9/1/2018 13:28,0,,"{'food': ['Paneer butter masala', 'Butter chicken', 'Dal makhani', 'Bread', 'Pulav'], 'drink': []}"
Eat India Company,Ash Dal,"Visited this place for the good experience we hd earlier at their jubilee hills outlet but at yachi bolu it was a disappointing experience.Purina chutney was sour , methi chicken was bitter. Don't think will visit again. Attitude of service staff was ok.",2,"5 Reviews , 1 Follower",8/29/2018 23:30,0,,"{'food': ['Purina chutney', 'Methi chicken'], 'drink': []}"
Eat India Company,Sakshi Singh,"We went here to celebrate a Friend’s birthday dinner ...
The staffs , service ,interiors and ambience was really great...

Coming to food, it was something ...
We all really did enjoy ...
Although the food preparation time was bit more than we expected...
But overall its a must visit place if you wanna hangout with either your office colleagues, friends or family ...

Regards,
Sakshi",4,"52 Reviews , 179 Followers",8/29/2018 20:41,7,,"{'food': ['dish', 'drink'], 'drink': []}"
Eat India Company,Raghu Kakkunoori,"The best thing about this place is it's aimbence. Food was good, would have been better for it's price. Gachibowli branch is clubbed with urban aisa. Zomato gold customers can take advantage of it.

Aimbence: 5/5
Service: 4/5
Food: 3.5",3,"49 Reviews , 1317 Followers",8/27/2018 19:24,5,,"{'food': ['Food was good', ""would have been better for it's price""], 'drink': []}"
Eat India Company,Akshay Krishna,"It was supposed to be a really casual lunch and we didn’t expect this place to be nice but were surprised for sure.

So it’s a nice restaurant with well arranged furniture and light. Has a buffet lunch which is very convenient for Software professionals and casual lunches with friends.

I have small complaints which are listed in the end but apart from that I had a nice time.

So in the spread, something that I loved dearly was the Chilly Prawns. I just couldn’t get enough of it. It was amazing.
The chicken was alright. But I can say but prawns were the best. Although they were really small, but can’t complain much. They didn’t give us fish even after we asked for it.

Staff: attentive and service was okay.

Ambience: very nice place, looks good, clean, effort was put in to make it look nice.

Food: food was definitely good I liked it quite a lot apart from the desserts. They were pretty bad.

Complaints: Starting with the ice cream guy- they have a cold stone ice cream. He broke a water glass on the bar counter while making ice cream (technically just mixing it) and he used his already worn gloves and ice cream scoop to push the glass pieces away. Didn’t wash his hands or change his gloves or wash his scoop. For all we know the glass pieces were still on his hands and scoop.

Second is also with the ice cream guy, we found hair inside the ice cream he made us and returned it immediately. Lost our appetite soon after that.

Third is with one of the waiters, probably didn’t want to give us fish even after we asked him to get us some which was on the buffet menu. He agreed to get some but never showed up with it. I hope it’s his memory and nothing else that caused the problem.

Hopefully management reads this and takes action on it.

If those factors are avoided, then will go again definitely.",3,"144 Reviews , 911 Followers",8/24/2018 22:25,0,,"{'food': ['Chilly Prawns', 'Chicken'], 'drink': []}"
Eat India Company,Charan Thota,Great place and wonderful service by Dilip! We ordered a fist starter and a biryani. Fish was very good. Loved the place! Will visit again for sure,5,"3 Reviews , 203 Followers",8/22/2018 14:31,0,,"{'food': ['fist starter', 'biryani'], 'drink': []}"
Eat India Company,Mahima Sharma,Good food. Amazing service. Decent enough prices. Paneer lababdaar and palak paneer are a must try. This outlet (Gachibowli) provides you more options since you also can order food from Urban asia menu. Overall a good experience.,5,"15 Reviews , 23 Followers",8/21/2018 22:33,0,,"{'food': ['Paneer lababdaar', 'Palak paneer'], 'drink': []}"
Eat India Company,Kumar Raja,Service is very slow. We waited for 30 min for the non veg starter and ended up having lots of time soda and left.. the dishes had very least salt. The chat was bitter.,1,"3 Reviews , 5 Followers",8/18/2018 14:54,0,,"{'food': ['soda', 'left'], 'drink': ['soda']}"
Eat India Company,IndraJeet Ghorpade,"The whole place was vibrating because of the loud music from the club above, completely spoiled the ambiance. The food wasn’t great either. The atta rumali roti was kachcha. Butter chicken lacked proper thickness. The biryani at jubilee is way way way better. Wouldn’t visit again. Especially when there’s a better alternative in the city.

The service was very good. No complains about the service. Very well trained staff.",2,"103 Reviews , 363 Followers",8/17/2018 23:21,0,,"{'food': ['atta rumali roti', 'butter chicken'], 'drink': ['biryani']}"
Eat India Company,Aditi Gupta,"Ambiance (3/5): 
Decent place for family get together. Comfortable seating arrangement, boring music. 

Food(4.5/5):
The quantity and quality of dishes served are exceptionally great. 

Service(2/5):
Service was extremely slow. Starting from menu to finger bowls to bill we kept calling the waiter and waited for ~10 min after every order. 
I was under the impression that after GST service charges are removed but i was charged additional ~10% service tax. 
Also AXIS bank offer as mentioned on Zomato site was not given by restaurant.",3,"58 Reviews , 150 Followers",8/17/2018 17:52,3,,"{'food': ['dishes served'], 'drink': []}"
Eat India Company,Smit Verma,"Food is delicious.Even service is good.SK allauddin served very well. We ordered
1. Chicken Sholay
2. Paneer lababdar
3. Peas pulao
4. Tandoori roti and butter naan",5,"2 Reviews , 2 Followers",8/12/2018 15:21,0,,"{'food': ['Chicken Sholay', 'Paneer lababdar', 'Peas pulao', 'Tandoori roti and butter naan'], 'drink': []}"
Eat India Company,Jaldeep Vasavada,"Urban asia and eat india company are in the same premises. Stale food, slow service, oily food. Water dripping from AC vents on tables and food items. Really bad experience.",1,"3 Reviews , 1 Follower",8/11/2018 12:45,0,,"{'food': ['stale food', 'oily food'], 'drink': ['water dripping from AC vents on tables']}"
Eat India Company,Ravindra Babu Gompa,"Enjoyed the lunch buffet, had multiple varieties of starters. Tasted like awesome. There are many variables in main course as well. Desserts are less in number but should be fine. The final ice cream mix was just sumptuous !!",5,"2 Reviews , 11 Followers",8/10/2018 15:34,0,,"{'food': ['starters', 'main course', 'desserts'], 'drink': []}"
Eat India Company,Sanjaya.bihari,"Food is good, but service is pathetic. Had keep asking for starters, but they couldn’t serve all the items at least once. Finally we gave off",2,1 Review,8/8/2018 14:13,0,,"{'food': ['Food'], 'drink': ['Starters']}"
Eat India Company,Abhinav Baloni,"The food is good, the ambiance is good, we were greeted by Dilip Das, and he made it an amazing experience for us to dine in over here.
Surely would like to come again!",5,"3 Reviews , 27 Followers",8/5/2018 21:00,0,,"{'food': ['food'], 'drink': []}"
Eat India Company,Susmitha Reddy,Had a greater time.. Great ambience coupled with delicious food...!!! Service was awesome..Thanks to S K allauddin.. Continue the same😊 cheers!! 👍,5,"1 Review , 1 Follower",8/4/2018 23:58,0,,"{'food': ['delicious food'], 'drink': ['great ambience', 'awesome service']}"
Labonel,Ruby Mathews,"Let me make it simple !
Their brownies are to die for , they have a huge variety of cupcakes but my personal favourite have always been the red velvet and chocolate brownies with walnut topping.",4,"18 Reviews , 86 Followers",5/21/2019 13:21,2,,"{'food': ['brownies', 'cupcakes', 'red velvet', 'chocolate brownies', 'walnut topping'], 'drink': []}"
Labonel,Arza Naveen,"This Place has only take aways, so I have ordered Red velvet Creme Cheese cake, and the Cake taste is lip smacking and everyone liked it. We even took a box of fresh brownies which are awfully tasty.

Only lacking thing is this place doesn't support customization of cakes. Prices are a bit high but they are worth it as the taste is good.",5,"19 Reviews , 20 Followers",5/17/2019 15:28,1,,"{'food': ['Red velvet Creme Cheese cake', 'fresh brownies'], 'drink': []}"
Labonel,Kanika Garg,"It is one of the premium bakers in Gachibowli. Most of the items are made on order, probably 24 hours prior booking is required. I ordered a Triple chocolate cake for my husband. It was good in taste but nothing extraordinary and came with nice packing.

Overall, you can try their cakes once although it may pinch your pocket.",4,"3 Reviews , 2 Followers",5/2/2019 17:10,1,,"{'food': ['Triple chocolate cake'], 'drink': []}"
Labonel,Saba,"Its a very expensive bakery not like other bakery they dont sell brownies and cupcakes in pieces they sell box of cupcakes and brownies . The brownies are amazing very tasty , they are soft and smooth . Love it .",4,"56 Reviews , 40 Followers",5/2/2019 0:51,0,,"{'food': ['brownies'], 'drink': []}"
Labonel,Rakshith Torres,"Okay so initially I thought it's quite expensive, especially for the brownies. But I had to try, of course. I took a risk of taking 2 boxes of assorted brownies for my friends. Well, in a nutshell, they loved it and so did I. Id not think twice about the brownies again! Cheers!",4,"16 Reviews , 7 Followers",4/26/2019 20:57,0,,"{'food': ['brownies'], 'drink': ['cheers']}"
Labonel,Sandeep Indukuri,"This place is all about the hype. Ordered their signature cake - Classic Chocolate with hazelnuts.

Good - Top cream layer, Good number of hazelnuts.

Bad - Extremely dry, hardly any cream inside the layers.

For 2900₹ it's extremely disappointing.",1,"8 Reviews , 3 Followers",3/29/2019 8:22,1,,"{'food': ['Classic Chocolate with hazelnuts'], 'drink': []}"
Labonel,Tumpa Roy,"Customer service is Zero..
They don’t know how to behave and dude they don’t even have an extra box.
The entire store is under renovation, how do we know the cookies and cookies are freshly baked..
It’s expensive too. The least you can do is speak properly with the customers, well these people they definitely CAN’T.
This place only has the hype!!!",1,"72 Reviews , 367 Followers",3/22/2019 14:31,0,,
Labonel,G. Sushmitha Reddy,"Best Brownies!

Labonel box of brownies are freaking expensive but are of good quality. Purchased a Walnut brownie box from here. Melt-in-mouth Brownies were cakey and moist inside.

PS: Zomato says this place has indoor seating but they don't have any and it disappointed us a lot. It's just a take away.",4,"81 Reviews , 872 Followers",3/18/2019 19:28,1,,"{'food': ['brownies', 'walnut brownie box'], 'drink': []}"
Labonel,Jay Mehta,"got a box as a gift!

Trully Amazing brownies gotta experience it...goes really well with some good old vanilla ice cream dash of chocolate sauce or even solo",5,"46 Reviews , 43 Followers",2/19/2019 17:32,0,,
Labonel,Mohammad Ali,"What a amazing experience, very delicious desserts
Staff is very friendly, hurry to visit to try more treats,
Very good ambience, 10/10 for everything",5,"10 Reviews , 9 Followers",2/11/2019 17:44,1,,"{'food': ['desserts'], 'drink': []}"
Labonel,Nishant Tiwari,Average cakes at a very high price. Banana bread was very greasy and too sweet. Staff also not courteous. Will stick with Concú from now on.,1,"1 Review , 3 Followers",12/31/2018 14:20,0,,"{'food': ['banana bread'], 'drink': []}"
Labonel,Sai Parithosh,Best brownies and cupcakes in the town... That chocolatey feel you will not get anywhere else.. trust me.. I feel they are over priced.. but can spend it,5,"64 Reviews , 103 Followers",12/26/2018 12:43,1,,"{'food': ['brownies', 'cupcakes'], 'drink': []}"
Labonel,Shreya Bhandari,"Their atmosphere is beautiful and the vibe is amazing. Tried their cupcakes. One of the best in Hyderabad, especially the red velvet cupcakes. It is a bit on the pricier side, but definitely worth it",5,"6 Reviews , 6 Followers",12/19/2018 21:35,0,,"{'food': ['cupcakes'], 'drink': []}"
Labonel,Puja Agarwal,"Chocolate cup cakes and Brownies, they were amazing. It is fine baking in it's true sense. A little high priced but then, they bake worth it!",5,"32 Reviews , 265 Followers",12/11/2018 22:46,0,,"{'food': ['Chocolate cup cakes', 'Brownies'], 'drink': []}"
Labonel,Faisal Ahmed,Very delicious cakes and brownies. Great quality. But a little expensive when compared to the size of the cake. Range is limited when you reach randomly. Variety only on order basis.,4,"3 Reviews , 139 Followers",11/29/2018 16:59,0,,"{'food': ['cakes', 'brownies'], 'drink': []}"
Labonel,Asraahmad22,"Their tag line 'fine baking' describes this bakery best!
Really one of the finest bakes I have encountered so far.

The chocolate brownie are commendable, with the right balance of chocolate-iness and fudge-iness in every bite!!!
We also loved the cookies and banana loaf",5,"9 Reviews , 6 Followers",11/25/2018 23:25,0,,"{'food': ['chocolate brownie', 'cookies', 'banana loaf'], 'drink': []}"
Labonel,Vedant Killa,"A true match for Theo’s from Mumbai, one of Hyderabad’s finest bakery 😬

The Triple Chocolate Cake is just designed and made to perfection! The cake is soft and gooey, full of chocolate and provided in amazing packaging.😇

I’ve been a regular with their brownies, they’re super light and yet so tasty! The only negative is that they come in a box of around 15 pieces as the smallest offering.

The cupcakes are a delight as well, both red velvet and chocolate. Slightly high on the price point.

Always a go-to-place for an excellent experience! ❤️",5,"86 Reviews , 216 Followers",11/24/2018 11:09,0,,"{'food': ['Theo’s from Mumbai', 'brownies', 'cupcakes'], 'drink': []}"
Labonel,Surabhi Gupta,"I love the cupcakes from this place, vanilla , chocolate and redvelvet combo is awesome. Cakes are also delicious. The only thing lacking is variety.",4,"66 Reviews , 270 Followers",11/20/2018 21:28,0,,"{'food': ['cupcakes', 'cakes'], 'drink': []}"
Labonel,Shilpa Prusty,"I ordered a pack of combo cupcakes of vanilla , chocolate and red velvet.None were upto the mark.I was attracted towards it good reviews and wanted to give it a shot .But none of the cupcakes were soft.
The icing on top tasted only sugar and the cream was stale.The cake was not spongy at all.I really don't understand how it has such high rating here.Total waste of money.My first and last visit today.",1,"70 Reviews , 169 Followers",11/17/2018 21:00,0,,"{'food': ['pack of combo cupcakes', 'vanilla', 'chocolate', 'red velvet'], 'drink': []}"
Labonel,Sudeep Sodani,Love the cakes and the brownies. Brownies are a must try. Red velvet and chocolate cakes here make me go nom nom nom. Initially the price point may seem high but each bite redeems more than each buck spent.,5,"16 Reviews , 151 Followers",11/13/2018 15:24,0,,"{'food': ['cakes', 'brownies'], 'drink': []}"
Labonel,Sridhar Kumar,"An excellent place with mind blowing taste. I can say each and every item is of high quality and it's worth the price tag. If someone is really tired of conventional desserts, it's the place for you to try something new. The taste will make you feel the fuming power of their tagline #finebaking",5,"27 Reviews , 58 Followers",10/24/2018 8:54,1,,"{'food': ['dessert'], 'drink': []}"
Labonel,Sthiti Chakraborty,"Nice place for desserts. Tried their red velvet cheese cake which was okayish as I am not a fan of the same anyway. And had packed a chocolate cake. The cake was really tasty and filling. It had that rich taste of chocolate and the texture of the cake was amazing. It was packed very well.
These guys are great with their quality and presentation.",4,"118 Reviews , 771 Followers",9/30/2018 12:45,1,,"{'food': ['red velvet cheese cake', 'chocolate cake'], 'drink': []}"
Labonel,Gopal Agarwal,"When we order something special for a loved ones birthday apart from the value there are always sentiments attached to it.

My sister aspires to start her own bakery and holds Labonel Fine Baking in high regard. Keeping this in minds we thought a Labonel cake will make her birthday more special.

We ordered the cake 1 week in advance and had confirmed the order the previous day. We also spoke to them the very same day we were supposed to pick up the cake. Both the times we were informed by their staff that the store is open on 23rd Sept. till 6pm (this is after you ignore the fact that their official timing is 7pm).

They decide to call me on the day of pickup at 4:50pm to inform me that they will shut down at 5:30pm. So, not only was i expected to drop whatever i was doing at a moment's notice i believe they expected me to teleport to their store.

Well since the cake held sentimental value for me I did leave immediately and rushed to the Gachibowli store. I made it there by 5:10pm and can you imagine my dismay when I saw that the store was closed! To add to it no one answered the phone.
I stood there for 30 minutes trying to get in touch with them on multiple phone numbers on the website but there was no response.

I could not believe that a renown place could be this unprofessional. If they cannot value their customers and have no regard for others time and sentiments I do not think it would ever matter how their product is.

My sister no longer considers them a role model as she values her customers more than having a fancy store with expensive products.

Since they did not contact me back even the next day I feel the only option left then is to complain on social media and hence this post. I hope this falls on deaf ears of Labonel owners.

I know I will not be repeating the mistake of ordering something from this place and to anyone who reads this, you have been warned :)

Update: I have a facebook post which certifies that minimum 5 friends of mine have dealt with similar bad experiences.",1,"2 Reviews , 85 Followers",9/25/2018 22:40,0,,"{'food': ['cake'], 'drink': []}"
Labonel,Harshita,"These cupcakes are so soft, fresh, chocolaty, delicious!!! They’re totally not overhyped. And their store is so pretty too. They should have one of these in BOMBAY. I can’t keep asking my friends to get them for me 😂",5,"125 Reviews , 363 Followers",9/19/2018 18:03,0,,"{'food': ['cupcakes'], 'drink': []}"
Labonel,Deepthi,after going through the amazing reviews I tried red velvet cupcakes. honestly it's not worth at all. the frosting on cupcake wasn't fresh. it tasted below average cake. not worth the money.,2,"1 Review , 1 Follower",9/10/2018 13:24,0,,"{'food': ['red velvet cupcakes'], 'drink': []}"
