Restaurant,Reviewer,Review,Rating,Metadata,Time,Pictures,7514,ner_results
Driven Cafe,ChicLifeByte,"If bikes, cars and coffee are your weaknesses then the Driven Cafe is no less than heaven for you. Their luxurious collection of supercars and bikes includes fantabulous FORD-MUSTANG-5, premium PORSCHE-911 CARRERA-4S0, the Hulk of Bikes TRIUMPH-ROCKET-III, speedy SUZUKI-HAYABUSA and the kinetic KAWASAKI-ZX14R- which is also one of the world’s fastest bike to name a few and guess what one could also rent these amazing creations from their website. At present, their fleet consists of 150 cars, 50 motorcycles and 7 bicycles.

If this doesn’t satisfy the gearhead inside you then there’s some delicious food and coffee for killing your hunger cravings even in those odd hours of the night!

The place is a brilliant amalgamation of a cafe and a bike museum. The ground floor of this establishment is a quaint cafe which sells food and beverages. It is very vintage in feel and decor and you will be treated by a very well spoken staff. The cafe also has a store which sells/rents biking accessories including biking jackets, helmets and other accessories.

Coming to the food now, the first thing we had here was the Chili Cheese Toast which is a cheddar melt on white bloomer with an orange mayo. It was quite filling and really tasty. Next up was the flavourful Apple Pie with ice-cream that totally melted in mouth and tasted heavenly with ice-cream.

This was complemented with a selfie coffee and a regular coffee. The ‘selfie coffee’ has your selfie printed on the coffee foam purely made of edible ink. This is one-of-a-kind experience. You click a selfie and Whatsapp that on a number, they’ll print that particular selfie on the coffee.

Lastly we had the Turkish Baklava Twins which were crunchy, nutty, flaky and really delicious. The place has a lot of variety in terms of coffee which included Colombian Coffee, Death Wish, Illy Monka, Birch Coffee, Araku Tribal Coffee, Organic Decaf Peppermint Mocha and many more.

The place is definitely a must go!

Review Credit: Karan Bhyana

chiclifebyte.com",5,"151 Posts , 2709 Followers",6/10/2018 9:48,34,,"{'food': ['Chili Cheese Toast', 'Apple Pie with Ice-cream', 'Turkish Baklava Twins'], 'drink': ['Selfie Coffee', 'Regular Coffee']}"
Driven Cafe,Nishu,"Explored this place today and was surprisingly very good because it never occurred me to try out for this long. Has an American cafe ambiance and feel and is open until 1 AM at least. The cheese garlic bread, veg puffs and Latte coffee were pretty good. It's self service and the order came in pretty quick. One and only suggestion is that maybe they can focus a little more on cleanliness. Overall, a good place for a quick catch up with friends over a bite. Amit Agrawal Harsh Jhunjhunwala Poorvi Agarwal",3,"120 Reviews , 1246 Followers",6/9/2018 2:27,6,,"{'food': ['cheese garlic bread', 'veg puffs'], 'drink': ['Latte coffee']}"
Driven Cafe,Siva Kumar,"Well been to this place for 4 times now, the reason being it's unique ambience, peace and the opportunity nto spend quality time.

Would have given it a 5 but the place has lost a bit of it's charm recently.

Shakes are very good, my personal favorite being black currant..n the brownie is also super yummy.

The main attraction would always be the awesome interiors which this place offers.

If u have still not visited this place, book your weekend for this😁",4,"84 Reviews , 183 Followers",6/6/2018 1:43,8,,"{'food': ['Shakes', 'Brownie'], 'drink': []}"
Driven Cafe,Sridhar Kumar,"It's ambience is enough to drive you crazy. It's one of the best places in financial district to hangout with friends. Coffee varieties will be satisfactory but will not disappoint too. If you want to click an amazing photographs with no one around and want to relax with a cup of coffee, it's the place for you.",4,"27 Reviews , 58 Followers",6/5/2018 13:33,0,,"{'food': [], 'drink': ['Coffee']}"
Driven Cafe,Sayir Ashai,"Visited on 3rd June 18. The place is cool and the deserts served here are really nice.

I tried the Mango Pie, chocolate donut and the chilli bread and the cold coffee.

Mango pie was pretty good and the blueberry muffin was really tasty.

Frappe coffee was an average cold coffee but Chilli cheese bread was a different one.

The ambiance and the music is cool. Good place to hangout and get some nice time with friends with a cup of coffee.",4,"15 Reviews , 12 Followers",6/4/2018 2:40,0,,"{'food': ['Mango pie', 'chocolate donut', 'chilli bread'], 'drink': ['cold coffee']}"
Driven Cafe,Kailash Joshi,"Awesome food 🥘. Been here couple of times and always satisfied with the food.

Food - 4/5
Ambience - 4/5
Service - 4/5

Open 24/7 and friendly staff.",4,"17 Reviews , 33 Followers",5/29/2018 12:58,0,,"{'food': ['Awesome food', 'Couple of times'], 'drink': []}"
Driven Cafe,Pushyami Reddy,"A best place for some hot chocolate and quick hunger bites, innovative ambience and cool staff. Loved the hot chocolate ☕️ 😁😁 good hang out place to refresh your mind 😜",4,"29 Reviews , 132 Followers",5/25/2018 7:42,3,,"{'food': ['hot chocolate'], 'drink': ['☕️']}"
Driven Cafe,Sidharth Mittal,"Place is usually sparsely populated.
They have a good variety of teas and coffees.
My personal favourite is Turkish Coffee.
Must visit if you want to try out something new and spend time at a peaceful place.",4,"62 Reviews , 119 Followers",5/25/2018 2:31,0,,"{'food': ['teas', 'coffees'], 'drink': ['Turkish Coffee']}"
Driven Cafe,Pancham Yadav,Very good frappe. Thanks for the good experience.,5,"30 Reviews , 7 Followers",5/12/2018 12:48,0,,"{'food': ['frappe'], 'drink': []}"
Driven Cafe,Yash Paradkar,"Great ambience and good taste. Entire place is designed with a sporty vehicular theme, and I was totally driven towards that. Also, there are sports cars which you can actually rent, if that's your intention.

This place gets more happening as the night goes, exactly opposite to Hyderabad itself :P",4,"57 Reviews , 42 Followers",5/5/2018 17:57,2,,
Driven Cafe,Bhavya Tyagi,"One of the best cafes I have been to. Hood ambience and good food.
What adds to the feel are the bikes n cars . Lovely to see everything at a single place.
Staff are courteous. Coffee is good.
Really loved the Red sause pasta.",4,"46 Reviews , 74 Followers",4/28/2018 9:47,0,,"{'food': ['Hood ambience', 'good food'], 'drink': []}"
Driven Cafe,PruThvI,"This place is best for evening snack, we had a milkshake and a cappuccino. The walls are covered with great wallpapers and the cars and bikes in the restaurant area are speechless",3,"13 Reviews , 53 Followers",4/22/2018 18:17,4,,"{'food': ['milkshake'], 'drink': ['cappuccino']}"
Driven Cafe,Pranjali Srivastava,I visit the place quite often.The ambience is amazing with decor of a garage.I have tried many items but mango frappe was the best one.You can also try apple pie.The staff is courteous.You can also rent luxury bikes and cars.,4,"23 Reviews , 53 Followers",4/22/2018 3:03,1,,"{'food': ['mango frappe'], 'drink': ['apple pie']}"
Driven Cafe,Bharath Manapragada,"Been there for the first time.
Great place to hangout.
The ambience was good. The pizza we ordered was not that good . But the sandwich was great.
Try mushroom sandwich and chilly cheese toast.
Worth the price.
Ambience:5
Food:4
Service: You have to serve yourself 😂",4,"6 Reviews , 23 Followers",4/21/2018 22:21,0,,"{'food': ['pizza', 'sandwich'], 'drink': []}"
Driven Cafe,Akshara,"had nice coffee ...staff is very friendly..we can say nice relaxing place ... seen meny collective cars .. for drive...
most interesting part is they have nice vegetables non preservatives.",5,"16 Reviews , 2922 Followers",4/17/2018 20:22,0,,"{'food': ['coffee'], 'drink': ['coffee']}"
Driven Cafe,Sneha Das,"Friendly environment. Great staff! I like the decor, it's not much of a work but very fascinating.

Lavender tea is a must try! It's so relaxing",5,"8 Reviews , 1 Follower",4/12/2018 3:52,0,,"{'food': ['Lavender tea'], 'drink': ['Lavender tea']}"
Driven Cafe,Sowmya Reddy,The ambience is really good. I like the coffee ☕.. The best thing about driven I can get my coffee at any time on anyday. Best place to hangout..,5,"6 Reviews , 38 Followers",4/8/2018 15:32,1,,"{'food': [], 'drink': ['coffee']}"
Driven Cafe,Rishabh Wahi,"Nice and relaxed ambience, I won't mind chilling here for some time but that's it. Food is very average and the service is ok. hazelnut cold coffee is something you can try.",3,"94 Reviews , 278 Followers",3/28/2018 18:22,5,,"{'food': ['food is very average'], 'drink': ['hazelnut cold coffee']}"
Driven Cafe,Ravish Arora,It has been my default place after my rides. Great Coffee and tea options. I personally love their floral teas (Lavender and peppermint) Food is ok. Not much options either. Also you get to check out cool superbikes and supercars and you can rest one as well.,4,"8 Reviews , 41 Followers",3/25/2018 14:11,6,,"{'food': ['food is ok', 'not much options'], 'drink': ['Great Coffee and tea options', 'I personally love their floral teas (Lavender and peppermint)']}"
Driven Cafe,Mt,too sweet,3,"10 Reviews , 42 Followers",3/21/2018 15:46,0,,"{'food': ['cake'], 'drink': ['coffee']}"
Driven Cafe,Meha,"Have to give it to the Driven Cafe for the ambience and the branding and the presentation, but the quality of food was disappointing.
The Pesto pasta we ordered was not pesto, the mint mocha was not hot, and the Iced Vietnamese was too sweet to stomach.",2,1 Review,3/18/2018 21:52,0,,"{'food': ['Pasta', 'Mocha', 'Vietnamese'], 'drink': []}"
Driven Cafe,Sree Sudha,Good ambience. A place for grabbing quick bites. Service was a bit late. Heard that this place serves good coffee..I had cold coffee which was very bad surprisingly!,3,"19 Reviews , 28 Followers",3/15/2018 13:22,2,,"{'food': ['quick bites'], 'drink': ['good coffee']}"
Driven Cafe,Bharath Manoj,"Great coffee
Awesome rides ready to pick up and a great ambience

Must try around Gachibowli for all of us who work in this area

Good food too.",4.5,"38 Reviews , 17 Followers",3/1/2018 0:49,2,,"{'food': ['coffee', 'food'], 'drink': ['coffee']}"
Driven Cafe,Lakshmi P Sastry,"A very good place to hang out with friends. I go there to read a book, have amazing Chai! 

The ambience is really good and so is the music.",4,"6 Reviews , 24 Followers",2/23/2018 12:20,1,,"{'food': ['book'], 'drink': ['Chai']}"
Driven Cafe,Swathi Avasarala,"I like the theme over here, in which they used tires as chairs. The concept is very cool with all varieties of bikes.

A place to hangout and can have a very good coffee and hot chocolate. Oh my god! The hot chocolate is just yum in tummy.

They have a very good cars and bikes which will be given for rent.

It is definitely a very good hangout place with nice music and very good ambience.",4,"52 Reviews , 574 Followers",2/22/2018 13:10,2,,"{'food': [], 'drink': []}"
Faasos,Kiran Thota,"As part of tasting review, ordered masala paneer wrap, jumbo chicken wrap and sigbature rice roasted chicken, you guys rock, well balanced taste , wraps are stuffed with lots of chicken, they are juicy and soft, signature rice is well cooked, packed perfectly, served hot and quick delivered.
Check the packing you will see funny quotations in the wrap boxes, they r funny next time dont miss to read them.
Overall satisfied with the taste and service.
Will visit the store soon. All the best guys.keep going.",5,"78 Reviews , 117 Followers",5/22/2019 23:36,3,,"{'food': ['masala paneer wrap', 'jumbo chicken wrap', 'sigbature rice roasted chicken'], 'drink': []}"
Faasos,Alok Kumar,Very bad service. Waited for 1 hr 30 min but still order was not delivered. Worst experience with Faasos. No online tracking system. No to fassos ever.,1,"2 Reviews , 1 Follower",5/19/2019 15:27,0,,"{'food': ['order was not delivered'], 'drink': []}"
Faasos,MJF Ln Sarath Babu S,"What did I order?

I ordered Reshmi Chicken Kebab Wrap, Cheese Melt Chicken Wrap & Chicken Rice Feast

What was good?

Food arrived on time and was hot.
Neatly packed.
They have used reusable container for the rice and recyclable carton box(small) for the wraps
Attractive packaging.

Above all, the Taste. The products tasted real good.

I feel the cheese 🧀 on my mouth when I was having the cheese melt wrap. Chicken was tender and cooked real soft. They are boneless and hence facilitated smooth process of eating them. Wrap was cooked equally good.

Reshmi Chicken Kebab Wrap was awesome. It gave a different taste altogether.

Highlight was the rice though the wraps were equally good. Rice was cooked with real long basmati rice and the masala mix was at the right proportion. It can be had by both - children and elders. They have two differential cooked chicken on the top. Both are boneless and cooked with perfection. Only the ingredients differ.

My tummy is full, this noon :)",5,"148 Reviews , 1995 Followers",5/17/2019 14:27,1,,"{'food': ['Reshmi Chicken Kebab Wrap', 'Cheese Melt Chicken Wrap', 'Chicken Rice Feast'], 'drink': []}"
Faasos,Shyam Tiwari,Mohsin was really helpful in handling the situation & delivered food on time as promised. I really wanted to thank you guys for rectifying my error & resolved my issue in a professional way.,5,6 Reviews,5/10/2019 12:16,0,,"{'food': ['food'], 'drink': []}"
Faasos,Narendranath Reddy,"Worst experience with Faasos. They accept orders, take money and then they don't deliver food. It's happening continuously with Faasos managed restaurants. Had a similar experience with their Ovenstory pizza as well. Till now, my money of Ovenstory pizza order is not refunded. I think my money for Faasos order is also gone.",1,"2 Reviews , 2 Followers",4/29/2019 22:25,0,,"{'food': ['Ovenstory pizza'], 'drink': []}"
Faasos,Kajal Verma,The place offers amazing rolls.... If you are a foodie and eat a lot like me then trust me one roll is insufficient for you 🤣 order TWO! The Mac cheese rolls are scumptious,5,"7 Reviews , 51 Followers",4/29/2019 10:53,0,,"{'food': ['Mac cheese rolls'], 'drink': []}"
Faasos,Yogita Sharma,"I ordered from faasos last night but I didn't receive my order,when I tried to connect with the restaurant they didn't respond.I tried to connecting with them many times but no one responds and after 2 hrs it shows that order is delivered.even on next day when zomato tried to call them, they didn't respond.its a wosrt service I have ever get.",1,"1 Review , 3 Followers",4/18/2019 13:45,0,,"{'food': ['faasos'], 'drink': []}"
Faasos,Foodie Emperor,"I have been Constantly Ordering Faasos

I have become the huge fan of Cheese Melt Chicken wrap

Ordered Cheese Melt chicken Wrap with Customization of Lacha Paratha & Peri peri cheese

Cost Around Rs 200

Damm the taste is top to the world

MUST RECOMMENDED",5,"20 Reviews , 4 Followers",4/14/2019 17:30,2,,
Faasos,Sumit,"The Egg wrap here is made by unprofessionals. The egg wrap's omlette was burnt as hell and I guess they were too lazy to replace it knowing it was burnt and sent me those wraps
. order (id: 1178102975) on Zomato Order.",1,1 Review,4/11/2019 12:41,1,,"{'food': ['Egg wrap'], 'drink': []}"
Faasos,Pradeepti Sharma,"Ordered the paneer wraps, one with the cheese, and other with a tangy masala. N a paneer rice bowl too. Paneer treat to myself. The wraps were perfectly made, with the covering prepared well, and the stuffing was mixed well with the right amount of sauces and cheese, giving a juiciness to the wrap. The rice bowl was equally yummy. With rice being cooked well, fragrant with exotic herbs and spices giving a deep ochre n shades of olive green look to the dish. Overall a nice place to order from n worth the money. Recommended 😊",5,"72 Reviews , 1932 Followers",3/14/2019 21:22,0,,"{'food': ['paneer wraps', 'paneer rice bowl'], 'drink': []}"
Faasos,Pravin Fengade,Very bad experience...i got incorrect order delivered...I ordered for smoked butter chicken combo under royal indian mean which costs ₹290...but i was delivered smoked butter chicken combo under quick meal which costs ₹190...and it was missing paratha and gulab jamun...when I called restaurant they didn’t agree to send me correct order and asked me to contact zomato which I couldn’t get in touch with..finally ended up paying more for what i was delivered... and wouldn’t recommend to anyone based on my experience.,1,"3 Reviews , 1 Follower",3/3/2019 14:21,1,,"{'food': ['smoked butter chicken combo', 'paratha', 'gulab jamun'], 'drink': []}"
Faasos,Aniket Kanwale,food was good but as compared to price quantity was very less,5,3 Reviews,3/3/2019 1:04,0,,"{'food': ['food was good'], 'drink': []}"
Faasos,उर्वी वशिष्ठ,"Wraps here are really yummy! As cheap as chole wrap and as expensive as paneer wrap! Be it any level of the wraps, it is yummy!
Moving on to rice, rice feasts are good to go and is very filling too!",4,"3 Reviews , 3 Followers",2/13/2019 13:11,1,,"{'food': ['wraps', 'rice'], 'drink': []}"
Faasos,Preethikumaresan Kumaran,I have ordered mutton rice in faasos the taste quantity quality was super worse.. totally disappointed... 160rs waste and waiting time was also waste,1,1 Review,1/27/2019 19:36,0,,"{'food': ['mutton rice'], 'drink': []}"
Faasos,Raagini Biswas,"Food was delivered after 1.5 hours, when the app said it would take half that time. Faasos does not provide a number of a delivery person. The number given is a common number that is always busy. Hence the order was not possible to track.

Received an SMS soon after placing the order with a tracking link from Faasos which did not work.",1,"3 Reviews , 34 Followers",1/25/2019 15:19,0,,"{'food': ['Food was delivered after 1.5 hours, when the app said it would take half that time.'], 'drink': []}"
Faasos,Hari Priya Bandi,packing is just amazing,5,2 Reviews,1/24/2019 15:10,0,,"{'food': ['packing'], 'drink': []}"
Faasos,Abhishek Das,"I'm usually order Mutton Over Load wrap & but this time it was he'll. The wrap wasn't looking like the usual. It smells wrong. Did something went wrong?!?!???
I don't think I'm eating Mutton. 🤔 this is something else entirely.",1,"9 Reviews , 2 Followers",1/19/2019 16:10,0,,"{'food': ['Mutton Over Load wrap'], 'drink': []}"
Faasos,Hi Bye,"yummmy food ,faasos never dissapointed me,rates also very economical..just love it 😍😍 ..keep going faasos..thanks for the yumilicious food and yess the box captions are amazing and packaging to is just awesome ..loved it .:) :)",5,"3 Reviews , 2 Followers",12/29/2018 12:25,0,,"{'food': ['yummmy food', 'faasos'], 'drink': []}"
Faasos,Raj Rohit,"Faasos never fails to impress.

Ordered their chicken cheese melt roll. The chicken and the quality of the roll is just top class

+ the masala was an added delight too.",5,"124 Reviews , 372 Followers",12/21/2018 17:20,0,,"{'food': ['chicken', 'roll'], 'drink': []}"
Faasos,Naman Nishesh,The melt wrap hardly had cheese even though I ordered extra cheese.,1,"6 Reviews , 7 Followers",12/15/2018 12:07,0,,"{'food': ['melt wrap'], 'drink': []}"
Faasos,Aman Agarwal,"Wraps, pancakes, sides, order whatever from here and you won't be disappointed. My personal favorite is fiery cheesy panner roll. The extra masala they provide is an icing on the cake. Overall experience is good.",5,"35 Reviews , 27 Followers",12/9/2018 18:34,1,,"{'food': ['Wraps', 'pancakes', 'sides'], 'drink': []}"
Faasos,Kasi Raj,I had absolutely no hesitation to say that..this is the worst biryani in d whole universe...i bet u will throw it in dustbin immediately after 1 spoon.....faasos sucks!,1,1 Review,11/16/2018 0:32,0,,"{'food': ['biryani'], 'drink': []}"
Faasos,Agrima Srivastava,"Was super excited to try out the special Navratri Thali from Faasos. It had Kuttu Aata parathas, Paneer curry, Sabudana vada, and Sabudana Kheer. Honestly, my excitement dropped down after tasting the parathas, as they were too greasy. Paneer curry, on the other hand, was the savior, Vadas were fine and Kheer was up to the mark. What I liked about the thali was that it had more than enough food for 1 person. I am going with 2 stars as the parathas are the base of this thali and I couldn't finish even half of it. I have very high expectations from Fassos and am sure they will take this feedback well and improve on the quality of parathas.",2,"81 Reviews , 196 Followers",11/15/2018 18:25,0,,"{'food': ['Kuttu Aata parathas', 'Paneer curry', 'Sabudana vada', 'Sabudana Kheer'], 'drink': []}"
Faasos,Aanchal Khemka,"Navratri Special Thali was the one I tried this Navratri as a food tasting session.I just loved the food and the thali.

It's a must try as it was absolutely filling as well as delicious.

It was a satvik thali which means without onion and garlic used.Still had two stuff parathas made of kuttu ka aata, paneer ki sabzi, sabudana kheer.

Packing was perfect!

Highly Recommended",4,"189 Reviews , 2321 Followers",11/12/2018 15:25,0,,"{'food': ['parathas', 'paneer ki sabzi', 'sabudana kheer'], 'drink': []}"
Faasos,Sanz,"package is good. thats the only thing which is good. tried jumbo chicken wrapper nd chicken overload jumbo wrap.
poor quality and taste.",1,"5 Reviews , 2 Followers",11/7/2018 23:47,0,,"{'food': ['jumbo chicken wrapper', 'chicken overload', 'jumbo wrap'], 'drink': []}"
Faasos,Raghava Krishna,I have tried Chessy chicken delight and Jumbo CHicken wrap with some great flavourings into it and it was well packed with a ketctup and teeka chaska,5,"25 Reviews , 6 Followers",11/7/2018 13:05,0,,"{'food': ['Cheesy chicken delight', 'Jumbo CHicken wrap'], 'drink': ['ketctup', 'teeka chaska']}"
Faasos,Vinay Singhania,"Fasoos Navratri review program.
Ordered the Singhada aloo paratha and panner makhanwala meal.
The packaging and the presentation was very nicely done.
The singhada aloo parathas were nicely baked and tasted really good. The spices in the parathas were less but that's according to my preference.
The paneer makhanwala was creamy and tasty. It was neither too spicy nor too sweet, it had just the right taste and aroma.
Overall a good experience, definitely recommended.",4,"73 Reviews , 322 Followers",11/6/2018 20:40,0,,"{'food': ['Singhada aloo paratha', 'Paneer makhanwala'], 'drink': []}"
Faasos,Namit Agarwal,"I just love the wraps of Faasos and can have them at any time .I mainly like their three wraps - Cheesy corn salsa wrap,Mac n Cheese wrap and Veg pizza wrap. All of them are amazing but Pizza wrap is just mind blowing.They have multiple options for the bread of the wrap as well - multigrain, crispy bake,lacha Parantha etc.

Pizza wrap has cheese, vegetables and other sauces in it. It gives you a feel of both wrap and pizza and tastes amazing.The size is big and is good enough as a meal for one person

I have also tried chola kulcha and Veg thali from Faasos but in Bangalore,they were also very good.

I have tried almost all of their major wraps :

Pizza Wrap (5/5)
Mac n Cheese wrap (4.5/5)
Cheesy corn Salsa(4/5)
Aloo wrap (3.5/5)
Jumbo Veg wrap(3/5)
Egg wrap (3.5/5)
Paneer Tikka Wrap (3.5/5)
Rajma Chole is also very good.

Desserts:
I recently tried their Red Velvet cheese cake and it was also mind blowing and definitely worth a try!!It was one of the best red velvet cheese cake,I have ever had
Red velvet (5/5)
Raspberry Cheesecake shot(4.5/5)
Chocolate Fantasy (4/5)

Must try their wraps and especially Pizza wrap!!!",5,"179 Reviews , 1877 Followers",11/4/2018 11:43,12,,"{'food': ['Pizza wrap', 'Mac n Cheese wrap', 'Cheesy corn salsa wrap', 'Aloo wrap', 'Jumbo Veg wrap', 'Egg wrap', 'Paneer Tikka Wrap', 'Rajma Chole'], 'drink': []}"
Faasos,Sandhya Menon,"I got a chance to review food from here. I ordered Jumbo chicken wrap & Jumbo veg wrap.
Food arrived on time & was packed neatly.
Food: Jumbo veg wrap was just perfectly juicy and light crisp from out.
Jumbo chicken wrap too followed the same.
Very happy with the food. Definitely a try",5,"55 Reviews , 2381 Followers",11/2/2018 20:46,0,,"{'food': ['Jumbo veg wrap', 'Jumbo chicken wrap'], 'drink': []}"
Faasos,Shashank Vyas,"Zomato has asked me to be polite.. ok.. Faasos is delightfully bad in its food quality... When you order a pizza roll.. they not only bake it like a pizza but they take it to the next level of master culinary skills... They roast it till the end.. just like how your mumma used to make it.. and best part comes next.. Faasos excels in giving surprises and since they handle their own delivery you can never know when your food is going to arrive... It's too much fun to see that status - ""Food is being prepared"" , ""Your food is in the kitchen"".. and they won't update it because the delivery person can come any moment to your doorstep and say Surprise.. In my case they were quick enough to deliver it in only 1 hour 30 minutes... So fast da.. then I remembered food should have been delivered only in 40 minutes... I asked delivery person why so much late da.. He said sir we were cooking your roll property that's why it took time.. open it and try it sir.. you would have never seen such roll.. And he was right.. I never saw the roll only charcoal.. ( attached picture for reference )",1,"2 Reviews , 21 Followers",11/2/2018 2:13,1,,"{'food': ['pizza roll', 'charcoal'], 'drink': []}"
Faasos,Ratnadeepa Bandopadhyay,I ordered food and they accepted it. Even after 2 hours the food was not delivered. I tried to contact them many times but no one answered. Worst behaviour ever. I had to finally cancel the order by calling the zomato customer care.,1,"9 Reviews , 34 Followers",11/1/2018 22:50,0,,"{'food': ['food'], 'drink': []}"
