review_id,user_id,business_id,stars,useful,funny,cool,text,date,ner_results
sacocAqwOQNtIWBJV-X46A,VFRIv3-_Og34wZyy-LigQQ,I5KZm-NnxYeEQsmp6nK5_w,2,2,0,0,"With Mole on my mind we decided to try Las Cazuelas. Believe it or not it's tough to find a Mexican BYOB with Mole dishes on their menu in this city... From the get go I knew service was going to be an issue. The hostess couldn't accommodate us sitting upstairs because she claimed she had to fill the first floor first so she squished us into the only remaining table downstairs. For the entire meal I felt like everyone in the restaurant could hear my conversation and I could clearly hear theirs making it a very uncomfortable dining experience. 
After being seated we waited over 15 minutes for someone to come get our drink orders which was completely unacceptable as there were 2 servers and only 20 people in the tiny restaurant. 
Anyways, you now understand that the service was terrible, on to the food! We started with the Chicken Quesadillas and Las Tres Marias which were corn patties topped with pork, chicken, black beans, and chipotle. The apps were yummy but I would pass on the Quesadillas as they were nothing special. For dinner we had the Chicken Mole which was only slightly above average.  The portion was average and it was $17.50 for the entree which was a bit high considering I finished my meal and was still slightly hungry. 
I would return only to try other items and if I happened to be in the neighborhood. There are other mexican restaurants in the city that are much better and as affordable.",2012-11-15 16:48:54,"{'food': ['Chicken Quesadillas', 'Las Tres Marias', 'Chicken Mole'], 'drink': []}"
fIKwReffAuqxLYokJuwSsg,84HvpQDxcHWmbMDfs8IEYw,_hsEJv3KtH5Vwp2b14wCAQ,4,4,1,4,"Yes, this is a hotel restaurant bar.  BUT it's trying to cater to the neighborhood as well.  Living in Chinatown, there are not that many local options for a low key place to get your drink on.   

I first went in here because I locked myself out of my apartment 1 block away.  I was blown away by the fact that everyone at the bar was from the neighborhood, they weren't scary Hotel Barflies either.  Young professional types getting a couple drinks and shooting the shit before moving on for the night.   Then I sat in here with the kitchen staff watching Frosty the Snowman.  That's just awesome.  

The drinks are very reasonably priced for Center City, but it is a corporate place.  Don't expect a lot of buy backs and heavy pours.",2008-12-20 12:51:33,"{'food': [], 'drink': ['Frosty the Snowman']}"
bdACs1Xe0FZJiDszUDgoGA,tGEkFShSLzO5BACDDBPb2Q,3lBooCffgkW7tVSG5kILBA,2,0,0,0,"My wife and I were very excited to try this highly recommended BYO. We arrived for our reservation on time and were seated within about 30 minutes. We didn't mind the wait, but like many BYOs, there is no real waiting area. We were able to sit upstairs in an empty dining room (which felt a bit strange) but was not a huge deal.

Once our table was ready, we were shocked to see how small this place actually is. You are literally rubbing elbows, backs, heads and everything else with your fellow patrons. In my opinion, it was a major interference with our overall dining experience. Our table was up against a wall on one side and then another two top was sat to our other side. Too bad for you if you had to use the restroom..... that feat would require asking two to three different tables to stop eating, stand up, and move so you could squeeze through... and then repeat the process when you get back to your seat. I literally felt like an adult trapped inside the dining room of a child's doll house.

I will say that the service was friendly and for the most part very attentive. Unfortunately, the food was average at best. I had the Osso Bucco which looked very impressive and was presented very well, but ultimately let me down. I understand that restaurants often pre-cook menu items that are braised, but you shouldn't be able to tell that it was just plucked from the fridge. The plate was luke warm to chilly and as I worked my way through the pork shank, the meet on the bone was outright cold. Cold pork fat isn't that appetizing. My wife had the Parapadella Porcini which was packed with flavor but was also cold. Both dishes were refrigerator cold not ""sitting out to long "" cold. This was a big disappointment because the dishes did have great potential. If we decide to try it again, it will definitely be during the week on a less crowded, slower night.",2012-12-11 03:51:00,"{'food': ['Osso Bucco', 'Parapadella Porcini'], 'drink': []}"
gntQmPNDZiIrptJ1P_oNFA,V7JZ5xGj7uZT5XFbjYLXfw,4_W5pstoN1166TGjjPOrMg,2,3,0,1,"Great food, great beer, completely awful service.

I've had decent experiences here in the past. The food is good and on par with the rest of the Philly gastropub scene. On a cold night in winter, the french onion soup is downright therapeutic. The beer selection is large and they always have multiple great brews on tap.

Why am I giving this place two stars? Its staff. My girl and I came early on a Saturday evening, placed an order at the bar, and were straight-up ignored. Twenty minutes later, I saw our bartender at the end of the bar obliviously sipping on a drink. Useless. Maybe the management sent all of their first stringers up to help Bufad get up and running. I'll be steering clear until they get their house in order.",2013-04-14 15:40:11,"{'food': ['French onion soup'], 'drink': ['beer']}"
2gO3ABEKSe3r6fIneplKOA,t5XrPmDxlnemu4s3cei6ag,wUnLSg_GKfEIQ5CQQ770_g,5,1,0,1,This is the best restaurant in town. Their Italian food is awesome. My friend went for the steak and said it was the best he ever tasted. The service was just as good. Yes it's pricey but it's well worth it. We will be back here for sure in the near future. One of the best ideas we had in a long time.,2018-05-21 02:42:09,"{'food': ['Italian food', 'steak'], 'drink': []}"
po3j2dvicof_7pKFWr8VHw,K8V3yN_I4PNNXIKeUBAt4A,EtKSTHV5Qx_Q7Aur9o4kQQ,4,0,0,0,Great burger and great service.  Be careful though.... the burger is kind of the food equivalent of crack.,2010-09-07 19:03:39,"{'food': ['burger'], 'drink': []}"
GT5FGJ80SPfZYj3pi3nWgg,ODDHnvkJ_VM6mz2xwuhWHg,Dv6RfXLYe1atjgz3Xf4GGw,5,0,0,0,Food was bomb! All 3 dishes I tried were good. 2 non-vegan's loved them all too.,2013-07-14 00:25:19,"{'food': ['dish1', 'dish2', 'dish3'], 'drink': []}"
SGAXca1VTvmhe6AAAbMQ6Q,N9pCoG2kpJtWrLYoIv-cTA,O6hY9yenifuRXrpc4TfgsQ,1,7,4,2,"I've been here twice. It's definitely a welcome addition to the Northeast and BYOB is always a plus. The decor is nice and the staff is friendly. My issue is the portion size for the price point. 

1 - My first time I ordered the scallops and for $18 you get 4 scallops and about two or three tablespoons of lentils. Nothing else on the plate. I was definitely still very hungry so I sampled what was leftover from appetizers, my friends general tso wings, which were okay. Tasty, but nothing special. The accompaniments to the wings were just blah. I ended up leaving this night very hungry. 

2 - I decided there were enough positives to give it one more try. My second visit I ordered the sweet potato gnocci $16 and my friend ordered the duck sandwich. I wish I would have counted, however there may have been 8-12 gnocci on my plate max. It looked like less of a portion than an appetizer. I'm hard pressed to think of a time that I've ordered gnocci and not needed a to-go box. I knew immediately I was still going to be hungry. The flavor, however, was very good.

My friend was equally unsatisfied with his duck sandwich. It was about  half a sandwich size and did not come with anything on the side. For dinner you would expect a sandwich to have something, anything on the side. I felt bad for him and offered some of my gnocci, which we joked about. We both left still hungry and after paying we decided that we had to hit another spot on the way home in order to get some satisfying food. I know this sounds silly, but we are fit people used to dining in all types of establishments, most often downtown and due to the portion sizes and price point at the Blue Duck we will not be back for a third time. 

If I hear they've made improvements in those two areas I would consider returning because they are on to something with their flavor pairings.",2014-11-30 16:53:15,"{'food': ['scallops', 'sweet potato gnocci'], 'drink': []}"
R3NbhFtdmLnCVrloWLKtYg,8EMU7d4pCkdqUnvlIW40CA,LnZvGYbqozanOSevcftnrw,3,6,2,4,"Hip City Veg is on the move.  From its original Rittenhouse Square location, it opened up in University City and now has plans for South Broad Street and Washington D.C.  This is a successful fast food vegan establishment, yet it is not my favorite,  In an increasingly crowded market of health fast-food dining options in Philadelphia, Hip City Veg does some things well and other things not so well.  I do like their Udon noodle salad but in my mind there is much too much arugula and too little of the other tasty ingredients be they peanuts, chicken substitute, daikon, scallions or even udon itself. for the price. It would more accurately be named an arugula salad.  There are absolutely no condiments out for people to use.  Aww c'mon guys!  I did ask and received a little Sriracha sauce to spice it up a bit.  The sweet potato fries are good but again the portion is small in relation to the price in my opinion. There is free water which is nice to have.  At the University City location the staff are friendly and it's kept clean.",2016-12-04 16:41:15,"{'food': ['Udon noodle salad'], 'drink': []}"
KcZvbxjQsrBssHcqp0fKgA,EeLY9IIay06tFjBBxCXXmg,HTqXI5S2XcSlh_ylx9sE6g,5,2,0,1,"This was a great place to rekindle my love of Italian bakeries during a recent work-related trip. Excellent cannoli...filled upon order, with a filling that contained the perfect blend of chocolate chips/candied fruit. So often you find cannoli that is not flavorful...even the shell was a flavorful treat. I'm usually not a huge lobstertail fan...I find them almost always bland. The filling on theirs has an excellent flavor...again a good ratio of filling to candied fruit.  Very good Italian style baba au rhum...generously sauced/syruped with a flavorful, rummy syrup. Love it!",2015-07-29 17:43:16,"{'food': ['cannoli', 'lobster tail', 'baba au rhum'], 'drink': []}"
uli86JS5w2pTSsBioNLNvA,26xBgJZdonEeWATSPf9plw,eaDZlSuVS0EY67Ke6pRP6Q,5,0,0,0,"Went there twice.  Roti Canai was pretty good. Tried their pad thai , it was good enough. I had a curry based dish last time and it was alright as well. Big proportion, shared it with my friend. Good options for vegeterian people.",2014-12-01 00:43:52,"{'food': ['Roti Canai', 'pad thai', 'curry based dish'], 'drink': []}"
qQovPdY7kkX4c9O5ow_wTg,2_R0yhZocqvU4thblSfCIQ,hUX1yAimviBIhb21D_KtcQ,1,0,0,0,This place is terrible. The manager was yelling at its employees in the middle of the  establishment. The food was not fresh at all. The rice tasted like it was leftover from last night. Chicken was disgusting and dry. The breakfast buffet looked more pathetic than a complementary hotel breakfast. I will never eat here again and suggest you don't make the same poor choice as me.,2014-11-02 17:29:27,"{'food': ['rice', 'chicken'], 'drink': []}"
I16G0JiJEwqra93zGmJ8cw,Fx8YWMRl6cawpMY_t5mnzA,Bw0cpnfI-Y9QmjWzqS-oFg,4,1,0,0,"I have been here three times. My first visit, shortly after the restaurant opened, was mediocre. I decided that I did not need to go back unless there was a good reason. Well it turns out I had a reason as my friend wanted to take me here, so I agreed to give it another go. I brought a bunch of wine, you know, in case the food was still not so great. However, I was pleasantly surprised by the quality and the deliciousness of the rolls. I have since been back a third time and I enjoyed my meal again. As a note: I would not order the seaweed salad again as it is seaweed leaves. I have never ordered an entrée or desert here, but I never do at sushi restaurants. All in all, the atmosphere is nice, the service is good and I would go back.",2011-06-11 15:19:07,"{'food': ['rolls'], 'drink': ['wine']}"
bnb-MRLTKGnbp6TMygoHag,pk0K_iCwNxRmUujtirs1WQ,A0F-h3xJm_6gHDKcDQwSrQ,4,1,0,1,"After many, many visits to Capo these past three and a half years, I'm finally ready to write a review. 

It's on the pricier side, but I'm always completely satisfied when I leave. The flavors are always crazy and unique; alongside the standard flavors, I've seen whiskey sour, cactus pear, concord grape, bourbon butterscotch, avocado, and thai coconut milk. They have a great rotation, so even if you find yourself in need of some gelato despite having just visited a few days ago ( ...or yesterday), there are always new flavors to try. 

The staff is great with samples and are always cheerful. In terms of general ambiance, it can get noisy sometimes with recruiting or university events, but it's usually manageable enough that I can bring friends who are visiting Philadelphia here to catch up. Some reviewers have complained about the service, but I've never had subpar service, nor have I ever been chased off the premises after finishing my gelato.

In terms of the other menu items, I'm usually too distracted thinking about which gelato flavors I want to try to consider ordering something else. I've enjoyed a latte or two from Capo, but unless it's late in the evening, I usually prefer to grab one from Hubbub.",2014-10-12 04:45:39,"{'food': ['gelato'], 'drink': ['latte']}"
_yffn7fF4-a3AM5w-eEOWQ,Is-Q2Y2xy6lpyN2UBBTCUw,Q-prSTdggNlxAEFV88BZOw,5,2,1,0,"i don't like to drink my money, i prefer to eat it. Last Thursday night I was on 17th street and in the mood for vegetarian. Tria was a great choice. 

I started with a salad of grilled asparagus, artichoke, white beans, tomato-onion relish and pine nuts and then had the stuffed fig appetizer for dessert. To drink? Water, no ice.",2013-02-24 20:14:18,"{'food': ['salad of grilled asparagus', 'artichoke', 'white beans', 'tomato-onion relish', 'pine nuts'], 'drink': ['water']}"
HLvimVdseGgkrF_zlfMaZQ,axh9xP0o47yr9LPT3AEtTA,d_tRshM-w6S4QxE4VVi8tQ,4,2,0,1,"I was in Philadelphia for the Love Run Philly this past weekend and since Jones seemed to have a diverse, runner-friendly menu, my friend and I decided to make this our pre-race dinner.  Overall, a nice experience!

We knew we'd be getting the man n cheese (helloooo carb loading!) and it did not disappoint!  Bubbly, cheesy, and hearty, this mac was on POINT!  My friend and I liked the build your own salad option and decided go that route.  The salads we 'built' were enormous and delicious--exactly what we were hoping for!  We didn't get any drinks but the cocktails looked wonderful as well.

The vibe is really cool, lots of neat decor and overall very upbeat.  I'm docking a star because Jones seemed to have lost the reservations I'd made via OpenTable more than a month ago--very strange since it was still showing 'booked' in my OpenTable app.  It turned out to be fine and the hostess found us a seat, but it seemed like it was a problem despite my showing them the reservation.  I'd probably go back to Jones next time I'm visiting Philly--I hear they have a great brunch!",2016-04-12 19:52:23,"{'food': ['mac and cheese', 'build your own salad'], 'drink': []}"
wWiOBWLU6zpR6QAlHYQpjQ,0ur15Tln5PK4lVQ3ph5Qkw,RI33oswGDkIsc0fuQ8GzjA,4,0,0,0,"I've walked or driven by this place countless times, but finally tried it today when we picked up steaks on our walk down to the Phillies game.  We were really impressed by how delicious our traditional, Italian, and chicken steaks were (we got three different kinds). Definitely significantly better than all of the tourist steak places-- snd probation the best cheesesteak I've had in the 15 years I've lived here. I agree that the service is slower than your typical steak place, but it's because they're making each sandwich individually to order.  The care they take in preparation translates into a high quality, totally worth the calorie spurge product. Can't wait to go back!",2016-10-02 04:21:08,"{'food': ['steaks', 'cheesesteak'], 'drink': []}"
5IHcnYJlkyAQTTXZ6jCUgA,6VcosJQagjNAlgbBvPcwYQ,MbKhuO-4uYPc0NRZDRWoew,4,0,0,0,"Great deal for how delicious the burritos are. 

If you have the option to get chorizo, do it! It was delicious and perfectly spicy. As for the rest, service is fairly quick and the place is clean. Downsides I spotted: a few things listed on their menu were out of stock. Eh, minor infraction.",2010-05-23 23:47:01,"{'food': ['burritos'], 'drink': []}"
E-opmSQnCIVyX6xB9q4IeA,NFP5l4xbEQFIxYVWOktxWA,vCHNWdW-ys-nWUx3Cpvk8Q,5,0,0,0,"I went to the Swiss Haus on Thursday and had, for the first time, a cronut. I've been avoiding sampling this pastry for a long time, mainly because of the calories. I finally gave in, and I'm glad I did! It was well worth five dollars. It was light, and yet it didn't leave me hungry the way other pastries often do. I felt like I was nourished with a meal(and it's a good thing, because that was my breakfast and lunch for the day combined).
I've always been a fan of this bakery. The ladies at the counter always greet me with a smile, and are very helpful. I've purchased cookies in the past to take to parties and gatherings, and they're always a big hit. Swiss Haus is a Philly landmark, and one of the best places to buy sumptuous pastries in Center City. Highly recommended.",2013-09-07 23:28:27,"{'food': ['cronut'], 'drink': []}"
LrLRpsKiQ5feao9loPwWOw,iP9NCp6If6YnlOc2QeDqeQ,lRbHFOIFuusN2WOR_ypQ_A,2,0,0,0,"Bit disappointed with the sandwiches here which were pretty expensive and sadly just didn't taste too great. The chicken sandwich came on dry bread that was falling apart and the honey maple turkey sounded like it had an interesting combination of ingredients but in the end seemed to just have a slightly bitter tasty gloop. I've made them sound pretty bad which is not exactly the case, but I wouldn't order either again.

As others have said, service wasn't exactly effusive but I was getting take out so it didn't really affect me. The wait was fairly long but not unreasonable. I did kind of funny to read all the bad reviews and stare at the servers trying to work out who was the offender - most of them seemed quite nice!",2012-09-14 10:25:44,"{'food': ['sandwiches', 'chicken sandwich', 'honey maple turkey'], 'drink': []}"
x5VacwFS3wkA2TCuy41VAg,XS7-zQI0ZUb9T-ZNgFzSTA,vCHNWdW-ys-nWUx3Cpvk8Q,4,0,0,0,"Carrot cake slice was yummy -- full of good stuff and moist.

Eclair -- didn't stand a chance once my husband got it.

Hazelnut cake -- got it for my for her 70th birthday and she and the family were thrilled.  Their mom had gotten the same cake for years (under previous owners).  The pressure was on, and Swiss Haus delivered.",2017-05-01 23:47:41,"{'food': ['Carrot cake slice', 'Hazelnut cake'], 'drink': []}"
4xYODgfvn1jCW3KQ5FtKTA,VLFFhie-pOovLi57wIQAYQ,V6Om7YZhlRQRU7WfuxHq8Q,1,0,0,0,I was expecting more from the fried mac and cheese balls after the Thrillist article said it was the best thing in the market...it was just fine. The noodles inside were standard elbow and the cheese was atomic yellow. The breading was too heavy and hard and the marinara sauce was too thin. The coffee tasted good but was cold.,2017-03-05 23:58:24,"{'food': ['fried mac and cheese balls'], 'drink': ['coffee']}"
lJGlcLiR7emMZ7dijUOhiw,_R-xEEF119h1faZ2xfSpjA,-OIUunijjcq_ZzyyQhPPFQ,3,0,0,0,Good solid neighborhood place. Dolmades are average to good. Watch out for the French fries they put in some sandwiches.,2012-05-05 21:20:30,"{'food': ['dolmades'], 'drink': []}"
Yfqr-p3hxJhbbJKJ6dss3w,viWkK6--5ChiN3hlZ8XqTg,KgozvZ1UFfXuJToqe8CfQg,5,2,1,1,"Got to give the bump to my favorite local Chinese spot. It doesn't get more friendly than the staff here and the food is equally as consistent and reasonably priced. Call ahead because larger orders can take a while but its worth every minute.

I have eaten here countless times so I'll just highlight the staples that I consistent come back to. The hot and sour soup is fantastic and comes with crunchy noodles. The amount of heat varies so if you get the end of the pot, consider this your warning. The chow fun house special noodles are also a must try. They are on the greasy side but go perfect with the chicken beef and shrimp combo. The steamed dumplings are also very tasty with the perfect amount of dough and filling (the veggie ones I do not recommend though). Oh, and make sure to get an egg roll no matter what as a side.

As previously yelped the only thing I am not a fan of is the fried rice so I stay away from the combo meals. Nonetheless the prices are reasonable enough you can still feast with the a la carte items without breaking the bank. 

There is some new chinese place a couple doors down but don't expect to see me cheating on Fortune anytime soon with them!",2012-12-08 23:16:55,"{'food': ['hot and sour soup', 'chow fun house special noodles', 'steamed dumplings', 'egg roll'], 'drink': []}"
_E9yxuLYIXbY8Ml67FmvFw,EjDvPkiuCU4On7TuodW9WA,DXYhpEv17mWqSqFjau7vhg,5,3,0,0,"Went to Eatalia for dinner last night.  Arrived around 5:30 and was seated promptly and politely.  From the hot seeded bread, delicious antipasto, stuffed chicken breast, garlic mash, vegetables and unbelievalbe tiramisu and cream puffs, it was a wonderful experience.  I too enjoyed Bistro Juliani and I am pleased to have again in the neighborhood a delicious establishment to frequent.",2012-12-07 18:41:40,"{'food': ['hot seeded bread', 'delicious antipasto', 'stuffed chicken breast', 'garlic mash', 'vegetables', 'unbelievalbe tiramisu', 'cream puffs'], 'drink': []}"
CH3EZTiBMy7WxAVLGECWSA,hDWrkldLnbMNBqm5y3aZRA,Q-prSTdggNlxAEFV88BZOw,5,2,0,1,"Heerlijke wijn, kaas en andere snacks. 
Een late-night dinner gehad. Omdat het zo goed beviel, gingen we de volgende dag terug voor een drankje en hapje tijdens happy-hour (er stonden zoveel lekkere dingen op de kaart!!) 
Wederom te gek. Omdat dezelfde bediening het Waardeerde dat we terug kwamen, kregen we een appetizer van het huis!",2014-05-09 01:18:00,"{'food': ['Heerlijke wijn', 'kaas', 'andere snacks'], 'drink': ['drinkje', 'hapje', 'lekkere dingen']}"
toisg2_pR1YQW6G6wN-gNg,A7ppV7wf8tgYprYuTciRJw,B-DiQpcSTJ7oMMnwzbAGTQ,4,0,0,0,"My friend and I were feeling spontaneous and wanted to take a trip to Philly. We were looking for things to do and came across the idea of checking out some food trucks since we don't have access to any where we are. We checked some out on Yelp but found that many closed at 3 or 4 and it was already 4:30 by the time we were about to leave. I found Cucina Zapata, loved the idea of Thai-Mexican fusion, saw the reviews and decided that the hour long drive was worth it to try this place. So we had high hopes..

We got to Philly, parked at some obscure bank, and while waiting for our food, sneaked around Drexel. oops! The guy taking our order was SO nice. He asked us if we'd been there before and when we said no we were from Jersey and we came all the way to try this place, his face lightened up and he welcomed us all so friendly and warmly. 

For the actual food.. I got the chicken satay tacos and my friend got the captain crunch tilapia burrito. I gave the review 4 stars because the food wasn't anything MINDBLOWING like another Yelp reviewer noted. However, I did love the concept of the food and think it was well executed. I personally liked the Tilapia burrito better than the chicken satay tacos -i just think it had more flavor and texture. 

What I liked about the food: the flavor of the chicken satay in the tacos -the very bold, curry flavor; the crunchy texture and all the spiciness from the sriracha in the tilapia burrito (i think he may have forgotten to put sriracha in the chicken tacos). What I think could have been done better with the food: the tacos and the burrito, aside from the fusion between thai and mexican flavors, seemed like any other tacos/burritos with red cabbage, avocado, lettuce, although the house sauce and sriracha did kick it up a notch. maybe they could have added some complementary spices, pickled the veggies, or something to give it that wow factor. That having been said...

Overall experience:
Friendliness of staff: 5 stars
Concept of food: 5 stars
Taste: 4
Was the hour long drive worth it: Yes
Would I come back again: Maybe if I were in the area, but I'm not so sure I would drive another hour to come back here. I would come back to try other food trucks tho.",2014-11-13 16:43:52,"{'food': ['chicken satay tacos', 'captain crunch tilapia burrito'], 'drink': []}"
614Mt1dw6AwyZ0xKu8nvOw,DX2EB2vxOG9lDrpe9uxrIA,Z5po0aTuzKKblek5y6Sp8Q,4,0,0,0,"I have to say this is one of my favorite burger joints in Philly. I have watched this place grow so much from the day of it's conception. The menu has expanded over time, which is great and the burgers have gotten larger since they opened at first they were almost sliders lol. There are two reasons why this place did not get 5 stars from me: #1 they do not handle crowds well at ALL! BE WARNED if you think you are going to enter after the clubs let out prepare to WAIT and wait you will. Also since they have a large crowd of mostly drunken patrons at that time ordering your burger temp is in vein it will come well done. #2 I am a snob when it come to my burger being served to me just how I like it which is MEDIUM!! So if you  get your burger to go  YOU BETTER CHECK IT BEFORE YOU LEAVE or when you get home it well be well done cause some of the cooks don't give a flying F*%K if they see it's to go.

TIP: Go for the Humpty Burger!!",2013-03-19 15:10:12,"{'food': ['burger'], 'drink': []}"
