review_id,user_id,business_id,stars,useful,funny,cool,text,date,ner_results
WgQIXF7ZhElfpZaCTnEU9A,MoHYT7tK5kX9ZzhistA9cw,BWITd9JUXP3gSi1z3Y-z8g,5,0,0,0,"Friendly staff (do pick up too!)...delicious food from every part of the menu, never disappointed.  A little pricey,  but appropriate for the quality cuisine. Must try!",2016-04-25 19:37:21,"{'food': ['delicious food from every part of the menu', 'never disappointed'], 'drink': []}"
G-X-oQONCEc0fgYi5pEVZw,7ktyPHE-NGnWxarOqjIQiQ,GUNpbcLvHZLE3NpOifjNUQ,3,0,0,2,"Slate is the manifestation of a true three-star establishment--neither memorably good nor egregiously bad. We visited on a Friday night around 10:00pm and the place was fairly deserted; I would guess that there were 2 or 3 other tables occupied with a couple of people at the bar. We were looking for a little food to sop up some of our preceding revelry, and I had read that Slate had a top-tier burger. 

The standout of the evening was definitely the service. Our waitress was very casual and had the demeanor of a server at your local bar who considers you a regular. She would chat with us while we waited for our food, she recommended alternatives when we ordered a dish or drink that she considered to be inferior to another menu selection, etc. All in all, we really enjoyed her. 

Alas, the low point of the evening, for me at least, was the food. I ordered the Slate burger (I had to ask about it because it wasn't on the menu, so they brought me the bar menu, which contained it). I was super excited to try it to see if it could match up to Village Whiskey or even Bobby's Burger Palace. 

No. No, it did not. The burger, which was certainly sizable, came out on a somewhat-oversized potato-ish bun with no lettuce, tomato, onion, or even ketchup (unless the ketchup they gave me, which I inferred was for the fries, was for the burger [in which case I had no ketchup for my fries]). There were also chunks of cheese and other things mixed into the burger, which I was not a fan of. The truffle fries, on the other hand, were excellent though. Also, I enjoyed that they had a blackberry wheat beer on tap. 

All in all, I will not go rushing back to Slate, nor would I actively avoid it. Three stars.",2011-02-20 13:54:58,"{'food': ['slate burger', 'truffle fries'], 'drink': ['blackberry wheat beer']}"
urEnJI79oEaTb6r8pznScQ,VOwc4Tyrv6LxZEWqqAeJbA,XQWZQjC73fCTRGWnD18-Eg,5,0,0,2,"I've been a frequent customer of Drexel alumni Marti's Mac Mart Cart, aka ""The Big Pink"", since I started working at Drexel and I am thrilled that they have opened a fast casual storefront so close to my work. It's the perfect indulgent cheesy treat to go. The staff is passionate about their product and loyal to their fans and customer. They're great at engaging on social media too. Go for the original 7-cheese mac or one of their signature recipes. The Corndog Cup is one of my favorites with cornbread crumbles and hot dog bites. #GotYourMacOn",2016-06-24 18:09:15,"{'food': ['mac', 'macaroni and cheese', 'cornbread crumbles', 'hot dog bites'], 'drink': []}"
a6sNTwuqm6QcsL3ywbZ3yA,iFdQzy3vYe1hz4c8Kdlpqg,I9DCtzUgR4gamBFMVsdY8g,1,1,4,1,Went in to pick up sushi and a six pack a couple nights ago. After selecting my six pack to woman at the counter began removing my beers from the six pack holder and started putting them in a plastic bag all the while banging each beer pretty forcefully on the counter. When I told her I wanted the beer in the six pack holder she scowled and said that they don't like to give the cardboard six pack holders away (wtf I'm not buying a 40 of King Cobra). When I got home I opened my beer to have it explode all over myself and my couch due to the counter person's careless handling. I doubt I'll be back again due to IGA having a better selection and better prices and being only a couple hundred feet away from their place. If you enjoy craft beer this isn't the place.,2017-01-31 02:56:23,"{'food': ['sushi'], 'drink': ['six pack', 'beer']}"
audlaGSit8z0L3JLdjeqDw,sjX6nkd7PgojHHsUqd0rdg,AlxnbBd2JNkozNvI0OvRLQ,4,1,0,0,"I've heard about this place through the grapevine and it definitely did not disappoint. The bar is your typical small Fishtown Bar but the menu is what sets this place apart. I would give this place 5 stars had it not been cash only and limited seating. There is a rotating specials menu, last time I went I had the Pork Shank Spaghetti and it was delicious! The portion was very large and most people ended up taking a takeout box home with them. Although in a small Fishtown Bar the price was a little on the higher end, not super cheap but then again not Davio's type pricing either. They also ran out of meatballs that day. All in all this place is a hidden gem and I will 100% be going back to try the other dinner options.",2016-10-17 17:31:46,"{'food': ['Pork Shank Spaghetti'], 'drink': []}"
HNKk-1_LJaX6B-l6r6O4bA,dhyBZ_k19tEIBTZEGBXZUw,u7_3L1NBWgxhBM_B-cmmnA,5,1,1,1,"This is a solid, hearty meal, that's equal parts casual, equals parts classy. The wine and pizza combo has been done in a few other places around town, like Pizzeria Stella and Nomad Pizza, but those pale in comparison to Vetri's version. Most anything on the menu is good, but the Four Cheese (Quatro Fromage) white pizza is my favorite. Definitely do not skip the Gnuttela Pizza for dessert. It's light but still decadent and well worth it.",2015-10-11 02:54:02,"{'food': ['solid', 'hearty', 'casual', 'classy', 'pizza', 'white pizza', 'dessert'], 'drink': ['wine']}"
mUdovr_oF6Tw2s6txFcFvA,bOvApIqgEjOZx8vQtLLmmg,4_W5pstoN1166TGjjPOrMg,3,1,0,0,"Been three times now. Highlight is the beer selection, it's always extremely good. Menu is standard for this sort of place but quality is better then normal. Service is hit or miss.",2012-12-09 01:47:29,"{'food': ['three times now'], 'drink': ['beer selection', 'highlight', 'quality', 'service']}"
uYCse5W2FuqkD0ukS4GGaQ,nBTodluJ9KZBkwLWClsKmQ,MUTTqe8uqyMdBl186RmNeA,1,0,0,0,3rd time ordering out and the sushi was just disgusting. I ordered the spicy tuna roll and the tuna tasted like it had been sitting out in the sun rotting for days. It was not fresh and it tasted horrible. Last time I ordered I felt sick after eating the spicy tuna and I'm afraid I'm going to feel sick again after having one piece. Very disappointed and not going to order again,2018-09-27 23:52:40,"{'food': ['spicy tuna roll'], 'drink': []}"
faKYAkEXPwbiRO2Y5VGoVg,BhkkJQbSy_womFDYIYTgQg,d_tRshM-w6S4QxE4VVi8tQ,4,1,0,1,"I came here for brunch on a Sunday... the food was really good, but the drinks were even better. The bloody mary, key-lime pie martini, and strawberry basil caipirinha were delicious! 

The service was also great. I'm excited to try Jones for dinner sometime.",2011-07-08 21:15:06,"{'food': ['bloody mary', 'key-lime pie martini', 'strawberry basil caipirinha'], 'drink': ['bloody mary', 'key-lime pie martini', 'strawberry basil caipirinha']}"
04WhSyuD8tsgxkIQ6S8xqw,4GvOrKF8B3Qk0BSRnVVvcw,V6Om7YZhlRQRU7WfuxHq8Q,5,0,0,0,"This place is fantastic. Our waitress Margaret was super friendly and helpful. The catfish po boy was excellent and the selection of sides and Zapps chips are awesome as well.

Definitely check this place out when you're in Reading Terminal Market.",2017-12-05 18:48:14,"{'food': ['catfish po boy', 'sides', 'Zapps chips'], 'drink': []}"
hJxwkKpHgJ2WcWHoKyWBLA,m68LrtzwCrdln17GC2e5ZQ,vUrTGX_7HxqeoQ_6QCVz6g,5,0,0,0,"My friend recommended we check this place out for brunch, since it's new, the menu sounded delicious, and the owners have an impressive pedigree.  It did not disappoint!  The mimosa and bloody mary were outstanding, as was my meal of the Lebanese omelette and citrus yogurt.  It's only open for brunch now (dinner to follow sometime this Spring), but it was an open, bustling, and welcoming atmosphere, with a friendly and attentive staff.  Can't wait to go back!",2018-04-29 23:37:32,"{'food': ['Lebanese omelette', 'citrus yogurt'], 'drink': ['mimosa', 'bloody mary']}"
dgjWyXoDtKBcuoIKlQsTbA,IsXy4uiCoElOhmEdLY7QTg,u-8sFq05DQ6PYCR5HiKZ2w,2,0,0,0,"still lagging in terms of delivery and service , the food is good if you eat in only.",2017-05-02 22:31:00,"{'food': ['food'], 'drink': []}"
9wGLYM8O4eI3nLyDp0ftZw,4U4vN1wDwgaSUBmV7dTzqw,D4AJVjAiJULF04BjN7bhiA,3,2,8,3,"Extremely expensive place (e.g. all wines by the glass start at $10) that has somewhat tasty delights.  I wouldn't call it tapas so much as pretentious meals for women who don't eat and the men who pretend to love them.

Don't think I'll be back.",2007-06-25 00:08:11,"{'food': ['delights'], 'drink': []}"
hBPHM6MKAAPgcrBHvhfJ7w,aZkkBAj9x5syIirXPyDvHA,Dv6RfXLYe1atjgz3Xf4GGw,5,0,0,1,"We had heard about HipCityVeg and tried it out for dinner tonight on our trip to Philadelphia from NYC. I am in love and wish we had one in Manhattan! I ordered the Crispy HipCity Ranch, and it was absolutely divine. One of, if not THE, best ""burgers"" I have had since going vegetarian. The interior is extremely tiny, but it's a great grab-and-go to eat in the park a block away. Must eat while in Philadelphia!",2014-07-20 00:14:01,"{'food': ['Crispy HipCity Ranch'], 'drink': []}"
oYjAeOhx4nznRKI38tcL5A,Za4sc4A2kMNki0BGwRVRYQ,7mpYTDb24SywNMRn3yeakQ,5,1,0,0,"TT is always accommodating of us dancers on Wednesday nights, letting us take up their floor and put on a show with the amazing Mikey Junior band and soulful blues tunes. They have a great selection of drinks, although few noteworthy concoctions, and generally helpful staff. Better just take it on the rocks.",2013-08-06 09:37:18,"{'food': ['dishes'], 'drink': ['drinks']}"
s9ckHhgwc95Q9hgHjUj1lw,97-dPyCYmQBykiutyfVuWw,Q-prSTdggNlxAEFV88BZOw,4,2,0,2,"I love wine, and I love cheese.  Therefore, I love Tria.  

The bf and I go here pretty regularly and each time we find new things we like.  The only downside for me, and the reason they don't get that 5th star, it's the crazy mark ups on the prices.  After finding a new red wine I really loved, I came home and looked it up on the PLCB website to see if I could buy a bottle nearby.  To my surprise, a bottle was priced at $13, and I had just paid $11 for a 5oz pour.  Boo.  

But, I'll support the local economy and keep on going.. it's a great way to try new things, and overall it's a nice chill spot to have in the neighborhood.

...omg I can't believe I forgot to mention the mead.  Yes, days of yore, mead!!!!  It's sooo good and I've never seen that on a menu anywhere else.",2009-08-13 02:36:26,"{'food': ['wine', 'cheese'], 'drink': ['wine', 'mead']}"
EBgHmIIZp8t4H5Og7cfFmA,wjClsIuhEjZN2OlkoFPKnQ,d_tRshM-w6S4QxE4VVi8tQ,4,0,0,0,"Amazing location, right by all the Independence Hall and Liberty Bell attractions. Awesome modern-ish diner feel, with great low lighting and a few outdoor tables. Service is quick and friendly...and the food is 100% comfort. I highly recommend the Mac & Cheese with crunchy topping.",2013-05-11 23:51:55,"{'food': ['Mac & Cheese with crunchy topping'], 'drink': []}"
yNJvHDOPi-LKrtBqDlaLWQ,pkmzFPcVsM5I_fdKDQkufA,VRnJgj0IvxoksHppE78X2Q,5,1,0,0,"I definitely enjoy eating here and appreciate the service I've gotten. I haven't tried too common items off their menu--my boyfriend and I love fish dishes and salt baked squid, so we usually only order that here. Their salt baked squid is definitely one of the best I've had in Chinatown. We also order the Sea Bass Filet with black bean and hot peppers. This dish is quite delicious--the fish is tasty and the peppers are crispy! We always ask for ""spicy"" and they definitely listen to us. 

I also want to rave about their service, specifically one younger male server. One Friday evening on our way out of town, we got a flat tire and had to call AAA. We decided to have dinner here while we waited assuming AAA would take forever. However, they showed up as soon as the food arrived, so my boyfriend left to attend to that. Our server was very thoughtful. He put our food back in the kitchen in warmers so it wouldn't get cold (I was obviously waiting for my boyfriend to come back before eating). He gave us fresh rice as soon as my boyfriend got back. We really appreciated his thoughtfulness! All other times, the service has been decent. It's a small place, so it can get filled up quickly. When it's really busy, we may have to wait some time to get our water glasses refilled, but they definitely do their best to keep up. I definitely recommend this place if you're in the area.",2014-12-01 18:18:52,"{'food': ['fish dishes', 'salt baked squid', 'Sea Bass Filet with black bean and hot peppers'], 'drink': []}"
mFu3pdTRyasJTor_0RqOQQ,SxxvSAvwZWBNZnGBcUC_IA,8Ak2iPlR4fCziMQZ11ohAA,4,0,0,0,"Went to a meeting over Sunday brunch and enjoyed it.  We had the room on the third floor which was the perfect size for our group (around 10 I think) and the walls were purple (my favorite color!) and decorated with Mardi Gras masks.  Brunch is a la carte, and can add up in a hurry if you are hungry.  I had the sweet beignets with berries.  They are bite-sized, didn't look like the ones in New Orleans but the taste took me back.  Then I had Eggs Sardou, which was nicely presented and a good choice for brunch.  Had a diet coke, which came in a fairly small glass and no offer of a refill or asked if I wanted another - that was the only disappointment.  The group meets there regularly - this was my first time but I will go back, for both the company and the food.",2009-03-10 13:23:46,"{'food': ['sweet beignets', 'Eggs Sardou'], 'drink': ['diet coke']}"
JoNLIDO9GNXRjekRgVQ3qA,mzL0zHFGyd9866OUljq49g,mUIBtlWNPD7sz3rGGWQ1RA,4,4,0,3,"Excellent.

I came here recently and on the suggestion of my dining partner, we sat outside.  I normally don't sit outside but this evening it seemed like I could break that rule.

First off, I loved the bread with tahini.  It was so good, we actually got a second plate of it.  Downright delicious.

Our appetizer was the flatbread and it was a revelation.  It had all of those wonderful greek flavors and when you're able to eat that with a nice bottle of wine while sitting outside, life is good.

My entree was the stuffed calimari.  It was light and delicious.  It was served over a bed of sauteed veggies in white wine.  At the very least, pepper and olives.  The squid itself was stuffed with rice, pine nuts, feta and some other goodies.  It was cooked perfectly and cut like butter.

Our waiter was very friendly and did a great job answering our questions.  I'm definitely coming back here.",2011-04-27 14:53:30,"{'food': ['bread with tahini', 'flatbread', 'stuffed calimari'], 'drink': ['wine']}"
3d6ONzaatPDnYMFO0p3msg,JGKMcH537WSicUzW0lZp-g,Oun4NN-u5yiHIxDqtJnxgA,3,1,1,0,"I live local, and we decided to give Federal City a try. It's a really small store front, they have stools but I doubt people would sit there as its so small. Pretty much its Donuts, Coffee, Fried Chicken after 11am, and Old Fashioned Soda's that are canned. We only had donuts and a Dr Brown's Cream Soda.
Indian Cinnamin~ this donut smelled incredible. The taste was spot. Really good.
Chocolate Banana~ this was kinda odd, but interesting. Mine was super banana, chocolate was more of an aftertaste
Creamsicle Donut~ it tasted like sugary creamsicle if you had on in the 80s.
Dr Brown's Cream Soda~ was really watered down for my liking.

Overall very pleased with this fancy donut establishment. I wouldn't go there all the time, but a really nice change of pace. I believe its $1.50 for the cinnamon, $2 for the fancy. So it was about what we expected. The cost would stop us from going more then 1-2 per year. It's a nice change of pace, but nothing more.

Has Benches outside and the crub. A few stools inside maybe 4.",2012-07-03 18:50:05,"{'food': ['donuts', 'fried chicken'], 'drink': ['coffee', 'old fashioned soda']}"
14VZZhO8xXiAU6_BRrQQHw,DCjEbpIRBT8YEfAriapy1w,9gObo5ltOMo6UgsaXaHPWA,1,1,0,0,"Bad place. I made a reservation for my sister's eighteenth birthday. They don't let us in because they think one of my friend's dress code is not good enough. Ok we are Asian. But it doesn't mean we are not allowed to be in the restaurant. The receptionist doesn't dress good enough too. Overall,  bad attitude, bad service.",2016-04-03 00:49:55,"{'food': ['dish'], 'drink': ['drink']}"
izgS_jK9vBfByLPvo1sdKg,J7TblDxAg61lFqw_KboIqw,pVHbXwsqLxNzAx9rdwy2EA,5,0,0,0,The food is delicious.  The bartenders and hosts are friendly.  Shout out to Yusef the head cook!  Food is fire!,2015-10-11 00:53:04,"{'food': ['food'], 'drink': []}"
5hwKlfyEUz6DJZiOuiFqAQ,23mUvv0YG8QFFRWvgk6WsQ,MMRRS6YhVRx_iN5-JhMRYg,5,0,0,0,"Very authentic,  we had extreme heat cabbage and three cup chicken. Finally a place with real Chinese food. We loved it. No room for dessert. Have to come back.",2016-10-02 16:39:11,"{'food': ['cabbage', 'chicken'], 'drink': []}"
gmhLF6oycJwD80QzzsAsWg,a8Vl5mgrJUh8Iu31JYJsYg,NeY1bH6IKJxnn4YAixibsQ,2,0,0,0,This used to be my regular lunch spot until I got fed up with the turkey and brie sandwiches. The honey mustard is carelessly distributed on the flatbread so the sandwich is very dry and tasteless.,2012-11-10 04:58:47,"{'food': ['turkey and brie sandwiches'], 'drink': []}"
5nHZzVvG6h63sbBXUU3Z2w,ZNC4L7fkT9ke9Xi9OGL1Dw,7lwe7n-Yc-V9E_HfLAeylg,4,1,1,1,"Before I begin this review, I first have to make mention of how their odd name! We spent at least a good 10-15 minutes trying to figure out 1. what the heck the name of the restaurant was and 2. whether that was a rabbit or a pig or what on the front cover of the menu. 

After a tough night of drinking on a huge ship we headed here for some brunch (but not before a stop at a pharmacy for some much needed advil for me!). We ended up whiling away the better part of the day at an outside table, in the warm sunshine and it was only towards the end of our time their that I was able to down any solid food.

However, I had no problems throwing back those alcoholic liquids. What can I say, that hair of the dog theory is completely true! I was pleasantly surprised with their selection of beer and ended up ordering a Duckrabbit Porter and a Sixpoint Bengali Tiger IPA. Both delicious! 

Anyway, this is all beside the point. 

The only food I actually ate were their fries with truffle dijonnaise which came in a huge container and tasted absolutely delicious! I wish I had ordered more of their creations because, judging from my friends' reactions, they were all full of flavor and completely satisfying.

The only negative I have is that our waiter was a bit inattentive and forgetful. Although, oddly, one of the other waiters randomly came over to ask how we were doing at one point- but since they don't wear uniforms of any sort we were a bit confused and thought for awhile that it was a crazy stranger off the streets!",2010-05-26 02:18:21,"{'food': ['fries with truffle dijonnaise'], 'drink': ['Duckrabbit Porter', 'Sixpoint Bengali Tiger IPA']}"
hG1PcVd0TqwkjLFDPZcIQw,4nTTGHn5a1L6Gsa0LWFpcg,H9YalVFugskHF38MfJWT_w,1,0,0,0,"Note: I visited very close to when the location first opened around Feb 2018. I hope that the place will have changed and its possible that they have improved. I hate to give them a low score just at the open but this is just what I think.

This review is for the center city location. I came in with high expectations but did not like the food at all. I got the tonkotsu ramen. Presentation was poor, and the ramen came in a plain white paper bowl kind of like an instant ramen bowl. There was no water - they gave a tiny water bottle and disposable utensils. The veggies did not look too crispy or fresh but quite limp and pale.

The broth was very thin and not silky. It was bland and not salty or savory enough. The pork was not cooked in a pot roast style but instead fired with a torch, which gave am unusual burnt and chewy texture rather than something soft and buttery like normal tonkotsu pork dishes. The noodles were no better. They were a little too chewy.

Overall the ingredients were poorly integrated and bland. Try nom nom ramen a few blocks away or terakawa for better ramen.",2018-02-25 22:17:27,"{'food': ['tonkotsu ramen'], 'drink': []}"
lo0sn1rgRWhNADD4odu33g,AOFSRsOYMIgo3UGVobTd3Q,04UD14gamNjLY0IDYVhHJg,4,0,0,0,"Went here on a Monday night at 8pm with two friends. They do not take reservations but luckily had a table available. The table was shared with another couple and VERY small. 

To eat we had the tomato and mozzarella salad, hummus, spinach pie, grilled octopus, shrimp pil pil, and seafood combination. Everything was very tasty. 

It is a byob. There was no room on the table for all the food. And the servers were not that friendly. I would go back for the food and hope the server is having a better day!",2016-06-15 14:46:40,"{'food': ['tomato and mozzarella salad', 'hummus', 'spinach pie', 'grilled octopus', 'shrimp pil pil', 'seafood combination'], 'drink': []}"
6rPH-2BKZvUfNIV_JkKaiQ,5ETDkJj_PRw8dz2HOxwWtA,RVLF2RaStLkJiQCqBHknDw,5,2,0,0,"I was excited to hear that mommom's cart had an actual location! The restaurant is small, cozy, and clean. The decor is lovely and expect to find the menu written on one of their black boards. They have a super friendly staff who create amazing dishes. Ordered the golabki and pierogies and was not disappointed! If you have the chance, stop in and try one of their delicious dishes.",2018-03-25 02:58:28,"{'food': ['golabki', 'pierogies'], 'drink': []}"
qkb7v3JNshlTKIvaO3u2CA,4P4p89caNosIhJjXTHhySg,NVN_23yYJDf_RAinqFICDA,4,2,1,1,"We stopped here as part of an impromptu food crawl as our dinner did not quite fill us up....we were looking for a veggie friendly place and saw that EVERY dog is available vegetarian style! 

After just eating dinner I insisted we each get a dog so we got a Bronx Bomber and the Saigon Fusion. Um, yum. Wow, yum. The Bomber was traditional so I had to get it but the Saigon was over - the - top out of this world yummy - ness on a bun. We also got the fries and curry dipping sauce as recommended but the FANTASTIC staff. Owner popped over to our table for a hello and 2 more free dipping sauces - curry reigns supreme! 

Amazing service, super friendly staff and just freaking delicious dogs.

Grade: A , Fun in a Bun - get some.",2011-07-06 03:25:45,"{'food': ['Bacon and Egg Burrito', 'Saigon Fusion'], 'drink': ['Fries', 'Curry Dipping Sauce']}"
VQLutql0bXCR0f1w5d1U-Q,7T01Kj0bsnn2LjPGJU3FdA,JomDoQafikclSVVCPkWjnA,5,0,0,1,"Food: Timeless meal. They have everything from simple food (my personal favorites #1 or #9 -- if you really want food coma) to chicken and waffles to their signature sandwiches at the bottom of the menu; all their food is unfathomable. 

Environment: Usually I'm particular but because of the ""old-school West Philadelphia environment"" they steal the stage away with its appropriate location and ""local West Philly"" vibe.

Service: We happened to come with 6 people initially, then 2 more 15 min later, then 2 more another 10 min later. What happened? Despite us being a difficult group of people, they were very accommodating and still showed unconditional love towards us. Sundays are outrageously busy so don't expect to be served like a princess on these days.

Price: Unbeatable. Seriously for a number 1, a standard 2 eggs over medium, 4 slices of crispy bacon, 2 slices of rye bread, with a heaping side of home fries or grits with butter for $7 before tax/tip, is absolutely unheard of in the city.",2017-06-19 01:48:58,"{'food': ['Timeless meal', 'Chicken and waffles', 'Signature sandwiches'], 'drink': []}"
0__mRlq8zHkil4c99Jn_4A,ouODopBKF3AqfCkuQEnrDg,MTSW4McQd7CbVtyjqoe9mw,4,5,1,4,"3 pastries for $1.25 after 7:00 pm!  I love coming here on a Sunday and stocking up for the week with a box full of rolls and custards.  The baked goods here are always very fresh and consistent.  I'm a big fan of the egg custards, which have a layered, flaky shell, and the coconut milk buns.  The cakes are better at Greenleaf's but the breakfast pastries here are excellent.",2010-10-25 03:52:44,"{'food': ['pastries', 'custards', 'buns', 'cakes'], 'drink': []}"
