review_id,user_id,business_id,stars,useful,funny,cool,text,date,ner_results
dtoD4XOylZCyxC2S-TY3Hg,5dK7rSjS9e3Mqd2nSWOxeg,GUMVStVaJfWmCIpQA4TtHg,5,0,0,0,"A coworker recommended this place.  I picked up a lunch special around 12:00PM.  It wasn't crowded but then again its New Years week and people are still on vacation.  The woman working the cashier was taking phone orders though.  The decor is modern with lights that slowly fade in different colors.  I ordered the 2 roll lunch special for $9 ($1 extra for brown rice).  It came with miso soup which was very very good.  I usually order the salad instead of miso soup bc I don't like miso soup.  But they made a mistake and gave me the soup, but it was a pleasant mistake luckily.  I ordered a Philadelphia roll which was very good and a spicy tuna roll which I loved.  It had a little crunch to it.  Brown rice was a nice change...there were lil black seeds in it.  For me, the most important part of eating sushi is the wasabi...if it isn't hot enough to make my nose hairs curl then I'm not loving it!    My nose hairs were definitely curlin'.   I noticed there is a trend in Center City to serve more pieces in a roll than 6 and to make each piece smaller.  That is not the case here...thank heavens!  6 pieces come in a roll and each piece was the average size.  I'm definitely coming back!  I can't wait to try their specialty rolls.  Best sushi place that I tried so far in Center City!",2013-12-30 17:24:44,"{'food': ['lunch special', 'roll', 'salad', 'roll', 'roll', 'roll'], 'drink': []}"
DRdrrx46KtBPHO25tCP7YA,vXDE70-3VTG6asHVAEa-CA,aZNiVR6oAMQX5__yGPvYsg,4,3,1,2,"Great place to take your Grandma to for Mother's day.  At least, mine liked and ate everything she got.

First course Madame:
Pork Potstickers.  Tasty and a good portion of 6.  Ate some of gramps's goat cheese/scallop/fig wontons.  I liked those though you mainly taste the goat cheese, which is how goat cheese can be and I like it.  Just to warn anyone who is more interested in the scallop taste.  

Second course:
Mu Shu Pork with brandy hoison sauce.  Very good (I'm a sucker for those scallion pancakes), not anything you couldn't get up in china town but they don't even pretend and label it as Classic. 

Desert?  Why, yes of course.  I shared the chocolate sampler with my Aunt and Grandmother, which was perfect.  White chocolate soup for Grams (suprisingly she ate the whole little cup full), mini cake, truffle, and chocolate bites for me and Auntie.  Complimented by Oolong in my own little iron kettle.

If you want to go just to get Wow your Socks Off chinese food, Don't.  That's not what you pay for.  The true chinese dishes are good, but no better than a really good take out place.  This place is about putting a spin on Upscale dining but still having a staple like Grilled Filet Mignon on the menu to please everyone in your party.  Very attentive waiters (Augustine was so nice!) and big open rooms with nice decor.  

I've eaten at better upscale places but it was good.  The menu does play it safe but I think it works for them and is needed to still lure regular upscale diners to a place that offers chinese food.",2008-05-13 17:08:04,"{'food': ['Pork Potstickers', 'Mu Shu Pork with brandy hoison sauce', 'White chocolate soup for Grams', 'Mini cake', 'Truffle', 'Chocolate bites'], 'drink': ['Oolong']}"
dCs-_rKwB4tFaXrHMfNSrw,F606Q2Jkel7rUCVgxkScVA,bqmX882_6AxVA_uHEQ70sQ,2,3,4,0,"I hosted a birthday party in the karaoke room last night. The food and atmosphere were great, and the karaoke equipment was totally functional. This would have been a 5-star review if it had not been for how I was misled regarding the cost of the karaoke room.

I made a reservation two weeks in advance over the phone. The rate is $150/hour, supposedly including unlimited food and drink off the menu. But when I got there, it turned out to not be a flat rate at all. There is no deal here -- my party's orders were taken, only for the wait staff to pull me aside and say that we exceeded a supposed $300 limit (since we had the room for two hours). We could pay the excess if we wanted, but I was blindsided by this and the wait staff helped me get it down to $300. I was very disappointed that the room policies were not better communicated to me, much less listed on the website or social media.",2017-04-09 14:13:14,"{'food': ['food'], 'drink': []}"
DQ5PB5iMmURJVeYAT__T8g,8MKygqfspKqG2-X9ycR-Ow,JUlsvVAvZvGHWFfkKm0nlg,4,1,1,1,"Maybe we got lucky with the server, but the litany of complaints about the service didn't reflect a recent Friday night experience. 

Endless chips and salsa, plus side o' guacamole, came out fast and were joined by a couple of fine craft brews (small but good selection). The guac, pico de gallo and salsa verde were all good, and they rub a bit of spice on the chips for extra kick, which was a nice touch. Is there a better app for $4 within a 3-mile radius? Probably not, but you tell me.

As others have noted, the burritos aren't what many of us are used to. This isn't a Mission-style torpedo weighing in at 5 pounds, exploding out of the foil with a delectable mess of beans, rice, guac, sour cream plus the meat of your choice. No, it's not that at all. But that's okay. I didn't have any trouble embracing, then devouring, the two svelte carnitas-filled and un-grilled tortillas. I dressed 'em up in the guac and salsa and had no complaints. And I didn't even miss the overstuffed feeling that comes as the secret side with burritos gordos. 

My vegan buddy had the veggie wings that everyone raves about, and the BBQ seitan. I tried them both, and liked them, but taking my advice on vegetarian/vegan food is really a waste of all of our time, Mr. Spicoli. So take it from Vegan Mike: he loves them.  

Excellent service throughout: attentive but not rushed. I don't know how some people got duped or upsold on the $5 rice and beans side. I know these are usually in the burrito, but the menu lists them separately with the price and indicates that they aren't ingredients in the burrito, so it was clear to me. Ambiance was nice and vibrant, and even though the place was busy, we got a booth right away. 

I'm trying to think of cons, but there really weren't any, so I'll be visiting again. And I'm looking at you, tequila selection.",2010-11-28 17:41:37,"{'food': ['chips and salsa', 'guacamole', 'salsa verde', 'carnitas-filled tortillas', 'veggie wings', 'BBQ seitan'], 'drink': ['craft brews', 'tequila']}"
gpN-3UvJP1EthepPIZ_64Q,vCUeFAY774VtmpszX9hyGA,MMRRS6YhVRx_iN5-JhMRYg,2,6,3,2,"I liked this place so much last time that I raved about it to all of my friends and came here again with a group of them. What a shame that this weekend's experience was both disappointing and embarrassing. 

I had made a reservation, which turned out to be a good idea because they were pretty busy. In the reservation, we had asked for an outdoor table. The hostess had reserved us an indoor table. We told her that we were willing to wait for an outdoor table to give the server some time, if he had been seated recently. While the hostess was reluctantly figuring out whether to give us an outdoor table, an older lady (maybe a manager?) came over and took us to an outdoor table. 

Our server was reasonably good. He frequently checked in on us. However, our water glasses remained empty for long stretches of time. When we were ready to order, the older lady who seated us came to take our order instead of our server. 

We ordered 3 items for starters: the Dan Dan noodles, Crispy Rice Style Pork, and the Bok Choy vegetable dish, to which the older lady said, ""THAT'S IT?!?!"" followed by, ""THAT'S ALL YOU WANT TO ORDER???""  all in a very rude tone and incredulous facial expression. I almost choked. 

As someone with many years in the restaurant industry, I understand  why one would prefer dining guests to order more. However, I did emphasize that we wanted to order those items as starters. Most restaurants don't have a problem with this. Also, even if I ever thought that a guest ordered too little, (I might secretly curse them out in my head, but) I would NEVER say it to the guest. 

Also, as many reviewers point out, the portions are fairly large. I'm not  a hugely large eater and I don't think it's wrong to order a comfortable amount of food when dining at a restaurant. (We were still very full by the time we left.) The way the older lady reacted when taking our order was tacky and unprofessional, but the real disappointment was that it took over an hour for our orders to arrive (last time, it took only 10 min). It seemed like she ""forgot"" to give the kitchen our order... maybe because she thought we didn't order enough. 

After 45 minutes, we asked our server about our food. He promptly went to the kitchen and came back saying the food was on its way. 15 minutes later, we asked him again. He checked with the kitchen and said that they had run out of bowls. At the same time, a table of 3 just got seated near us. About 10 minutes later, that table of 3 received an order of Dan Dan noodles (in a bowl!) despite the kitchen's alleged lack of bowls. We still did not receive any of our items... not even the boiled vegetable side dish, which takes about 5 minutes to make. 

A few minutes later, a manager came out with yet another bowl of Dan Dan noodles, but he offered it to a couple who said they didn't order it. The bowl was sent back to the kitchen, though I suspected that it had been ours. I thought about lunging for it, but it disappeared before I could even blink. Another few minutes later, I talked to a girl who was checking on tables and got her to finally bring out our dishes. She apologized that our food ""took so long to arrive"" ... meaning 1.5 hrs in this case. My friends were really hungry (that's how they kept track of the exact time). I felt so badly about telling them how good Han Dynasty was. 

This experience really deserves 1 star, but I'm giving 2 stars after taking my last visit into account. I believe the bad reviews a bit more now. I'm not sure if I can still recommend this place at the risk of having others wait 1.5hrs for their food and get rude service from that older lady (the hostess/manager/person who took down our order). We didn't ask for a discount, but if this happens to you, make sure you get yours.",2012-09-12 15:21:14,"{'food': ['Dan Dan noodles', 'Crispy Rice Style Pork', 'Bok Choy vegetable dish'], 'drink': []}"
8htteUhfwVMlKJIWb4eJvw,YA2RD6y51ouVaMTSxSQHow,Z5po0aTuzKKblek5y6Sp8Q,4,0,0,0,"The thought of a burger from here makes me salivate like Homer Simpson..mmmmm....

I'm a burger snob when it comes to take-out burgers with most not meeting my satisfactory standard (sorry mcdonald's you are so below me) but 500 degrees gives you that steak house quality burger while meeting the American instant gratification need.

I ordered The 500 and wow, devoured it in under 5 minutes.  All the burgers here are good and their fries? Forget about it--amazing!  They're cooked in truffle oil to give it that extra kick.  Ask for their house sauce free of charge and it makes a great dipping sauce.

The only thing that held me back from giving it 5 stars?  The price.  Even though you get your money's worth, since they opened, their prices have been slowly creeping up there.  But believe me, that will not stop me..not yet :)",2011-03-29 19:03:30,"{'food': ['burger', 'fries'], 'drink': []}"
1UvbaapWNUDat_3JfmPHTg,iCXDWiY2QADZDNk_oIPIPg,04UD14gamNjLY0IDYVhHJg,4,0,0,0,"Dmitri's continues to be a certified go to spot for a great bite to eat. The place is small yet cozy, but not as stuffy as some other BYOBs in the area. As per normal, the meal starts with some freshly grilled pita and olive oil. We ordered the avocado citrus salad that was fresh and a good size. Many come to Dmitri's for the seafood, but my default meal is the lamb. It is always top notch. You can't go wrong with any of the standard seafood menu offerings.

In the winter be sure to sit towards the back of the restaurant. The consistent traffic of customers and people inquiring about the wait time through the front door tends to result in gusts of arctic through the front half of the place.",2014-03-05 13:10:13,"{'food': ['pita', 'avocado citrus salad', 'lamb'], 'drink': []}"
lhe4fftiGbzk-83lY5KxLw,cpEgAh3MH3Pop0e0b5WQKw,wUnLSg_GKfEIQ5CQQ770_g,5,0,0,0,"One of the most memorable dining experiences I've ever had. Service was impeccable, every course was delicious. There's honestly not one bad thing I can say about Vetri. It was worth every penny.",2018-06-21 20:16:32,"{'food': ['course'], 'drink': []}"
SlkEcqa0xH5w3bv00NN5kA,4Qwu_-av8nK3fFCuvn0PqQ,O6hY9yenifuRXrpc4TfgsQ,2,1,0,0,"I won't nitpick and list all of the missteps or comment with everything that went wrong. I'll just say that we waited over an hour for our entrees and they were not hot when they got to the table. I think they have some kinks to work out and then this place will be amazing. We were compensated appropriately for our lackluster dining experience. In other words, they made it right.",2017-05-05 12:48:35,
vbbbix1Zv-0o3qjgpNuSmg,yrmAf77pYlgCjacpK5ZDnw,htO_nlxkEsYHzDrtbiUxew,4,0,0,2,"I discovered La Colombe through Yelp reviews. Their coffee is great and the place is nice and cosy. They are very friendly in their service and not too expensive either. It is true that you see a lot of hipsters here but that does not bother me. 

Most important are their croissants. They are the best you can find in the whole of Philadelphia. When you eat it, you feel like you are in Paris eating a real french croissant. Trust me, coming from Europe, this is hard to find here. 

I will be back for some more latte and a croissant!",2010-12-07 23:12:36,"{'food': ['croissants'], 'drink': ['latte']}"
YVbZyERAd-cVzkSsKHabww,xs7xL0iyDP7Q8dtuAlX4gw,d_tRshM-w6S4QxE4VVi8tQ,3,1,1,0,"The place is modern, stark, ""cool"" and noisy, but that's what they want. The food was excellent. I had the Matzo Ball Soup (two fluffy matzo balls) and the Seared Ahi Tuna (not much to it, but good). My wife had grilled Salmon. We both had a drink. We split a desert. My wife had coffee. Everything was excellent and delicious. But here is the catch, the bill came to about $95 including tip. It was good but not that good. The portions were small. No need to worry about taking home a ""doggy"" bag. I would rate Jones' pricing at $$$ and a half. Definitely New York pricing.",2016-06-29 01:47:50,"{'food': ['Matzo Ball Soup', 'Seared Ahi Tuna', 'Grilled Salmon'], 'drink': ['coffee']}"
HSLaC9xUD1N9RgkxGJy8vQ,RrWpgjirADFUK9jGF_Uzmg,EtKSTHV5Qx_Q7Aur9o4kQQ,4,0,0,0,Very good burgers and a nice vibe. Also they have almost a whole PAGE of bourbon. I love bourbon. I do think it is kind of spendy for what you get but I did like it and I would return the next time I am in town!,2012-11-19 01:29:21,"{'food': ['burgers'], 'drink': ['bourbon']}"
Vwgf6Yg8DTb5z37-KPE_8g,wqrbPeGf-bimRXU5t1x5Aw,pj8Y-5vfbRitnnm2xJFH9w,4,2,1,2,"BYOB! Needless to say. 
 Great Jamaican food, exotic island flavors.  I recommend the Jerk Wings, they were perhaps the best wings I have ever had. Nothing plain like Buffalo wings (though i like them, too). Cozy place for a casual date.",2014-05-12 17:18:58,"{'food': ['Jerk Wings'], 'drink': []}"
ClADhlvJkBYsuQTlTuhAHA,JuHSZ2TsIKaV8NiyTsUeJA,JUlsvVAvZvGHWFfkKm0nlg,4,1,0,1,"Great Place. Great food. Awesome menu.  If your not into sitting close to people this might not be for you, its close seating, but great atmosphere. fun staff. beer could've been a little colder. might have just been that night. would definitely go back.",2016-02-02 16:11:37,"{'food': ['Great Place', 'Awesome menu'], 'drink': ['beer']}"
7JiXVxJl6M8-8IxOUENuJw,eFRiuv-gmbd0XpkyycuL5Q,3ZynJ94VpIdDlaArmEp2Rg,3,3,0,2,I was a little underwhelmed about this place. I expected more from reading the reviews. I only went for dessert and the mile high apple pie and cheesecake where good and worth the price. The red velvet cupcake was not too good. It tasted like a corn muffin. Bad baking day maybe? The ambiance was not what I expected and it can use some renovations. All in all it was just and ok place.,2013-02-25 16:24:47,"{'food': ['mile high apple pie', 'cheesecake', 'red velvet cupcake'], 'drink': []}"
6LCHoGLsjcbzjUIZeAufHg,fmnQIsoUvtgUfD1TfNcV8w,cNfeKIYIv07oxqVozMbjpw,1,0,1,0,"Break's my heart to leave a bad review for this place but they earned it.
I bring in 11 people for lunch and they hand me a bill with a 20% tip added to it.  (I felt 20% was a bit high but just a bit, no big deal) They do not circle it on the bill nor does the waitress tell me she added $40.00 to my bill.  In all the restaurants I have owned and worked at that is reason for immediate termination.  Bringing in 11 people to their half empty restaurant was not enough but they wanted to bang me twice on a tip...
Wrong... Too many great restaurants in the Great City of Phily to go to a Thief....",2011-05-31 11:14:23,
6CAyVPpy6A0cE-1Nfmi0rw,RpuHjlLqJBIQoszxwBokzw,4_W5pstoN1166TGjjPOrMg,3,0,0,0,"Solid establishment I would visit again. 

Pros:  Extensive beer list with rotating drafts. Cool vibe with the lighting, solid wood tables and retro bar stools.  Grilled cheese and burger specials were good.  Bread for the grilled cheese was perfect texture to support the cheese.  

Cons:  very loud - hard to have a conversation. They could  do well with some acoustic tiles on the ceiling.  When I first arrived and sat at a table I was told I could not be seated without my full party being present.  They were due any minute and there were lots of empty tables.  I was told they need to keep it open just in case a large party shows up.  Well they aren't here and I am so do you want my business or not?  I almost left but glad I did not after I got the guy to agree I would move if the 
""unknown large group"" showed up before my friends.  I am sure others would have left so you may want to rethink that approach.  The place was still not full when I left two hours later.",2014-03-21 01:10:12,"{'food': ['grilled cheese', 'burger'], 'drink': ['beer']}"
f0xStDd40fDpAModF-nrCQ,89rD-wRrTSMDSlewnEuGww,Bw0cpnfI-Y9QmjWzqS-oFg,4,3,0,1,"I was very impressed with the quality of the fish and the craftmanship of their sushi chef.  The Oh Toro and the Amber Jack ( a type of yellowtail) came enveloped in a very fine delicate seasoning and melted like butter in my mouth. We had the Izumi roll which had freshly roasted seaweed that were crisp which enhanced the taste of the fish. The yellowtail and scallion maki rolls were also delicious. 
We ended of meal with house made green tea ice cream that had just the right amount of bitterness to give it a kick. 
The fact that it's a BYOB makes it so much more affordable.  I'm definitely going back for more.",2013-06-30 02:36:52,"{'food': ['fish', 'sushi', 'Oh Toro', 'Amber Jack', 'Izumi roll', 'yellowtail', 'scallion maki rolls'], 'drink': ['green tea ice cream']}"
JqHyMLvKJ1SmyFKPc3KTmQ,y8qV-PhEM0VaWkgv0BD_wg,eaDZlSuVS0EY67Ke6pRP6Q,4,0,0,0,"Having never tried Malaysian cuisine, I didn't know what to expect, but it was the perfect blend of asian and indian fare.  For starters, the Indian pancake was great, the Prawn Mee Soup packed a kick (but I kind of liked it), and the Malaysian Spareribs... damn those were good.  I didn't think I could eat another bite until the fried ice cream came out... it was gone in like 2 minutes... will definitely go back.",2009-06-12 20:23:08,"{'food': ['Indian pancake', 'Prawn Mee Soup', 'Malaysian Spareribs'], 'drink': []}"
gHT2Lp0dUyGOJ__7yab18w,uIBhZTxEdOw1FRVpSJ45mQ,IgNDlyLERBwFGphgcC5VDQ,5,0,0,0,We were looking to eat breakfast at an inexpensive place. We happened to walk by this Cosi and it worked out perfectly. We got to eat breakfast for all 3 of us for under $10 dollars. The food was delicious.,2013-05-11 07:30:10,"{'food': ['breakfast'], 'drink': []}"
onAtox7d_8y0_1NI2pS9cQ,NqmBwY-KI29iUgRR14ZmRw,HTqXI5S2XcSlh_ylx9sE6g,1,0,0,0,"After ordering a boxful of pastries + another Container of sweets we needed an extra plastic bag to split things up in our group. The lady rudely refused to give us one. I've never been refused a CHEAP PLASTIC bag where I've given my patronage. Don't even try to ask for a double bag if you wanna get mean eyes!! Plenty of good bakeries that don't do this. But I guess if you're already successful, you don't necessarily need to make your customers happy anymore, and perhaps get a bit greedy like Termini bakery where you try to hold on to every penny! Shame on you. With so many other great bakeries in the neighborhood, forget this place.


Pastries are good but nothing special. There are many wonderful bakeries who make similar things. The flavors and cakes are well made but standard in flavor. Typical cannoli and cakes. 

Really, at this point you're just looking for a good atmosphere with good people and vibes and this place wasn't it. Sad.",2017-01-06 19:31:48,"{'food': ['pastries'], 'drink': []}"
DaM48fc7q_-YhquavtxXvw,6zN2RzuL60RYA4QXJhperQ,PxEiXqMAzzvp8GFlb5EoLg,5,0,0,0,"We can't get enough of this place.. Or their fried chicken sandwiches and shoestring fries. Perhaps the best part about it here is the servers - they aren't pushy and are really accommodating. You can show up for a full meal w drinks and appetizers, or you can just stop in for a burger - no judgements. 
This is a great addition to our neighborhood!",2014-12-21 21:57:30,"{'food': ['fried chicken sandwiches', 'shoestring fries'], 'drink': []}"
iiVIuwxS5YkmiWCk_U9iiA,wWALcl8hJ7cwZGW5e-v1fQ,cXSyVvOr9YRN9diDkaWs0Q,5,0,0,0,"Loved this place for breakfast yesterday.  Crowded at 11 am on a weekday usually is a good sign and we were not disappointed.  Breakfast quesadilla with avo cream was really good, with fresh pico, then topped it all off with a huge slice of lemon cake. Bring cash, no credit cards. But go!",2016-05-21 23:45:34,"{'food': ['breakfast quesadilla with avo cream', 'lemon cake'], 'drink': []}"
7qjYQID7GZpeH0lH4fY7Yg,1hQjdoDUQwHB3kFdffMA6Q,BWITd9JUXP3gSi1z3Y-z8g,3,3,0,1,"Stopped in at In Riva after a visit to Wissahickon with my pup.  Overall, the food was good, but a little bit on the expensive side.  We had a pesto pizza and salad of cucumbers with feta, which were both very good.  The cheapest pizza is around $13, which is a bit too high in my opinion.  

The best part of In Riva is that they have a separate area designated for people dining with their dogs.  Because it is fenced off, you can let your pup run off leash while you eat.  I like the concept, although I wouldn't trust my 8 month old puppy on the loose around other diners.   Also, if you dine outside, it's not really that nice of a view-- there is way too much traffic.

Although I wasn't blown away by In Riva, I will definitely give it another shot-- especially if I'm out in the area with my pooch in tow.",2015-12-07 15:52:21,"{'food': ['pesto pizza', 'cucumbers with feta'], 'drink': []}"
_pjr-Urv-reqm-KDuoLBfg,Rkj1-DFdh_9mnSCnaRIYaw,Q-prSTdggNlxAEFV88BZOw,5,1,1,2,"I love Tria.  Love love LOVE.  That should be my whole review, and you should go there immediately, but I will give a little more information I suppose.  

This place is on my block, and if I go 3-4 days without stopping by Tria, I get a little bit sad. 

First - their happy hour.  5-7 Mon-Thur, 2 wines, 2 cheeses, 2 beers, changing daily.  This is a great way to try new things.  

Second - their staff.  Extremely educated on the menu, they can describe each item and make recommendations.  They're not pretentious, even for my sad friends that only want ""sweet wine"" or ""light beer"" they are patient and make suggestions and let them try different things that they might like.  

Third - their Pistachio Herbed Ricotta with Lavendar Honey Bruschetta.  Order it immediately.  Do not pass go.  So.  Good.  

I could say a lot more about this place.  I love it.  Yes, it is a little pricey, but for the ambiance, diverse & changing menu and knowledgable staff - totally worth it.",2011-06-01 20:57:20,"{'food': ['Pistachio Herbed Ricotta with Lavendar Honey Bruschetta'], 'drink': []}"
CeghqXi1jsffsdg5Xxl5sA,ryKgufwebb0es7mGddLH-g,EtKSTHV5Qx_Q7Aur9o4kQQ,4,1,0,2,"I was stumbled across this place on yelp and looking at the great reviews, I had to check it out myself! 

I went in for a late lunch which was good.  It wasn't crowded at all.  The place is super cute and small.  I sat over at the bar and you can see array of alcohol stacked pretty high.  It gave it the bar feel but not bar food feel.

I looked at the menu and of course I had the famous burger whiskey king that came w foie gras. Since the foie gras in CA I had to get in my burger w fried egg.  I also ordered a side of the duck fat fries.  

When my food came, the burger was HUGEEEE!! I'm pretty small so this thing had to be cut in half.  I took one bite and it was mouthwatering esp with the egg that dripped down. Yummm.  The duck fat fries was like icing on the cake and complemented the burger really well. 

I had of course leftovers and took it with me.  This place is def worth checking out :)",2012-09-13 22:08:52,"{'food': ['burger', 'whiskey king', 'foie gras', 'burger with egg', 'duck fat fries'], 'drink': ['whiskey']}"
vaEOdUs5PPXI4Ev4FdIeqA,0u0rVD-x8QWzIYPyxVkT9w,IH_ZeeTh13jQURbh31d1Kw,5,0,0,0,"Egg and cheese with salt, pepper, Bui sauce. You truly can't go wrong. Friendly service and a little known fact-- you can order by phone!",2016-12-07 01:45:08,"{'food': ['Egg and cheese with salt, pepper, Bui sauce'], 'drink': []}"
v9B-u8KtC_6lLZrS0ac-5w,33q7YVUXixF1DIikw4qYEw,17Y8circEnkMMXKfLo8Ztg,5,1,0,1,"Such a gem in South Philly!  I love getting my labneh and other Middle Eastern goodies at this place.  Fill your cart with homemade dips, breads, spices and sweets and enjoy a full Mezze dinner!",2009-10-23 23:08:09,"{'food': ['labneh', 'Middle Eastern goodies'], 'drink': []}"
