review_id,user_id,business_id,stars,useful,funny,cool,text,date,ner_results
rgSuonZ-4AmHlIWJuPyHtg,YmfGjqIfGeDkfJVdsmg29Q,EtKSTHV5Qx_Q7Aur9o4kQQ,1,2,2,2,"Update -- Sadly I will not be returning to Village Whiskey. From the Philadelphia Inquirer:
""[Jose Garces' Village Whiskey] had more risk factors for foodborne illness than 99 percent of establishments inspected in 2014. [...] Seven inspections in a row at [Village Whiskey] found multiple serious violations, such as a food-prep employee's working with a cut finger, raw meat stored over produce, and egg salad held at temperatures hospitable to microbes.""

---------------------------------------------

I've always believed that if you're going to do a hamburger, you do it right.

Village Whiskey does it right.

VW's ambience is lively with an upscale vibe. But the space is cozy to say the least, so expect a wait if you just walk in. The menu itself is very short, so if you don't like hamburgers, fries, and whiskey, you should probably dine elsewhere. Or better yet return to whatever sad, burger-hating voodoo cult you hail from.

Soon, you'll find yourself sitting in front of a giant bun piled so high with hot beef and fixin's that you won't be able to pick it up neatly. You'll wonder to yourself, ""How did I get myself into this jam?"" before realizing that you're in 'Murica and that's the way we do it here.

The one to get is, of course, the namesake Whiskey Burger. The word ""no"" doesn't exist when a luscious colossus of magical maple-bourbon glazed cipollini, applewood smoked bacon, rogue bleu cheese, and foie gras-topped beef is staring you right in the face. Yeah, you're throwing down an obscene amount of money for a hamburger. And yeah, it's damn good. Village Whiskey's signature Duck Fat Fries are thick, dark, and full of dense potato-y goodness. They are also heavily seasoned, so you might want to have a taste before you ask for a salt shaker. Mmm! As far as beverage pairings go, I happen to like whiskey but next time I'll wash everything down with a beer instead.

If you're looking for something a little lighter on the palate, you might want to try just taking a nap. BUT if you're in the mood for something decadently sweet, then may I recommend the French Toast? Deep-fried mouthfuls of nut-creme-filled brioche toast, tart berry jam, and toasted pecans topped with fresh berries and whipped ricotta cream. Sweet tooth: 1, stomach room leftover: 0.

I'll take that nap now, thank you very much.",2015-12-10 08:08:05,"{'food': ['Whiskey Burger', 'Duck Fat Fries'], 'drink': []}"
eTO24SOjrlphG15ujmlQFg,lD0hzfmwR1ML6ct1gbHGkw,Oun4NN-u5yiHIxDqtJnxgA,5,1,1,2,"I had the buttermilk ranch dry chicken and an oatmeal raisin donut today.  AWESOME.  The guys are very nice in there and it was empty so I pulled down a stool and ate my dinner.  I had no idea you receive a honey donut and very small side of japanese pickles with the chicken so that was a pleasant surprise.  After eating, I couldn't help myself and bought 4 hot donuts, they gave me 6 just because, and I scarfed one down on my way out.  It literally felt like heaven in my mouth.",2012-03-12 00:47:10,"{'food': ['buttermilk ranch dry chicken', 'oatmeal raisin donut'], 'drink': []}"
tZ6ng4mktJH3MIR6bjFgHA,oW_bHLMTFS4gF6Bwm7i-1g,XQWZQjC73fCTRGWnD18-Eg,5,0,0,0,"Fast, affordable, delicious. Unique menu. Treated with kindness and respect. I would recommend for quick lunch or quick dinner.",2016-06-07 17:50:26,"{'food': ['Fast', 'delicious'], 'drink': ['Quick lunch', 'Quick dinner']}"
G8B9h2iEnxQ5qCp5bWN3qg,33R6iml_TDXcLMSAxyWQkQ,FnEkr6LzjuGsg93Z7fkl7Q,3,0,0,0,"As soon as I saw the logo for this bar I thought it needed to be on Bar Rescue. Misconduct Tavern with terrible cursive writing and a weird sailboat theme that doesn't go throughout the whole bar. They have a substantial amount of large tv's and i was able to watch the final four games, but it just felt like an odd place, with an odd name, and an odd theme. I will give the bartender props though because I asked for a Guinness Black Russian, told him what was in it and he made it pretty darn well.",2017-04-02 20:20:35,"{'food': [], 'drink': ['Guinness Black Russian']}"
jTnlkQ_1V52WRtTibr2W5A,0Ix1-2sokuGJeiJcB86JxA,ngvE1G9IckUO-ljZBFo23w,5,2,0,0,"Phenomenal takeout/delivery spot. I LOVE the lack of unnecessary fats, vegan options and great prices. I'm not a vegetarian, but I crave the mumbai dal on a regular basis. I've been getting takeout/delivery since they opened and have never been disappointed.",2015-10-21 21:08:34,"{'food': ['mumbai dal'], 'drink': []}"
ClTRyAprbjdvpQB_DhuhVg,-HApD45elUly42Ca6Girwg,1UNorskttXSWuEcgzKzXcA,4,0,0,0,"Philly has a ton of good mexican restaurants. 

Whereas many people default to all things Stephen Starr, I personally find gems like this to be the better options.

It's a great location in head house square, so you can bar hop before or after your meal.

The thing I like most is the use of so many fresh ingredients and some of the unique menu options

I would have kept it 5 Stars except they changed their menu some and the tomato and crab gazpacho that was incredible is no longer there.

But everything I have ever gotten there I enjoyed! Awesome guacamole well worth the review on it's own!",2011-09-04 21:28:49,"{'food': ['Mexican restaurants'], 'drink': []}"
HnZ__Oo8q-7UhQ8RGxFo-Q,T7Nb5pR1mqyANvGR6-xb-w,m4lkv5ksqtdXvlIVIftH_A,4,3,0,2,"Came here for Restaurant Week.  The lower level dining room is much smaller and more tightly packed than I anticipated.  Overall, I felt the food was good, but the portions were quite small.  My wife's scallops entree only came with 2 medium-size scallops.  Definitely didn't seem worth the $28 that they normally charge for it.  My short ribs entree was just 1 short rib.  Everything was on the small side.  However, we did notice that the table next to us ordered the Tempura Rock shrimp appetizer which was far bigger than any of the others.  My concerns about the many negative service reviews were unnecessary.  Our server, Harrison, did a great job and was attentive throughout the meal.",2008-09-20 01:39:28,"{'food': ['scallops', 'short ribs'], 'drink': []}"
5BWv1zO4PWvdpgpEh3_LHQ,qdZjFncnwu5Rz-JB_1sCNQ,17Y8circEnkMMXKfLo8Ztg,5,0,0,0,"While I have yet to try the prepared foods at Bitar's, the grocery items and customer service have me coming back on a regular basis. They a delicious selection of feta cheese, olives, pita and home made spreads. Everything here is delicious!",2018-03-06 16:11:18,"{'food': ['feta cheese', 'olives', 'pita', 'home made spreads'], 'drink': []}"
BNQ97kOeVwEzRy3fH1ZVMA,KhhlZrnwPbJsgLN5tNrIFQ,cXSyVvOr9YRN9diDkaWs0Q,4,2,0,2,It's nearly impossible to get a table at Honey's during weekend brunch. There's a reason for that- the food and service is just really top notch. I was able to sneak in one evening right before they were closing. I love that they have a lot of vegetarian options and faux meat products.,2013-04-20 14:43:41,"{'food': ['vegetarian options', 'faux meat products'], 'drink': []}"
ATZG7ntIuyC8QIzJNunCkQ,k3blBOULnhunws_RIH2Yfg,cXSyVvOr9YRN9diDkaWs0Q,5,1,0,1,"this place is great i really enjoy myself every time i go here. food is amazing. especially breakfast. would go here every weekend if i had that much cash on me. biggest downfall is that too many people know about it and that causes a HUGE problem for being seated in  timely fashion. but the it's worth the wait. the staff has always been pleasant to me and my guests, and the food never fails to hit the spot. cash only is annoying.

i would be up for going anytime.",2008-06-02 04:02:21,"{'food': ['breakfast'], 'drink': []}"
6UY9jd_1MrNtJDO_RwfNZQ,9u_Gpm5d40u81I3dOmvDYA,46_2e1hnQ4csLrYnhn6bkw,3,0,0,0,"Cute restaurant and bar.  Sat outside and did take awhile to be greeted but the shirt dark hair girl server was very nice.   Ordered the mussels and was not very impressed with the Bloody Mary sauce. Also was eaten alive, the bugs were out of control.  Would try again but probably sit at the bar.",2015-08-22 20:15:52,"{'food': ['mussels'], 'drink': ['Bloody Mary sauce']}"
pVOlB9r-u9WIL5BG82ODow,BmYbRP263eVeLNKNsZmBOA,9gObo5ltOMo6UgsaXaHPWA,3,1,1,0,"Atmosphere: 10/10
Service: 10/10
View: Incredible
Food: sub-par

Tried the trout and sea bass, both were overcooked and very bland.  The service was excellent, the wine recommended by our server was excellent, and the view is probably one of the best in the city.  Great atmosphere, very chic.  We will be back but probably just for happy hour.",2015-06-27 13:03:28,"{'food': ['trout', 'sea bass'], 'drink': ['wine']}"
tMrEMbZI-H29A1JsKfcX9A,RtlpPgo-fvTJsnmmkPzC5Q,C_EtrXTygRX5RTUOKtO6Dg,2,0,0,0,"Not the worst thing I've ever eaten, but I really wasn't impressed.  The food seemed like someone put in the bare minimum of effort to give a vague incarnation of what mexican food might be.  Service was fine.  It is extremely loud in there.  Like, party of 10-15 people screaming, loud.",2011-08-31 22:25:30,"{'food': ['mexican food'], 'drink': []}"
8_9vkI1JGlkrJI6a5OTKGw,ikIT45t6zrQQ55JBoozHFw,2er_V-oAd7IbQ5YTY56r7A,5,0,0,0,"Wonderful casual spot. Great for a date night, without being too formal. The noise level is comfortable. Best thing, they have the impossible burger. It's by far the closest to real meat that I've ever had. The portions are large too. If you get fries, get the smoke sauce. It's the best! The service is great and never seems crowded.",2017-12-08 00:02:06,"{'food': ['impossible burger'], 'drink': []}"
3QaKipmK3RliyovWLw-Wvg,qb93lt68RXCsrmAc9AYJeQ,VJEzpfLs_Jnzgqh5A_FVTg,2,6,2,0,"This is an all-around 2 star place in just about every way you can imagine. Absolutely nothing stands out about it except for the few things that I disliked.

However, they are conveniently located RIGHT across my apartment. That is pretty cool and I was excited to see a Thai restaurant so close by, even though there are already quite a few Thai places in Center City.

The fact that they set up shop in a nice little neighborhood is attractive, but I feel like the novelty of this place stops there. 

The inside looks pretty lively most of the time which is inviting but the decor and set-up is rather plain and almost cafeteria-like in nature with its ordinary red picnic-tables and somewhat bare walls that even display an elementary school style fire-bell on the wall. 

The tables have no place settings, no coasters and no glass top either, although they are polished well.

Tables are somewhat close together but not so much so that it's annoying. The table all the way to the far back left corner however is poorly located right in front of the cash register. Not only do you get to hear ever other table being rang up while you sit there but if you're lucky you get to overhear some of the very unprofessional comments and discussion of the staff who think that no one can hear them. No matter how friendly they are to you and how well you're served, they lose a little of that customer-service friendliness when right after they say please/thank you, they walk two feet away from you and stand there swearing and making comments you'd hear on the street. Just because they aren't aimed at anyone in particular makes no difference, it's just plain rude and unprofessional. 

As for the food- it's what you would expect of a random place like this: It wasn't the best Thai food I've ever had and it wasn't the worst either. At this point it's so widely available I feel like any place that is just NOW opening a Thai restaurant needs to bring a little something extra to the table. Jasmine Rice doesn't really do that and that's why it's a cute but forgettable experience that I can't really recommend to anyone else.",2012-01-09 21:00:36,"{'food': ['Jasmine Rice'], 'drink': []}"
oTyepPW-BRyqoPxFXm9jag,hizNLiiKZAfu9Fi-Z0Qv-g,4_W5pstoN1166TGjjPOrMg,4,0,0,0,"came in the other night to grab a beer and some dinner. i was pleased with the shrimp appetizer(happy hour special i believe) and the macaroni and cheese entree(expensive though, 13$) service was good too, personable staff i would say. def would come back....",2012-03-08 02:28:49,"{'food': ['shrimp appetizer', 'macaroni and cheese entree'], 'drink': ['beer']}"
KgS-l6kQSKdkrLLiYTVsOQ,i84YDhPbxtq9F8ipmtR5vg,EtKSTHV5Qx_Q7Aur9o4kQQ,5,1,2,0,"I've found burger heaven! (Whiskey heaven, too!) Where is this, you ask? The corner of 20th and Sansom. Gosh, I love this place. This is a place to recommend for a really, really good burger. There's a reason why there are only two options for salad. YOU COME HERE FOR THEIR BURGERS. (Let's see how many times I say (type?) burger in this review).

My burger of choice? Village burger + cheddar + avocado + bacon + fried egg. Yes, the burger is $12 and yes, my additions are a whopping $9, and yes, I don't care. When you receive this holy burger in all its glory, it truly is amazing. Look at it from all sides. The burger is cooked to perfection, the avocado is ever so gently laid upon the cheese. The bacon? Crisp and beautiful. And the fried egg. It knows that it will cover your burger and  keep teasing your taste buds with every bite. Oh, and it comes with pickle. A very jealous pickle since the burger gets all the attention. If you instagram this burger, you'll get more likes than your best selfie. #yourewelcome

To complete your experience, get the tots and duck fat fries. I mean, since you already spent $$$ on your burger, why not go all out? The cocktails are interesting, and I've tried a few of them. But let's not get too crazy here. My review is about the burger. One of the best I've tried in Philly.

Word count for burger: 15.

I'm obsessed with burgers. Oops, that's 16.",2013-12-12 02:19:01,
4NBMUGLJv4V9qjFw5ab23g,W-47MR70cVEe09Hil6KNkA,htO_nlxkEsYHzDrtbiUxew,5,0,0,0,"Google maps called this place ""hipster"". I am going to call it ""international."" Great vibe, half the people in line were speaking other languages or accented English. And yes, there was a line...but well worth it.",2014-04-06 05:25:02,"{'food': ['international'], 'drink': []}"
IBdZVL9Q2-6bj58hiTapXg,z3jpMmKxzC22XCOITuMkpw,7yPzOek7Af2dKWGYKpcHWA,5,0,0,0,A lot of food for your buck and it's more than delicious. I'll be back as soon as I can. A must. Heck out of you like a little sweet and a little kick of spice at the same time.,2017-06-09 21:34:25,"{'food': ['food for your buck', 'delicious'], 'drink': ['a little sweet', 'a little kick of spice']}"
E-gALmWKJuv0-Boo3-fmuw,5_Az8sa4oj01IGlkIWaTMw,XpTNCVbO5wL1DtDyKzKqfA,5,2,1,2,"BEST BAKERY EVER!!!!  There apple clams can put my apple pies to shame (and I make a good apple pie).  Once I had one of their chocolate frosted doughnuts, I kissed Dunkin Donuts good bye.  They butter cream filled doughnuts are to die for.  Get their early because they sell out fast.  And they are insanely cheap!!!!!!!!!!!!!!!!!!!!!!!!!!!!  Buy a lot for a little.  Can you say addicting?",2010-07-25 23:57:48,"{'food': ['apple clams', 'chocolate frosted doughnuts', 'butter cream filled doughnuts'], 'drink': []}"
ECdbSVJUmAiPySGXdhv1Lg,XqKrvSHKHRwrUxDVxMihGg,Dv6RfXLYe1atjgz3Xf4GGw,5,1,0,1,"I'm not a vegetarian but their Crispy Hipcity Ranch is one of the best chicken sandwiches in the city, real chicken or not! It's also artfully packaged-- it took me a while to figure this out, but if you open the sandwich wrapping sideways bit-by-bit it'll keep your hands from getting messy while you eat. It's a circular wrapping, hard to explain but works like a charm.",2016-08-10 19:21:51,"{'food': ['chicken sandwich'], 'drink': []}"
EhtJVBPFJqVWB6FEZ5FQQg,gb8UDnHlu3XjcjwZryVNPA,Gw7UW0E2BguzL9suQnwDeg,5,0,0,0,"The burgers at Spot Burger are very amazing and good. I usually order burgers for takeout. The side dining area with the high chairs is pretty neat to eat at, you can actually see your burgers being made. Definitely give Spot burgers a try. My only suggestion is a wish they would have more of a selection of craft burgers, and also carry Crispy chicken sandwiches and buffalo chicken sandwiches.",2017-02-27 10:30:54,"{'food': ['burgers', 'chicken sandwiches'], 'drink': []}"
5zEAqTcUbx4m8W_nsr0nBQ,mK6MaS9ovaV9L1HQQ6NuFA,4SQ5uczVt66-GGGeNQRfEA,4,1,0,0,"The Philly cheese steak sandwiches are phenomenal, and I loved the salad that came with it too! 

You have to climb up a staircase to get to the eating area unless you eat at one of the few tables outside. The eating area has a big TV, and it's a bit cramped in there. Wood chairs and tables. None of the large tables were clean when we got there, but our waitress quickly cleaned ours. As a bonus, there was an outlet by our table so we tourists could charge our phones.

Friendly waitress, great food, ok eating atmosphere. I'd recommend it.",2014-07-05 18:28:45,"{'food': ['Philly cheese steak sandwiches', 'salad'], 'drink': []}"
ao1x4rgcGGcHrgmqvR6zig,IpLRJY4CP3fXtlEd8Y4GFQ,pj8Y-5vfbRitnnm2xJFH9w,3,0,0,1,"OK... not sure what all the negative reviews are about, but I like Jerk Hut.  Their food is your typical Jamaican cuisine.... I like their jerk chicken or jerk shrimp platters with cabbage and plantains, but the steamed fish is my absolute favorite!!!!!!!!!!!!!  Also, love the Dunns River wings.

And of course, you have to have TING when you eat here!!!!!!!!!!!  Yum. I think I'll eat here this weekend.",2010-03-23 21:07:36,"{'food': ['jerk chicken', 'jerk shrimp platters with cabbage and plantains', 'steamed fish'], 'drink': ['ginger beer', 'ginger beer', 'ginger beer']}"
uwcjbjN0s3ADImn8iUlXtA,Tx1KmPy4NaQg2cDTsDXoUA,DJJtybSWY0BygESsSrabqg,5,3,0,0,"This place is as authenticity South Philly as you can possibly get. Hot dogs are prepped by hand (and arm) and get to your table or counter seat quickly. The ""works"" features a sauce with fresh onions and mustard inside and is flawless on a hot dog. Paired with a root beer and you have again as authentic a South Philly style lunch as humanly possible.",2015-10-27 17:50:17,"{'food': ['hot dogs'], 'drink': ['root beer']}"
x1G3SitGNDNLETDahcaxLA,YXa04oicSU0lnCAfUstJQg,MbKhuO-4uYPc0NRZDRWoew,1,3,0,0,"Okay so first off the food here is amazing, just saying. BUT the owner is a jacka**. Completely. All I wanted was a quesadilla with beans on it, and the owner said ""no we can't do that here,"" and when I asked him why I could not get beans on my quesadilla he replied ""I could explain that to you but I don't want to... we don't have waitresses taking your customized order here."" He said this in an extremely condescending tone and was extremely rude as well. I ended up canceling my order and will never go there again while he is there. I hope a better and nicer individual buys MexiCali from him.

Sincerely,

Disappointed Customer.",2012-04-10 21:29:39,"{'food': ['amazing', 'quesadilla with beans on it'], 'drink': []}"
Hr2EHg7Mf7Eb7YRHdsqc-g,g1YYZRklnq_BzKdaAaZ5eA,GmJDCmDhtKbjofeO35yBrw,5,1,0,0,"Just got a really good buffalo chicken salad. It was very fresh. The fried mushroom Poppers were good too. I didn't like the sauce they came with though.
Will order from again!",2015-06-25 23:58:34,"{'food': ['buffalo chicken salad', 'fried mushroom Poppers'], 'drink': []}"
0YzWYGtM7Q12Gtml_VuE3Q,BaXJWlhCFa2niZjyhivCfw,t5RIuLUvE5fxr0TaRWxeQg,3,2,0,1,"After reading the good reviews on here, I was excited to go to Il Tartufo (since I have a food blog and go places based on what I read).  In summary, the food was decent but OVERPRICED, with our own wine, 3 salads and 4 entrees it was $124.00 +tip. Not cheap, and prob wouldn't go back due to the terrible service.
To read more:
http://philly-phoodie.blogspot.com/2010/01/long-awaited-il-tartufo.html",2010-01-31 04:13:51,
iIp8T9CldnumLzlchvG3bA,bCsS9EJOBTIxRGiqixB5rw,DRr5xdfHtqgWfhmdTU1B8Q,3,0,0,1,"Review for Brunch-

I am not a big fan of brunches because I dont like sweets as entrees, and lets be real- I can fry my own egg at home!! So I was pretty excited when I saw the brunch menu which included korean fried chicken and burmese braised pork bellie with soy sauced egg. My kind of breakfast!! My friend (party of 6) also ordered the pork bellie and we were both super disappointed. The dish was drenched in sauce, making it so salty that it was impossible to eat...I mean, I ate everything, but I am abnormal and NEVER waste food. I am 100% positive that a normal person would be unable to tolerate the saltiness. My other friend ordered the pancakes and he said it was so-so. 

On the positive note, the restaurant has an amazing bloodymary selection where you can create your own bloodymary mix. So if you are in the mood to experiment what other flavors compliment tobasco sauce - go for it!",2013-03-28 02:18:30,"{'food': ['korean fried chicken', 'burmese braised pork bellie'], 'drink': []}"
odjVgt9DfJuwQDsEgWXK7A,ZGjgfSvjQK886kiTzLwfLQ,cXSyVvOr9YRN9diDkaWs0Q,3,1,1,1,"Though three stars seems low, I'm going by the Yelp modifier A-OK, because I think that more or less describes Honey's. It was solid. But, considering the absurd number of glowing emphatic reviews, it didn't meet my (sky-high) expectations. 

I went with Jack I. (the man) and Matt L. (both of whom have beaten me to the reviewing punch) and ran into Monica S. outside (which, of course, spoke highly of the establishment). We survived the wait, and were seated at the counter. 

I was really really really excited for a) grits and b) the much-lauded latkes, so I ordered something relatively healthy and boring as my smokescreen. Turns out my smokescreen was better than both. The grits were good for the first couple bites then got a little thick and gelatinous, the latke was fine, but not really a latke. My biscuit was too dense. Sigh. But the omelet was yummy, and I am intrigued by the huevos rancheros. 

It was a good brunch, nothing really to complain about, but nothing I would write home about either, so it didn't live up to the hype. I will give Honey's another try, but my brunch allegiance remains to Sabrina's.",2010-01-24 20:56:19,"{'food': ['grits', 'latkes', 'omelet', 'huevos rancheros'], 'drink': []}"
efz-guAGhv3t-VbK1GKFgA,IpLRJY4CP3fXtlEd8Y4GFQ,7crp8LZA4HbkMAKyh8Wcdg,2,1,0,1,"This review is strictly for the delivery service.I used to teach in this area, and I ordered from this place weekly.  Sometimes I would have my students go down and pick up my orders for me when I was unable to leave the classroom.  Well, one of those times, I had my students pick up the order, I was supposed to get $10 back in change. I sent a note down with my students saying that his tip was $4.00 The delivery guy took it upon himself to pocket ALL of my change.  Mind you, I tip... and I tip NICELY, but I d-mn sure was not tipping him $14.00.  This made me angry, to know that he really thought he deserved that much money for coming around the corner and dropping off a cold box of pizza.  

As for the food, it's ok.  The pizza is good, when it's HOT. TWICE I ordered from them for my class pizza parties and it was delivered to me ICE COLD. They also make good strombolis and chicken cheesesteaks.  Not a TERRIBLE choice, if you MUST order from here, just count your change if you get delivery.",2016-09-22 18:03:27,"{'food': ['pizza', 'strombolis', 'chicken cheesesteaks'], 'drink': []}"
jcEm6z4edqUncCXBobaJcw,2_UmQTRPbpqKNQUdPDxZrA,hoYHhfn4w0mVjI60eHDHzA,5,0,0,0,"I can't get enough of this place. I literally order it every time I am craving something healthy, but delicious and filling. I used to get the small bowl, but for a few bucks more, why not get the large?? It looks small but it definitely fills you up.

I custom fill this large bowl with 2 scoops of raw tuna, 2 scoops of raw salmon, and then 1 scoop of whatever other delicious protein I'm feeling that day, along with mango, seaweed, rice, veggies, and sauces. I usually top it with a dab of soy sauce and dig in. 

Lazy pro tip: they're on Uber Eats!",2016-12-07 19:09:15,"{'food': ['raw tuna', 'raw salmon', 'protein', 'mango', 'seaweed', 'rice', 'veggies', 'sauces'], 'drink': []}"
_VXeXycEAGP-6KfNZbI3sQ,dIKGGMYW2SocsGVqp2ZXCg,wUnLSg_GKfEIQ5CQQ770_g,5,0,0,0,"This was one of the most amazing meals we have had in a long time. We went here to celebrate our 19th wedding anniversary and it did not disappoint!  
The food was spectacular and an incredible value. 
With a chef's menu, it's often a concern if the portions will be substantial -- my husband is an ultra-marathon swimmer -- but there was more than enough and then some. 
The service was second-to-none and the atmosphere was graciously superb. 
I had the wine pairing and it was outstanding. Just the right amount and exactly the proper compliment. 
We have had a place in Philly for years and I cannot believe it has taken us this long to get here. 
I promise you, Vetri will never disappoint!!",2018-03-19 01:20:54,
