review_id,user_id,business_id,stars,useful,funny,cool,text,date,ner_results
hNRtTbs5HOdqJC-ZxXDXQg,3Zl3RokY8eyRJQbbQmuOuA,1UNorskttXSWuEcgzKzXcA,1,6,2,1,"Offensive.  Flavorless pre-made guacamole in a tiny bowl.  i've been robbed less at overpriced restaurants in manhattan.  what really got me was that it turned brown by the time we were down to the last chip (tops 10 minutes).  pampano, mama mexico, even dos caminos makes fresh guac at your table to order.  are you serious ""So-Cheet""?  within the first 20 minutes of being at this restaurant, i can understand why they did an opentable spotlight.

The housemade chips aren't overly greasy and they're the perfect thickness, but is all that salt necessary?

The mushrooms in the tamale were tasty, but I thought the strong cheese didn't fit in, I could barely taste the pasilla chile gravy or house crema, so I can't say they added much.

Extremely dry, tough and tasteless short ribs--maybe this was the ""lean kind"" but it was really really dry/tough.  the golden potato gordita was great, but the roasted garden veggies were soggy, soaking in sauce, and just as uninteresting as the short ribs.

Completely dry and tasteless chicken (the special ""pollo frito"")--$25 for a half-chicken, are you serious?!  i made a more tender chicken breast on a fry pan the other night.  (entrees were $30 post-tax across the board--at those prices, I'd go to one of the amazing BYOs Philly offers)  24-hour brined does not make dry chicken!!!

The doughnuts were an incredible disappointment.  the chocolate sauce and whatever fruity sauce (they called it strawberry) they brought out seemed like they came out of a can and a film formed on the top of the chocolate almost instantly.  they should learn a thing or two from the stanton social.

I would give this place 2 stars but for the fact that the service was pretty terrible despite the very nice disposition of the waitress.  finished glasses and plates were not taken away unless we stacked them on top of each other and placed literally on the edge of the table.  the restaurant was hardly full so there was no excuse.  i specifically asked for no salt on my margarita, but surprise surprise, it came with salt.  my friend's first drink of the night never got cleared from the table--with 4 people at the table, are...you...for real?  i can appreciate paying happy hour prices for these drinks, but aside from the fresh ingredients like lemons, limes, mint, truly nothing to warrant the $10-15 cocktails (the cocktails go up in price from there).  the flights of tequila we tried were delicious but they could not make up for the fact that the food sucks.  sorry for the bluntness.",2012-03-03 06:10:39,"{'food': ['doughnuts', 'short ribs', 'chicken'], 'drink': ['margarita', 'cocktails']}"
XXXvvbU8njqPRqGMWktZ2w,gXGIn3b76mNOQu9_xqA1zw,SPWyzJPFP2TT7x0BsqaBqQ,3,1,0,0,"Loved the outdoor patio - cosy and private and decked out with bright garden furniture. However, that's pretty much the best part of it and the only reason it's getting 3 stars and not 2. I was excited to try out this place which is right by the Piazza at Schmidt's but rather disappointed.

The menu was limited and there was definitely some false advertising on the part of the restaurant because the website indicates ""all you can drink bloody marys and mimosas for $20 + 1 entree"" but when we arrived the waitress told us $25. 

The food was ""meh"". I was unimpressed by the turkey bacon benedict I ordered, and the egg white omelette and salmon benedict the others ordered were all quite bland. Not worth a drive up to this place if I can make a better brunch myself! If I do head out here again, I'd probably try the other outdoor brunch places nearby instead.",2011-06-30 14:21:40,"{'food': ['turkey bacon benedict', 'egg white omelette', 'salmon benedict'], 'drink': []}"
Uvf3nmvKZ0gkpOIMtkOB6Q,mlCU1dITrXxLUxfezsnMXw,Z5po0aTuzKKblek5y6Sp8Q,4,0,0,0,Want a fast food greasy burger? This is the place. It's definitely on the pricer side of gourmet fast food. But there's speciality burgers and they got those skinny cut truffle fries. Burgers are made to order. Also got the banana milkshake and it was good. None of that gross artificial banana flavor. Go here if you're hungry. Next to Rumor. Yay.,2015-06-09 01:14:52,"{'food': ['burger', 'fries'], 'drink': ['banana milkshake']}"
745-gYuM445zf1AiTUCcsw,2ZV0izokgGrQStHORL2ycQ,V6Om7YZhlRQRU7WfuxHq8Q,4,1,0,0,Food was good overall but not out-of-this-world! Ordered the fried shrimp platter with red beans & rice which came with cornbread on the side! Tasted great but I wish they gave you more shrimp and larger shrimp too. Also ordered a jambalaya bowl and fried mac n cheese to go (both solid!) and tried my friend's Train Wreck sandwich (yummmm!). They have a very strict policy when it comes to not allowing take out customers to sit at the counter. I saw a few takeout customers turned away and they were not pleased but there's also signs all over the place! Special shoutout to Kate who took care of us while we dined in!,2016-12-05 00:50:41,"{'food': ['fried shrimp platter with red beans & rice', 'jambalaya bowl', 'fried mac n cheese'], 'drink': []}"
DzDMIT0OD-bJHuK74kI5Mw,E5d30UjstDvJwvoaWtX2QA,u9XTeDl_If4U5Eixl6ys7g,5,2,1,1,This Foodery rules.  They have so many different kinds of amazing beer.  They also do a lot of taste tests there.  There is an area for you to sit down and drink the beer you just purchased which makes it cheaper than going to a bar.  They also have pint glasses in there for you to drink out of.  It is so nice in there and the service is super friendly.  If I ever live in Northern Liberties I'd spend way too much money tasting all of their delicious beers.,2009-03-11 16:43:57,"{'food': [], 'drink': ['beer']}"
QSFB43FA2CdFL0sMqLw_YQ,TzSAS82oFrJlrsGAmjoWLg,SiHnuDYGCzm4NeMQILPyzw,4,0,0,1,This hotel is nowhere near as bad as the reviews say. I was on my way here wondering how could the hotel pics and the reviewers pics be completely diff. I arrived and granted the entire hotel looks better than the rooms but it does not look dirty the blankets look fine it has a fridge and microwave idk what the problem was,2014-04-23 16:07:02,"{'food': [], 'drink': []}"
c7XKzKPxe2jj3tDdHvCodw,wqpOzrwDfuJ5UHzt6R5U9A,JUlsvVAvZvGHWFfkKm0nlg,4,0,0,0,friendly waitress. large variety to choose from on the menu. great mix of southern country music and food with Mexican music and food.,2014-01-22 07:48:43,"{'food': ['large variety to choose from on the menu'], 'drink': []}"
PxNONYQFbBkCBBUzkgtVAw,IbCZqWTWkp86qzDZMN3AvA,hUX1yAimviBIhb21D_KtcQ,1,2,0,0,"This was the worst Mexican food I ever had in my life. Taco Bell is more appealing. I knew from the chips and salsa that it wasn't going to be good and I should have left but didn't. Playing it safe, I ordered chicken quesadillas but they were awful. It seems like they use a mix of cheeses and it isn't good. Service was good and prices are reasonable but the food isn't edible.",2013-10-07 20:09:44,"{'food': ['Taco Bell', 'Chicken quesadillas'], 'drink': []}"
LAyYuZfa0azsfVz2hTmn4g,T4mE0BuH7AYBkqo0bADxmQ,7lwe7n-Yc-V9E_HfLAeylg,4,0,0,0,"First things first, the SANGRIA (fabulous, wonderful, delicious, etc!)

A last minute decision for the boyfriend's birthday turned out to be a WONDERFUL choice! Bells brewery was there and their $40 food & beer pairings were beyond spot on, couldn't compliment them enough on it!

It was the groups first time there and it was a great, close atmosphere to sit close, chat, and share all of the wonderful food! Sometimes there is nothing better then small candle votives, a soft breeze blowing in the open windows, and the true feel of a pub out in the country side.

Everything on the menu was possibly ordered from the cool avocado soup, to the hanger steak, right on down to the macaroni & cheese. Oh, and of course someone ordered the famous burger, and yes, the positive rumors proved true, it was delectable!

A wonderful atmosphere for both the couple looking for a quaint night out and the rowdy group looking to satisfy both hunger and thirst! Only thing I am a bit verklempt about was not being able to sit and have a pint at the bar! Next time though!",2011-08-01 14:08:05,
nwZI4SxDtblzjTV1Whnabw,N5Eow642OX-KS70OLl8dAg,u7_3L1NBWgxhBM_B-cmmnA,3,0,0,0,"Good pizza, but what's with burning it all the time? It is a shame. It would taste so much better if you didn't burn it.",2016-10-16 02:37:22,"{'food': ['pizza'], 'drink': []}"
XMywg765UMEcKRuuQn_NGA,ORMTaB0B6R1z_KwYIRMUiQ,x1CpCXik31TwTtMPMcrcug,4,1,1,0,"I was skeptical because I couldn't get my pick-up until ""after 4"" because they don't begin making the pasta till then.  I was pretty impressed that the food was ready at 4:10, when the server said it would be freshly made and ready.  I make my own pasta at home all the time, and this particular batch wasn't in the long strands like you can get in a store.  I mention this because someone who's a little picky may take issue with that.  I loved the giant meatballs and I can't believe that my meal came with an enormous and delicious foccacia that I finished off with a friend.  
I come to Philly all the time, and I have a whole hit list of food when I'm here.  A Tutti has made the list, which is a big deal because I have limited time, and it's worth making space!",2018-09-18 01:40:58,"{'food': ['meatballs', 'foccacia'], 'drink': []}"
ygyTHN5njpEuQUSo4cE_IQ,mzL0zHFGyd9866OUljq49g,K8b2MQ5Az59-nzvqUfjJEQ,5,3,1,1,"This meal was positively lovely.

We arrived on a Friday evening a bit early for our reservation.  The table wasn't ready yet so we sat outside on their small bench and the server who greeted us brought us some water.

Finally at our seat we perused the menu and settled on the heirloom tomato salad (feta on the side) and the bloody beet steak (yogurt on the side)  Both dishes were as excellent to taste as they were to look at. If there is something they know here, it's wow factor with food.  They have great presentation.  The beets were perfectly cooked and I love the play on meat even though it didn't contain any.  Each dish stood on its own and was rich but not overpowering.

For my entree, I went with the short ribs.  I expected tender short ribs but I was blown away by the sauce and the sides.  This dish was a symphony of flavor and even though I don't eat much meat these days, this dish was easily up there with some of the best I've had.

Service was excellent and they kept both our water and our beer glasses full (we split a bottle of Pumking)  This restaurant was an excellent way to begin my labor day weekend and my plan now is to come back for the squid ink pasta.

F & F, you've got a new fan.",2013-09-09 01:42:15,"{'food': ['heirloom tomato salad', 'bloody beet steak', 'short ribs'], 'drink': ['water', 'beer']}"
5ATmL5W4TROMSThg9LjM7Q,mZL0EfP_cGs1KAGPxp1XLQ,DsKzHnkLKnxZTVsFpts4oA,5,0,0,0,"A great new bar restaurant right across from Independence Hall,  our Founding Fathers would have been proud.  The food was excellent.  Service and decor also very nice.  Craft beer selection seems decent enough, however I always believe more beers should be available on tap.  A bit pricy, but it is center city.  Overall a great place that I would def return to,  cheers!",2012-11-15 11:15:59,"{'food': ['food was excellent'], 'drink': ['craft beer selection seems decent enough']}"
a_2X8Gjy-f3BlvFXSSWLLg,FhIWszvePmXn0cob0XC3Qg,mUIBtlWNPD7sz3rGGWQ1RA,5,0,0,0,"I love a restaurant that gets it right and this one definitely does.  The food is outstanding, fresh, delicious and creative.  The service is super friendly and knowledgeable.  You get the feeling the wait staff loves working there.  And it's BYOB which helps with the bill.  We have bought wine and beer on different visits.  Food goes great with either.",2012-09-16 20:28:19,"{'food': ['outstanding', 'fresh', 'delicious', 'creative'], 'drink': ['wine', 'beer']}"
6xekNSEk6JgI9BoZO33_lA,EIX_bsa_9G3C7Lp8VaqDCg,2er_V-oAd7IbQ5YTY56r7A,5,1,0,0,"Awesome burgers! Organic, grass fed meat, what else could you ask for! The service is great too! Oh, I forgot to mention the milkshakes!

Ron is best looking server in the world!!!!!!",2014-09-26 23:13:31,"{'food': ['Awesome burgers!'], 'drink': ['milkshakes']}"
0XZnKOCICSbsBTz2DiLTVQ,6MSoU_MTwg1tRqPVdCw40Q,JUlsvVAvZvGHWFfkKm0nlg,5,0,0,0,"The margaritas are fantastic, the nachos and queso fundido are great, and the pulled pork and the seitan cheesesteak sandwiches are delish. But what is truly magical, and the reason I will keep coming back forever, are the pig wings. Thick and meaty, perfectly seasoned and sauced, and meat so tender that it literally falls off the bone (it has happened every time I've ordered them).

Other pluses include the outside tables where you can be away from the crowd but still people-watch and enjoy the nice weather while it lasts. Plus, we've brought our dogs to sit with us several times, and they had a great time (the servers were even thoughtful enough to volunteer to bring them a water bowl and fill it for them).  If you're looking to relax and fill up on fantastic BBQ for not much dough, head over to Camino.",2012-05-31 14:46:34,"{'food': ['margaritas', 'nachos', 'queso fundido', 'pulled pork', 'seitan cheesesteak sandwiches', 'pig wings'], 'drink': []}"
gOLijH84xpwAQquXqU-5IA,Jt3GylPuH64uA3zTdbMdCg,MbKhuO-4uYPc0NRZDRWoew,5,2,0,2,"BEST BURRITOS IN UNIVERSITY CITY, HANDS DOWN!  AND THEY'RE NOT FROM A CHAIN! 

As if that doesn't sum up how I feel about MexiCali, might I add that the owner, Jane, is extremely friendly, personable, and accommodating when it comes to modifying menu selections to one's preference--beans and I are not friends, and I'm not a big fan of salsa, but my standard is a chicken or tofu burrito with rice and cheese, usually in a whole wheat tortilla.  Also planning to try the sweet potato and plantain burrito sometime soon.  Every single time it hits the spot, and for the size of the burrito, the price is definitely worth it!  How ironic that I recently reviewed both of the major Mexican restaurant chains in the neighborhood and thought I'd be returning to them often...then I tried MexiCali and that all changed...I've found my new go-to for burritos!",2012-07-18 09:43:09,"{'food': ['chicken', 'tofu'], 'drink': []}"
wMQB9XCjJt-kbvBPWH5zUw,1TVFpuoMj2Xed9k9Q7VrUA,BWITd9JUXP3gSi1z3Y-z8g,4,1,0,1,"Great pizza, good beer, fantastic outdoor deck, lovely staff, dog dining area.... Can't fault this place. I'm now a regular.",2014-07-28 04:29:19,"{'food': ['Great pizza', 'fantastic outdoor deck'], 'drink': ['good beer']}"
S04PwTjaARQJZTs6d--coA,Zywg_JbfMjlGI0tWVhqNKw,PxEiXqMAzzvp8GFlb5EoLg,4,0,0,0,"Just passing by and decided to stop in.  All the food looked good and decided to order the chicken and waffles which were very good and hit the spot.  Also, got a bourbon Bloody Mary - a first.  Not crazy about bourbon but somehow it worked.  The menu has a number of items that were appealing and one day I should be back.  Waitress was very nice, casual and friendly.",2017-04-30 19:52:07,"{'food': ['chicken and waffles'], 'drink': ['bourbon Bloody Mary']}"
hnhd_wYRFJG7HXCcAN8MAg,bIsW255vsUMdZYk_IV7Xhw,j99PtxlKTW_u5alE4jiqHQ,5,8,7,9,"Newer is always better, but not in this case.  

Not much has changed in over a 100 years of service at Ralph's, and that suits me just fine. Sure, it's got the prestige, the history, the classic neighborhood feel, all of which really complement the food & huge wine cellar very well.

Besides the suggesting the pastas, some notable orders I would recommend:

Meatballs - delicious traditional seasoning
Eggplant Parmesan
Calamari in red sauce
Mussels in white sauce

Five stars for italian fare, you ask?  Why yes, because the food is that good.  There's few italian spots that I really recommend, but Ralph's does it well and should be a must try for anyone willing to shell out a couple bucks more than you'd pay at a chain restaurant.",2013-01-03 00:03:10,"{'food': ['Pastas', 'Meatballs', 'Eggplant Parmesan', 'Calamari in red sauce', 'Mussels in white sauce'], 'drink': []}"
1B8dKMh7L95cAzMbFi9dtQ,mh-FtXRIT8pBymSV7FlKfA,BWITd9JUXP3gSi1z3Y-z8g,4,0,0,0,"In Riva is conveniently located off of Kelly Drive near the falls bridge. We came here around 7pm for dinner and drinks. We heard they have a great happy hour but were too late this time. 
The food came out promptly and was delicious. We tried the margarita pizza, the edamame crab ravioli and the meatballs. All were great and sharing was a great choice so we could sample everything. We also has their signature drink the Riva Spritz which was really refreshing for a summer night. We sat at the bar which was really busy---they had one person making drinks for the bar and the entire restaurant.  Our server was very friendly despite being noticeably busy. Would definitely return to try more menu items.",2016-08-05 00:23:14,"{'food': ['margarita pizza', 'edamame crab ravioli', 'meatballs'], 'drink': ['Riva Spritz']}"
rLVJ-qlZsG0KLyoOaHZKZw,meSxukeC8mECIZTPzVxIIA,FHNIvNgh3fS7VZQq2Y3dsA,5,0,0,0,"Cheu's has to be one of the top 5 meals I have ever eaten.  Everything about this place is amazing, from the food, to the service, to the signs in the bathroom.  If I didn't live 600+ miles away from here, I would be here at least 2-3 times per week.

My dining companion Liz and I set out on a mission to try as many items as we could in one meal.  We succeded. We ended up enjoying the nightly dumpling special (among the best I have ever had), the broccoli, the black garlic wings, all three of their buns (get the pork belly), the Boloanasian, and the brisket (complete with a matzo ball).  To top it off, they have daily, fresh pressed juice concoctions that you can easily throw a few shots into.

Each dish was just as amazing as the last. Of all of the great eateries in Philly, this one shot right to the top of the list.",2014-06-13 12:40:55,"{'food': ['dumpling special', 'broccoli', 'black garlic wings', 'buns (pork belly)', 'Boloanasian', 'brisket (matzo ball)'], 'drink': ['daily, fresh pressed juice concoctions']}"
XCm1dyZtPCPqPL-Cb1e7TA,rJW56eg7OSCsOhL1Dc-3QA,Dv6RfXLYe1atjgz3Xf4GGw,4,0,0,0,"I fell in love with the curry tofu wrap, mediteranean salad and the banana whips instantly. Many of the menu items seem a bit heavier than what I would typically eat which is why I don't venture to far across the menu items but, what I did have, I raved about and went back many times for.

I get a banana whip every day on my way home from the gym (obsessed!) and it would be great if they were made a little quicker since, it can become pretty cramped in there to wait. The free water with fresh citrus slices definitely helps ease the wait time.",2012-07-18 18:53:37,"{'food': ['curry tofu wrap', 'mediteranean salad'], 'drink': ['banana whip']}"
ZpMHtJ5HGdgtM98gI8Ul5w,IzND1LXhw5vxIwYWASK5xg,F8yozE3NWnImNApHO347gQ,5,0,0,0,"I've always been adventurous where food is concerned. Growing up in a multicultural paradise allows you to try new things all of the time. My husband can be a little hesitant, so when I described this place to him I promised that this experience would be worthwhile. As the driver dropped us off, we began to worry that we were in the wrong place until we saw the sign. You must knock and wait for the doorman, who is an extremely kind man. Once there is available space, you are whisked into what almost feels like another world. The smells, and small intimate settings alone made me happy. We were taken to the top floor and placed in a dimly light room with two other parties. I was worried that this would be awkward or ""too crowded,"" but everything turned out fine. I had mentioned to my husband that they only accepted cash, and that the meal is 25 per person. Upon seeing this price in reviews I wondered if we would be full after the meal. We were full by the third course! There are technically seven courses (but some would not count the dessert of fruits and baklava as a course). There are no utensils, but that didn't stop us from digging right in. I started to wonder if we would get a visit from the belly dancers that seemed to only exist downstairs, when suddenly we heard cheering from the next room and moments later she appeared in our doorway. From beginning to end this was an experience we will not forget. Thank you Marrakesh for an extremely memorable night.",2017-01-02 21:32:46,"{'food': ['dish', 'dish', 'dish', 'dish', 'dish', 'dish', 'dish'], 'drink': []}"
SX507ObIi_uWn956IyElug,mWn0y6TbHqDLYcPSq4IqkQ,d_tRshM-w6S4QxE4VVi8tQ,3,1,0,1,"GF and I stopped here for a bite for dinner. Waitress was friendly and informative and the food came out fast once we ordered. This is about all that made it 3 stars. 

I ordered the matzoh ball soup to start and it wasn't the best I've ever had. Very salty. For dinner I opted for the baked Mac and cheese appetizer for my entree and that also left much to be desired. It came out hot and bubbly but the taste just seemed.. Off. 

GF got the turkey club with avocado mayo. Nothing special - she said it pretty much tasted like a Turkey BLT and couldn't even taste the avocado.

Prices were fair for the city but we probably wouldn't be back for dinner - maybe it's just more of a breakfast/lunch place.",2014-03-15 22:06:20,"{'food': ['matzoh ball soup', 'baked Mac and cheese', 'Turkey club with avocado mayo'], 'drink': []}"
DNr3JlitC5o7Kb_5vTKyEg,G03-8zKlaMjkXMt8hW7W1A,j99PtxlKTW_u5alE4jiqHQ,4,1,0,1,"A last minute Friday night trip that did not disappoint! 

In an effort to avoid meat for Lent, my boyfriend and I went to Ralph's in search of some delicious seafood and pasta. Extra points for having Lent specials with veggie soups and crab meat pasta!

We started off with some fresh mozzarella and tomato which was great. My guy had the flounder francaise which he raved about for the rest of the weekend and a side of ravioli-delish! I opted for the manicotti. If you are a fan of cheese, do yourself a favor and order this- outstanding!

Unfortunately, we had no room for dessert. Only con I can think of is that the temperature of the place was on the warm side. That won't stop us from going back!",2014-04-20 02:22:03,"{'food': ['mozzarella', 'flounder francaise', 'ravioli-delish', 'manicotti'], 'drink': []}"
4wdfJyKQbt2sTMYXq1IxqQ,7v6ETyw7rBkZmXuRSqsUFw,OHzX-ZD9qyoeoxR8Z0dlIA,4,0,0,0,"I was surprised that this place had a decent selection of vegan options/substitutes. The vegan fried chicken po' boy was tasty. My friend ordered the vegan pulled pork (made out of seitan) and he wasn't a fan, but he loved the big ass biscuit. It's a very hipster vibe. I plan on coming back to try out other menu options.",2018-04-16 17:24:40,
DO3DO-VnDh_ttwIP16n6fQ,NqJku3WGn0Hp7CjA-I_N3A,LnZvGYbqozanOSevcftnrw,5,0,0,1,"HipCity is a gem in University City. I have taken many self-titled carnivores there and they have been astounded by the Crispy Hip City Ranch. Apparently, it's that good. 
I like everything here, but my favorite has to be the Curry Tofu Wrap (can be made as a salad) or the Cheesesteak. But like I said, everything is amazing. 
Their delivery is also on point.",2014-05-09 20:24:20,"{'food': ['Crispy Hip City Ranch', 'Curry Tofu Wrap', 'Cheesesteak'], 'drink': []}"
97VfaF_IjuONqX36gyv_6A,lzeD32es165sSAatsR88KA,Gw7UW0E2BguzL9suQnwDeg,5,1,0,0,Easily the best burger I have ever had! The service was fast and you get great quality food. Best burger in Philly!,2016-09-07 23:36:19,"{'food': ['burger'], 'drink': []}"
xRIHiPt4YH70sOS2PgSRyA,HvE0SrE33a5hnnRSOR9a-g,7mpYTDb24SywNMRn3yeakQ,4,0,0,0,"Bourbon flights are pricey but well worth it if you're a whiskey fan.  Spent a night with live music and a couple of friends going through about 4 different flights, and was not dissapointed.   Whiskey burned good, the band played well, and the general crowd was friendly and comfortable.  

Haven't been able to get to the game tables upstairs, having only gone on weekend nights, but this would make for a fine happy hour stop for those as well.",2013-05-31 00:23:43,"{'food': ['Bourbon flights'], 'drink': ['Whiskey']}"
DH5qdiw8BjvQNedy1Q6Bzg,-D-gaoi6h6laaCtf7U4DJQ,oBhJuukGRqPVvYBfTkhuZA,4,0,0,0,"This is a restaurant/bar that is part of the hotel. The menu is small and doesn't have a lot of options but they have an extensive drink menu. Personally, the food is significantly overpriced, especially the half chicken entree. However, the food was flavorful and delicious. I think this is a great place for anyone who doesn't mind spending money and wants to enjoy a good meal and drinks. 

The mussels were delicious and a good amount for the price. The fingerling potatoes were a little dry but still yummy. The waitress was very attentive.",2017-12-03 19:55:43,"{'food': ['mussels', 'fingerling potatoes'], 'drink': ['extensive drink menu']}"
