review_id,user_id,business_id,stars,useful,funny,cool,text,date,ner_results
axvrF0iptX7MJHQgiDaF7A,23L6Ua1w15AFE3rK50jh9g,Dv6RfXLYe1atjgz3Xf4GGw,4,0,0,0,"Nice spot...Not enough seating, but not really their fault for the small square footage. It is the space they have to utilize until an expansion happens one day ""maybe"". Yet, what is more important is the food; which is quite delicious! I love the sweet potato fries with dressing the most, and then the taco and mock caesar salads. The staff greets you in line and takes your order to keep the flow of traffic going much smoother. Also, the greeter is usually very polite and patient. It would be nice to add to the menu from time to time, so there is something new to look forward. Overall, great service and food, but space is limited to enjoy your meal.",2015-07-21 04:08:39,"{'food': ['sweet potato fries with dressing', 'taco', 'mock caesar salad'], 'drink': []}"
_yPlDrGCNdsOo9IixmPBsw,10dW9AMs9mlPVHfpLKbrYQ,QrIV69RPS4LTpIwPoL22_w,3,0,0,0,"The service and wait time is usually pretty decent, I've been there a few times now for food and drinks.  It's not the cleanest Applebee's I've been to and the servers let people get a little bit too drunk sometimes, hence the 3 stars.",2017-10-17 00:06:26,"{'food': ['food', 'drinks'], 'drink': ['drinks']}"
kTD6AN_qmyz_0dCeFuiGIw,tYe3wHZB77lCG4ThTJ3gRQ,pj8Y-5vfbRitnnm2xJFH9w,2,1,0,0,"I went here with a friend on a living social deal.  Needless to say I will never come back.  The food was not even authentic west indie food (I know because my family is from Trinidad).  The curry chicken was too Americanized and lacked the flavor and spice that authentic west Indie curry has.  My friend had the jerk chicken and the chicken was spicy but lacked flavor.  
Wont be back, even with a deal.",2012-10-16 22:41:32,
Zrno3N_sw1uONOJhkq0brQ,ZPSY7MNHL54abYB_Mg5M3g,D2gONomZQyRjxR3TMHJovw,1,1,0,0,"This is the WORST Wawa that I have ever been to. To be fair, I did go during the early morning hours on Sunday as the Saturday night bar crowd was heading home, but it was unacceptably unorganized. There was absolutely no system in place for the deli counter which created a HUGE crowd of restless drunk people. The employees were not calling out any numbers as the food was prepared, so no one could tell if their sandwiches were ready. Everyone was just standing around trying to figure out when they would be getting their Mac n Cheese so that they could finally escape the chaos and head home. It was a mob scene that could have easily been avoided if the employees had just yelled out order numbers as the food was ready instead of forcing people to squeeze their way to the front of the crowd to check on the status of their order. When I was finally sick and tired of patiently waiting, I made my way to the counter (through the throngs of drunk people) only to find that all of our food had been sitting on the counter the whole time.",2018-02-13 23:49:02,"{'food': ['sandwiches'], 'drink': []}"
qcZQpgZCk48Y5ZSDNn51ZA,ElDcdK-TQJwmQYvDPZgB9g,GOSVLhjUT6TnrPhkkmDOpw,5,0,1,0,One of the best chai lattes (hot or iced). Innovative and basic crepes. Ninja fast service. Relaxing neighborhood atmosphere.,2017-07-01 15:04:20,"{'food': ['chai lattes', 'crepes'], 'drink': []}"
cNsSYBIR7cHjiXZtwi322A,89uNzxmH29Cv64jiy4ySWA,qot32tHVWZpiJibLTwQGyw,5,0,0,0,"We have been ordering from Pena's for 20 years. We have never had a bad meal. For the last 2 years we order weekly as my husband has been house bound that long. Our food is always correct, hot and delicious. Always delivered sooner than they say. Phone people are friendly and helpful.
Thought it was about time i gave them a boost, since, as I said we have been enjoying their food for more than 20 years.",2018-05-22 15:22:40,"{'food': ['food'], 'drink': []}"
eMNi3zhlo88cMftGdEXk5Q,VFRIv3-_Og34wZyy-LigQQ,SIoCIxjn4jLt2O-4DajWJw,4,1,0,0,"I've genuinely liked this place since the first time I walked in. It just feels like the regular spot you've been looking for since moving into the city. It's laid back, plays great music, offers a pretty good selection of drinks and food and reasonable prices, and the servers are decent.
I recommend anything that comes with fries because their fries are bangin'. They are the shoestring kind so you have to be a fan of the thinner fries in order to enjoy them. They also have yummy mac and cheese which tastes very homemade. As with most bars, you can't go wrong with their burger. Mine was cooked well and was flavorful and juicy.
I can't quite give Macs 5 stars because it's nothing super special and their servers could be more personable but it's a place I continue to frequent and recommend to friends.
VEGANS- They have a mean Seitan Sandwich that you'll devour in seconds and come back craving.",2012-07-03 15:41:13,"{'food': ['Seitan Sandwich'], 'drink': []}"
X4AobGXyGvtESb6iVwdLOA,DgC8Z8VmSAlWZpsc_XjbqQ,WRMlifrYLjRY8q5YUUbfZA,1,0,0,0,"I'd been wanting to go here for some time since they'd opened and finally got the chance. While this is a cute little quaint spot, I didn't have the best food experience. The first issue for me was My appetizer. I had ordered a spring roll with shrimp, however the shrimp did not look nor taste like shrimp at all. It actually looked like tofu. When I'd asked about it, the waiter couldn't tell me why it had that consistency. My entire was noodles with shrimp, it had no flavor whatsoever. Now the shrimp in my noodles looked and tasted like shrimp, so idk why the ones in my spring roll were different. My friend had some dish with beef in it but there seemed to be some unfamiliar looking piece of meat. He didn't eat it and again the water couldn't describe what it actually was. The fact that our waiter couldn't answer any questions left a really negative taste (pun def intended) in my mouth. Idk if this is normal Pho cuisine and I am just not familiar with it, but I'm certain I won't be returning here.",2017-04-10 17:51:43,"{'food': ['spring roll with shrimp', 'noodles with shrimp'], 'drink': []}"
e1YDQbdpUdAV-1GbOpFMMQ,vQTwBHj8S4QJ-IxgEp_6xw,sdWuLh-auc0nC2Jy6_26AQ,3,0,1,0,"This bar is standard. The food is standard Irish/American bar food but is a little over priced.

The atmosphere is ok. I like the three levels. The crowd is late 20's. However, the bar smells like feet. I don't know why it smells so bad but others bars have figured out how to rid themselves of stale beer smell. Day or night winter or summer it always stinks.

Staff is nice. Have never had a bad experience.

Go here if someone can't think of anywhere better.",2013-08-22 03:23:01,"{'food': [], 'drink': []}"
YX4bGBxyFAJFOmHQTjhCpg,b1JgmlAQAEZNz7UdRDMRrA,eaDZlSuVS0EY67Ke6pRP6Q,4,0,0,0,"Food was good. Fried rice was plentiful. Pad Thai had good flavor and a little heat. Won ton soup was huge. 
Liked that you got hot tea when first seated. 
Price was very reasonable for lunch.",2017-12-08 00:00:24,"{'food': ['Fried rice', 'Pad Thai', 'Won ton soup'], 'drink': ['hot tea']}"
gPH57_ODlivVJtRMSEQHig,ZWaM5hUj6M3RqyxcU3UlSw,D4DZztR7vkbiED6txGUYFg,5,0,0,0,The best si chuan food in philly!! Very very good services! Managers and waiters are very nice!,2014-12-24 05:32:58,"{'food': ['si chuan'], 'drink': []}"
GnRkahlahoacJg2h2rSnhg,7UH3efCBqHcuXHW5aDp7Gg,Dv6RfXLYe1atjgz3Xf4GGw,5,0,0,1,"Sooooo happy I randomly found this place! I got the Ziggy burger and sweet potato fries... one word... YUMMY!! The burger taste almost tooo real! Very beefish taste and the special sauce is super good, fresh ingredients as well. The size of the burger was big, had to take a break from eating it because I was full. The fries and sirracha aoili combination were the best sweet potato fries I've ever had. I was pleasantly surprised by this place.",2017-01-19 23:07:24,"{'food': ['Ziggy burger', 'sweet potato fries'], 'drink': []}"
azkw15ZxXdi-xKu4YiRxLQ,LvJaWVpuGvladxwgi0UoWA,HuDNHqKv9n1mWpe4BqCnwA,4,0,0,0,Just started checking this place out. The food is damn good and the service is quick too.,2012-04-08 13:46:59,"{'food': ['The food is damn good'], 'drink': []}"
CBolu7CT1SeOHoXvQUMu-w,yUltf-w4-Um7PLSbd6pO2g,9gObo5ltOMo6UgsaXaHPWA,5,0,0,0,Amazing view and good eats. Truffle Mac and cheese is great and so is their steak. Great service and drinks,2017-11-12 20:09:47,"{'food': ['Truffle Mac and cheese', 'Steak'], 'drink': []}"
WVoYbXpx7_GNUNUyGwhEjA,bs8LJYmpf6VTC2wxcJuNvg,sdWuLh-auc0nC2Jy6_26AQ,1,6,1,0,"To all party planners, I don't recommend booking an event at Black Sheep pub.  After booking the second floor 5 weeks ahead of my event, the bar double-booked the space.  I learned this information 2 weeks before the date of my party, which was too late for me to find another venue for 30 people. They pushed my party downstairs into the cramped space in front of the fireplace until the other event finished.  We were told we would be in this small space for about an hour and then would be allowed upstairs to the second floor.  One hour turned to two hours.  We were finally permitted upstairs two hours after my original booking.  I was told the party before mine was spending more money and planned parties there regularly.  To reduce party planning stress, don't book your party at Black Sheep Pub. If you do decide to book a party at this establishment, I suggest checking your reservation frequently in case you also get double-booked.   

The bar did not apologize verbally for their lack of respect to my reservation.  No food or drink discount was offered for the inconvenience.  The bar sent over a free drink for me, which in my opinion was not enough of an apology for the number of people I brought to their bar.  I will not be booking another event at Black Sheep Pub.",2014-11-21 17:14:28,"{'food': [], 'drink': ['free drink']}"
tr3g64vFdoipKhsYZNaWiw,zQawe0Esc7YmaIJqANyB9w,fKDV_dlDhXd7P5kZi97Kng,5,0,0,0,"This place has had really great fries ever since they came out. The burgers are always great too. 

PROBABLY THE BEST FRIES IN TOWN THO.",2013-04-21 15:25:20,"{'food': ['fries'], 'drink': []}"
zFDxfKmULmDl_i3gJUAqhQ,3lkP6UrA5u_tZa3H1c9fgA,AWJyivVwe3t9BO-k8D0ynQ,4,0,0,0,Went there for the first time this morning. Friendly staff and reasonably priced food make them a great addition to Old City! Their serving La Colombe coffee is a big plus. I would definitely visit again.,2014-10-02 13:11:08,"{'food': ['food'], 'drink': ['coffee']}"
_6_lSpMPxEL7U4EAh5NwoQ,BER_TjDC6OzqvjDAwYh-Jw,d_tRshM-w6S4QxE4VVi8tQ,3,0,0,0,"We went here based on the family friendly reviews.  Heads up - there is no actual kids menu but they accommodate well.  The menu is a lot of mediocre comfort food.  I had the Thanksgiving dinner - and it was ok.  Nothing to write home about. The gravy reminded me of Salisbury steak gravy from those old freezer meals.  Maybe it was supposed to?  I enjoyed the decor - felt very Brady Bunch.  So, overall ok.....",2017-06-24 01:53:20,"{'food': ['Thanksgiving dinner'], 'drink': []}"
0X5zh3OkTsYkjzUK1JbelA,K8IMkDkD7kQ_YfT4aH7ZGg,3lBooCffgkW7tVSG5kILBA,5,0,0,0,"I have been struggling to find real Italian food in Philly, I moved here with my wife a couple of years ago and I have been checking several places. Personally this is my favorite by far, I found recipes which my grand mother used to cook. Small place, noisy but great staff and , to me , fantastic food. Must try the Ravioli con ossobuco.",2015-08-13 17:42:18,"{'food': ['Ravioli con ossobuco'], 'drink': []}"
4db2Xc-SEnPkUOUH0rgDZQ,B_Shr72OZfT0gopInQaZ4w,HSXvx9ajd9cGDzYIScmrig,5,0,0,0,Food is great & the customer service is excellent . I also love the home style atmosphere. Thanks Tyemeka's!!!,2016-06-07 23:42:52,"{'food': ['Food'], 'drink': []}"
vxqbxYpqQBZlKOldf6oEJA,ech65IRYjqCpiOnv-54c6Q,d_tRshM-w6S4QxE4VVi8tQ,3,0,0,0,"Great service, some things on the menu are great, some not so much, definitely skip the ""brisket"", its dry, full of fat and has no flavor.",2018-07-19 09:52:36,"{'food': ['some things on the menu'], 'drink': []}"
_lluBk4IiI-UPFcCCwkDgg,TLcUXi2bn6v4hdB8X-M73w,eMiN8nm70jjKg8izikVWDA,4,0,0,0,"Beer towers + mussels red + crab fries + wings + big TVs = Chickie's and Pete's.  When I have a day to kill, I kill it in Chickie's and Pete's ordering apps, drinking beer and watching sports.  C&P is a also a great place to eat and drink before heading to a sporting event.  There is plenty of parking and is large enough that a wait for a table is manageable.

The wings and mussels are amazing (dip your bread in the sauce), but I do agree that the crab fries are completely overrated.  Service is friendly and quick.  Prices are average and acceptable.

If you have a day to kill, head down to South Philly while the sun is out and head home (via desinated driver of course) under the stars.",2007-01-31 22:31:37,"{'food': ['beer towers', 'mussels', 'crab fries', 'wings'], 'drink': ['beer']}"
T0R6uiMw28Nn4O5MVEFujA,4QnOHtPIYn1ycvt3F5d7Tw,uBDXcXlLR9IuRV1N2m0SPQ,5,5,0,4,"My friend and I were trekking along Market street in search of a good place to eat. We passed Pho street, and it seemed like the most appealing option. Pho street has a simple interior design, with orange and purple colors - sounds funky, right? But it actually looks cool In person. 

Stepping in, we perused the menu on the wall to the left, and made a selection. We placed our order via a touchscreen a little further back, and we ordered the beef noodle soup with eye round steak and brisket to share. There were other options to customize the soup (I.e. more noodles) or building your own pho from scratch. We waited for our order number to be called, which took about 10 minutes. We collected our soup with the fixings (bean sprouts, jalapeo peppers, and basil) and grabbed our spoons and chopsticks.

For starters, the pho was large enough to properly feed 2, so if you plan on having a bowl, come hungry! The broth was very tasty and light. The noodles were the perfect texture and I appreciated that they were generous with the steak and brisket - both of which were nice and tender. 

This place was great for a for quality pho in a timely manner. Truly a pho-nomenal experience (okay I admit that was pretty terrible).",2018-06-30 06:27:34,"{'food': ['beef noodle soup', 'eye round steak', 'brisket'], 'drink': []}"
OPepLdiomMJkb7Qvd_rVww,JkuAlOGEAlRhKHNRfmLffw,JomDoQafikclSVVCPkWjnA,4,1,0,0,"It's not Honey's, but I'm ok with that. My wife housed her yummy pancakes. I had the two eggs with french toast, and home fries with green peppers and onions. Nothing fancy. 

You won't find the artisan, craft, fusion dining here --- or whatever trendy/hipster moniker you can dig up. Sometimes a simple place to eat with good, friendly, prompt service, is all one needs. 

Since it's in our neighborhood, we'll be coming here more often.",2013-11-23 18:40:19,"{'food': ['pancakes', 'eggs', 'french toast', 'home fries'], 'drink': []}"
4HJaZZtuc3F8SqPt8wXhCQ,s1mD1PvJQrAYHfNG9UDYJw,eaDZlSuVS0EY67Ke6pRP6Q,5,0,0,0,"I've eaten at Nyonya in NYC twice (also famous for their roti canai and Hainanese chicken). It didn't leave much of an impression on me. The food wasn't bad, but I didn't understand the hype. However, when I moved to Philly, I found Penang obscenely good. It quickly became our default Chinatown restaurant.

The Hainanese chicken is simple, but the thing about simple food is that I can eat it everyday. My new obsession is the fried rice with salted fish. It is mmm mmm good.

The servers are quite warm and nurturing unless, on a very rare occasion, you get a waitress who isn't as well-versed in speaking English. It normally isn't an issue... until you have a friend who makes a complicated order. Water under the bridge.",2011-11-07 19:08:04,"{'food': ['Roti canai', 'Hainanese chicken'], 'drink': []}"
VHOcAM3cgNQg0K63f9qg6A,kJnbLIPdJ6QOu_USBdfuZA,-Or44IdY51Ukd618kikmtA,4,0,0,0,"This review is for the donuts, I don't know about the chicken. Originally I was thinking of going to the one on South 2nd street, but I saw that they were going to close very soon so I went to the one up north instead because these guys close later. I walk in and the place was completely empty, which I found surprising. So I ask the pleasant girl behind the counter if there were any more of the blueberry mascarpone donuts (how baller does that flavor combo sound), but they were sold out. They also didn't have any more cold brew coffee either, which was a bummer. She said the lemon creme hot donuts are her favorite, so I go with that one and also ask for a cinnamon brown sugar one.  After waiting a few minutes, I received my hot donuts, and they were great. They even threw in a couple of extra ones. Man, I didn't realize how much better the texture of a donut is when it's fresh. I did not find them too greasy, but it's true that the texture does change after a short while. A couple things to note: each location of Federal Donuts has a different menu of fancy donuts, so it's advisable to check the menu on the website before you go. Also, the lemon creme donut is quite flavorful, but there's really no creme filling. So all in all, I was satisfied. I live right near The Doughnut Plant in the LES of NYC, so I'd like to think I know a quality donut when I taste one, and this place holds its own.",2014-11-20 01:24:34,"{'food': ['donuts'], 'drink': []}"
d16jppApH8wfbA2zmlP_8Q,rKGTBWaFgu8a60DFqeK3Fg,9gObo5ltOMo6UgsaXaHPWA,2,0,0,0,"We came here for happy hour on Friday night.  Happy hour runs from 4:30pm-6:30pm.  Everyone was very friendly and the bar was half filled.  We sat at a table in the lounge.   The happy hour prices were fair however the food was just mediocre.  We ordered the potatoes which were greasy and way too hot to eat.  We also ordered sliders.  I ordered one fish and one beef.  However, I received a short rib instead.  The burger was dry and tasted like saw dust.  The short rib was okay.  My friend ordered the tomato salad which she said was good.  
Go here for the view and a cocktail.   Eat somewhere else as there are so many better choices.",2018-09-30 05:12:17,"{'food': ['potatoes', 'sliders', 'short rib', 'burger'], 'drink': ['cocktail']}"
2StR9ieLLQPntN50hneEQw,DURbMFxI7ZcwkqYHfi8oXQ,YtSqYv1Q_pOltsVPSx54SA,1,2,1,0,"Let's start with the seating. I came here today for Vday and nothing romantic about it. The tables are so close together it was like having dinner with a stranger!!! The couple next to us were talking non stop and loud!!!! The whole ambience was non existent! Loud and obnoxious! Service!! What service!? Oh to come and pick of the check. Yeah that was excellent! I'd rather had gone to Cheese cake factory if I'd known I'd be sitting practically on someone's lap! The food, blah. One and done. Save your money.",2016-02-15 01:53:26,"{'food': ['Cheese cake factory'], 'drink': []}"
Vabf12ukFztCbZv5ugw9dQ,1wgYYWKWoDl4WFA8shpzKg,CPgWuWGZ4v2sZr5_-1kluw,2,0,0,0,I love checkers food and was so excited to get a late night meal. We ordered a cheeseburger and two spicy chicken sandwiches. What did we get? Two burgers and a regular chicken sandwich. While in line I also want to add someone ran up to the drive through window and was begging for more honey mustard. It was a bizarre place-go here if you want a good laugh,2016-08-07 15:52:10,"{'food': ['cheeseburger', 'spicy chicken sandwich'], 'drink': ['honey mustard']}"
JD7xf00bx4XrVfUZgTyGVg,gj8BnejluSlll42YK2MCGg,FHNIvNgh3fS7VZQq2Y3dsA,3,0,0,0,"The food was OK. But, the prices were too much for the smaller portions. 
I wasn't happy with the service; they kept taking plates and I felt awkward watching my date while I sat plateless in front of him. 
Spice 28 is much better, with more selections and better portions/prices.",2013-11-23 14:48:16,"{'food': ['food'], 'drink': ['drink']}"
PWm3A2Z5h0h3n237jjImiQ,ahdQ8RWsr76SISCEPtQrbg,7mpYTDb24SywNMRn3yeakQ,2,1,0,0,"Southern cooking...I had salmon sprinkled with sea salt on a bed of greens.  Not much going on there but nice beer selections.  Dessert was a spicy sweet potato ice cream, ewww is the only way I can describe it.  Way to spicy for a dessert!  I don't think I would be going there for food.",2012-08-21 14:16:57,"{'food': ['salmon', 'spicy sweet potato ice cream'], 'drink': ['beer']}"
RZ8iou6cvhWy5JkuZv8ReA,ibk6XiRV-ucTKLO0NiZU6g,10wt8eSXI_PZfl9dRIiWmg,3,0,0,0,"Food was very good, but service is very slow which is unusual for an Indian restaurant.  We've eaten in the restaurant and also gotten takeout. Last time they forgot to put part of my order in the bag, I didn't realize it until I got home, so be sure you check carefully before leaving.",2010-07-15 19:34:15,"{'food': ['Food was very good', ""We've eaten in the restaurant"", 'Last time they forgot to put part of my order in the bag', ""I didn't realize it until I got home"", 'be sure you check carefully before leaving'], 'drink': []}"
F19TE57J0x1JWeuycYBJ0w,WuiEYopWZOWOuWQD87fVSw,IgNDlyLERBwFGphgcC5VDQ,3,1,0,0,"Came here to study. 

Internet: unstable
tables: unstable
service: inconsistent. the MANAGER forgot to make a drink order. If the MANAGER is blatantly forgetting to do things, i don't understand how the restaurant plans on functioning. 
tea: decent, but realized they are sitting in an semi-open canister on the counter the ENTIRE day.",2012-11-12 21:47:05,"{'food': ['Came here to study'], 'drink': ['Came here to study']}"
oCTYOm2RGspjnKNxHrc7cQ,qIVLLE6twbV_33WpiGIzDw,14ZGwnDyydXdSBsLXpSUrA,3,2,0,0,"Visited the Vientiane Cafe on Sat night. Nice little place in the heart of West Philly. My wife and I both ordered a appetizer of veggie steamed dumplings and Pad Thai. She ordered Tofu Pad Thai, I opted for the Shrimp Pad Thai. The dumplings were nicely cooked and the dipping sauce was excellent. The Pad Thai was very good. I thought the spice level was nice (I ordered a 2 out of 4 on the heat scale) and they definitely kicked it up a notch! The shrimp were good, but you have to peel as you go, and I'm not the biggest fan of that serving method. Nice portion size and quick service. Its also a BYOB, so thats a plus as well. The two down sides to the place is 1. Its a little run down inside, and its completely no frills and 2. Its a tight dining room. If you like some elbow room, this isn't your place. However, all in all, nice little Thai place. 3 stars. Recommended.",2012-07-02 19:21:26,"{'food': ['veggie steamed dumplings', 'Pad Thai', 'shrimp'], 'drink': []}"
12YszfeLGwSPyCr2Eq8OuQ,_LNCGYNoGKxyVUag3EG0-g,WZPCfTRiN4ipajP7gFfziA,4,4,0,0,"We finally made it here after talking about it for a year. If you want fresh food for a good price, this is your place. We had the farmers omelette and the western omelette. Both were a good size and filling. The waitress provided good customer service and was attentive. Just enough not to be annoying. The water wasn't very good, so I ordered a cranberry juice. No complaints here. Go and enjoy.",2014-07-18 15:27:47,"{'food': ['farmers omelette', 'western omelette'], 'drink': ['cranberry juice']}"
aBeMXdQQuKMCJxIVAPPXPQ,ZU7QVuxmA80hQoMmjQAzvA,O6hY9yenifuRXrpc4TfgsQ,5,0,0,0,"Ordered pick up from here after recommendations from friends. Even though I took it to the neighborhood pool and ate it, everything was still wonderful! Will have to come back and actually eat in the restaurant. We had the grilled chicken pimento wrap and the pork roll burger and both were excellent.",2016-07-08 17:13:35,"{'food': ['grilled chicken pimento wrap', 'pork roll burger'], 'drink': []}"
4B-uaFfJvIJ4Q7iadYPycQ,6qQFO8DtRdeYQm_qCDlQLg,9iBlpXwgBFLVnx6RmHsiCQ,2,0,0,0,"Very fast delivery (especially considering the wet weather) through Grub Hub - took less than 20 minutes. However, the club I received was actually a triple decker (there's a difference) and was falling apart. Bread was soggy and messy.",2014-04-30 16:07:36,"{'food': ['Bread'], 'drink': []}"
GFfPk0lirK3slIIGy9Q2UA,RdJ7Ykelg8w4y5FTmxjT8g,UhSVDwQFW6mKmaEA5OTU7A,5,3,0,1,"I wandered into this place one day on my lunch hour, and I really enjoyed it.  Unfortunately, there 's no one at my work that I can get lunch with, so I tend to stick to take-out places for lunch where I don't feel weird eating alone.  However, I braved my lunchtime solo-ness and got myself a little table in this tiny basement restaurant on Sansom Street because I was curious about how the food was.  

The waiter was very nice and attentive, and I ordered a chicken kabob over rice with an eggplant and pita appetizer.  Everything was delicious, and I think the chicken had saffron on it, a very expensive and tasty spice.  I was able to read my book in peace, and I enjoyed listening to the large and boisterous group of people at a table in the back (up a few steps), who seemed to be enjoying themselves on some sort of business lunch.  I really enjoyed my meal, and it was really pretty cheap, so I would definitely go back again, with friends this time so we can be the boisterous group at the back table.",2007-07-06 18:37:54,"{'food': ['chicken kabob', 'eggplant and pita appetizer'], 'drink': []}"
dW23VrDiU6ikLrvHbjtNcA,tdJ_TquO1CjvUdviaXnf4w,j99PtxlKTW_u5alE4jiqHQ,2,1,0,0,"Ok,Ralphs is 100 years old and the oldest family owned Italian resturant in the us...cool,but the food was just plain aweful...I love the old school decor & history so that's why I gave raplhs 2 stars not 1...my girl ordered the clams casino and they tasted more like the movie casinos DVD  then clams,they had to be 99% bread...I got the sausage & brocolli rabe over pene w/garlic & oil...the sausage tasted old,the brocolli rabe was sour and penne was mushy...ok now possibly I jus caught ralphs on a off day or being from ny actually know good Italian...this place doesn't fit the bill...just visiting Philly so I can't recamend another Italian spot but the pizza at lorenzos on south street is AMAZING...grab a slice and save your self cash & fustration!",2011-09-04 14:08:25,"{'food': ['clams casino', 'sausage & brocolli rabe', 'penne'], 'drink': []}"
