review_id,user_id,business_id,stars,useful,funny,cool,text,date,ner_results
KiJI3Fqvcb2GVP4cw5nIwg,eX6tb2ebnZa4R5knVmUiZw,REns5fQe45Nk_D2UwQyr0w,3,1,0,0,"We went here because we saw it on the 1,000 pts. list for Open Table.  My husband had one of their wood fired pizzas -- he said it was VERY good.  Also, we split their meatball appetizer, and that was excellent.
I had their crab pasta in a lemon cream sauce.  The waitress said it was very good, but I don't suggest it.  The sauce lacked flavor and the crab was scarce.
I have to mention that the place was pretty empty when we arrived, so all of the staff - and who I assume is the manager (in street attire) - were sitting at the bar.  It's always awkward when you see that; it makes me feel like we're inconveniencing them.  And they continued to sit at the bar  (located right next to our table), until business picked up.
So just three stars because while our server was nice, she forgot the salad I ordered, the bathrooms needed attending, and the restaurant is attached to a Hookah place next door with only a thin door separating the areas -- the smell destroyed the brick oven scent.",2013-07-20 16:25:36,"{'food': ['pizza', 'meatball appetizer', 'crab pasta'], 'drink': []}"
KjzO5soX1CTfY1RSzrRkEw,aFIhSd0x93vJc3FioI_yxA,DsKzHnkLKnxZTVsFpts4oA,4,1,0,0,"FIRST and foremost -- GREAT SERVICE!!! This place INVENTED the warm welcome and non-intrusive attentiveness. Mirrors hotel service wherein the resto is located. Food OK. Great tourist location. 25 percent tip. If you're in the hood, try it. -- HOTSPUR. (This review will also appear at The PJ (www.junto.blogspot.com).",2013-10-07 15:12:43,"{'food': ['Great service', 'Hotel service', 'Resto'], 'drink': ['Hotel service', 'Resto']}"
9DIo0-FLG2Nt5NUevUHOdA,PmLVqWGgQy0hZcG_QQCBwQ,F8yozE3NWnImNApHO347gQ,4,0,0,0,"my boyfriend and i were looking for a ""cultural place"" to eat. he had mentioned moroccan. i was a little eeehhhh on the mention of it. let's be real. i love american foods. anyway, he had said i would probably like it. we had searched and found marrakesh on here. i didn't read much of the reviews to be honest i was just like eh, ok, let's go there and grub. 

we had trouble finding the place. it's smudged between south street and some alley. i wasn't sure if the building was it. i even forget if their was signage....but it kind of adds to the overall mood of the restaurant. (ps...i saw some drunk guy pissing on their wall....) 

we rang the doorbell only to have a tall, dark and well....not so handsome..but friendly gentlemen who sat us down. we were seated on a comfy morrocan-ish style couch filled with lush cushions and pillows. dimly lit living room or parlor to say it better. a little cramped and not as private but comfy indeed. 

the waiters were dressed in typical moroccan clothes....and i believe they may have been moroccan.
...so the food was a 7 course moroccan dream. it's basically a set menu but you do get to choose 2 items or so. i don't recommend getting the lamb. it tasted waaaayy to gamey for me. they have this delish eggy/almond/pastry pie course in the middle of all 7 courses. it almost looked/tasted like a funnel cake. 

i don't wanna spoil all the surprises they have to offer. but you really should check it out.  probably not a first date choice. 
all in all, i'm now a fan off moroccan. thanks marrakesh! see you soon:)",2009-10-26 00:23:24,"{'food': ['eggy/almond/pastry pie'], 'drink': []}"
MxR10h1DCK--A3DMyoe8-Q,iBDKvmTT8vtosTBzmbEwmw,Gw7UW0E2BguzL9suQnwDeg,5,1,0,0,Wow what more can I say. There menu is so creative and all of the flavors work so great together. I will eventually try everything on the menu. Wish I lived closer so I could walk here everyday!! Sooooo good,2016-11-03 02:15:19,"{'food': ['Wow', 'what', 'more', 'can', 'I', 'say.', 'There', 'menu', 'is', 'so', 'creative', 'and', 'all', 'of', 'the', 'flavors', 'work', 'so', 'great', 'together.', 'I', 'will', 'eventually', 'try', 'everything', 'on', 'the', 'menu.', 'Wish', 'I', 'lived', 'closer', 'so', 'I', 'could', 'walk', 'here', 'every', 'day.'], 'drink': []}"
M5QiT1lXjZVOhufQecbDSw,RiYsFWku3xGJFERi8byk1A,y44MbCvvtmg1FpkNGSWisw,2,1,0,0,"I hope the real restaurant is better than their airport restaurant. The sandwich was nothing like a real cheese steak. The meat was in wide thin slabs like steak-ems out of the box - not at all cut up like the pics on the menu and the cheese whiz was applied as thinly on the bread as you butter toast. 
Probably, the manager has not properly trained the workers how make a real cheese steak. 
It's a travesty that this place is what travelers get as a taste of Philly.  It also damages Tony Luke's reputation but it makes a lot of money so that's what they must really care about. 

Don't eat here if you want a cheese steak.",2014-08-15 16:11:28,"{'food': ['sandwich'], 'drink': []}"
jtam0CJbrdRX-Xm6lcMc0g,dWiVnoDXPMWNqjU0Ub-8Lw,f8xDi3rajxvIqS73N93Afw,5,0,0,0,"Most of these reviews are spot on- all except one, however. Wiccacco has been serving the locals for the past 15 + years, providing friendly and excellent service everytime I go. Their bbq chicken wrap, paninis, and breakfast platters are just some of the things that wawa does not have, setting itself apart from your typical convenience markets and other large chain food stores. Don't get me wrong, wawa is a solid choice, but stores like wiccacco help add flavor to our city!",2010-07-20 03:50:25,"{'food': ['bbq chicken wrap', 'paninis', 'breakfast platters'], 'drink': []}"
eTFOABELzByPTv233fRGeA,XGaMoQ6sg0B5hSzC5aRmdw,xCXGV3wEvYd4xBGx8ZRFQA,4,2,2,3,"Do you like bagels dripping with organic crunchy peanut butter and ooey gooey jam? WHAT AM I SAYING OF COURSE YOU DO. Get thee to La Va.

Seriously good stuff. I'm not much of a coffee drinker, so sorry to be unhelpful that department. What I can tell you is that Brian (hi Brian!) makes a mean PB&J bagel and pours a thirst-quenching OJ faster than you can say LAVA! (I pronounce it LA-va rather than la-VA, which is just more fun that way).

Loved this neighborhood, and this cafe in particular. Tell Brian I said hi.",2009-08-12 15:50:21,"{'food': ['bagels dripping with organic crunchy peanut butter and ooey gooey jam'], 'drink': ['OJ']}"
9H0bzRgQXcuNd0qy-DK0vw,UXcOSMHZM2RPWTgjQbKDJg,Q-prSTdggNlxAEFV88BZOw,5,3,2,3,"A friend and I planned to hit up the infamous Sunday $10 Destroy Your Liver event in Old City, but I had notice that my sister wanted us to meet them at Tria for some snacks.  We figured we'd stop in to eat a bit before pounding our livers into submission and sweat-dancing into oblivion.  Talk about starting out classy before losing it all later.  This place is pretty nice in the sense that I sorta felt out of place in an old t-shirt and cut-off shorts, however, they didn't mind.  There's a list of food items and drinks on a clipboard and it's such a very detailed and helpful menu.  Everything on the menu is described well and each drink conveniently also has the ABV, price, and fluid amount listed.  Most things you will order are perfectly snack-sized for two and it's priced moderately which just makes drinking your beverage that much more enjoyable.  Also, it was a warm night and I got to sit outside for a while.  Swish.",2009-05-26 15:39:48,"{'food': ['snacks', 'drinks'], 'drink': ['alcohol', 'price', 'ABV', 'fluid amount']}"
FBPu7yyJl1EIr2Xm_R9PgA,XULqz9Je2rB61OaJCzidNQ,Zh8X1au_crT9jBs2LlPb2Q,1,2,0,0,"Horrible experience! It all started with our party being 5 minutes late, in which the hostess then informed us that our table was given away. We then sat at the bar, only to be told that every beer we wanted, was out of stock. After waiting for a half hour, we were seated. As foodies, we like to order everything on the menu and was told that they didn't think they could accommodate us. What kind of establishment is this? Our service was bad, our food was anything but good. Please do yourself a favor and go elsewhere. Too many good restaurants in Philly, don't waste your time here.",2016-05-08 02:18:42,"{'food': ['beer'], 'drink': []}"
0lD4Sq1S8PTFg5Lj5JnTOQ,PGx_pmKGlmzK4Y_15IWAUw,I4TFiNX5gTsJBnEGH2Tl8Q,3,6,1,2,"I can definitely see why people love to stop in here to grab a coffee or a quick bite, but it was honestly a bit of a brunch letdown after reading all the good reviews. I came here with a group of friends this weekend (6 of us total) because I didn't want to try getting in at one of the usual brunch spots and having to wait for hours. Seating was easy, and we pushed together a few tables to accommodate everyone.

However, the food choices are a little strange and not extremely descriptive. I split the jalepeno cornbread and the mushroom frittata with my boyfriend. Both main items were extremely small (like 5 bites) and came with a small arugula side salad. All the flavors were just okay. For $9 each, I felt like the price point wasn't quite right, especially for this neighborhood. One friend ordered a green tea cupcake that came out very hard and dry, like it had been made days ago. The best-looking dish by far was a vegan sandwich off the lunch menu. 

I was happy with my latte and happy with the ambiance, but this place isn't in my 'hood and I honestly probably won't be back. Oh well.",2015-08-31 13:47:38,"{'food': ['jalepeno cornbread', 'mushroom frittata'], 'drink': ['latte']}"
hMisXaBhQQMVDxjPSH-_tw,7UuFJeZbZAcv2oeJ_-QcNw,rQW9iupvhk6ScPn2VPNLVQ,5,1,0,0,"Delicious, fresh and cheap. Not greasy, which I really appreciate.",2013-12-09 19:07:16,"{'food': ['Delicious', 'fresh', 'cheap'], 'drink': ['Not greasy']}"
jClaTDdvi7LcyL5R02gCRA,Ia42wGLOQcfkPl4mI08NUw,EtKSTHV5Qx_Q7Aur9o4kQQ,4,0,0,0,"We are so lucky to have stumbled upon this gem.  The atmosphere is relaxed. Seating is a little close - I recommend the bar seats. The cloister cocktail is great - I also recommend the morning glory fizz. Burgers are great. I recommend the duck fat fries. The wait staff is very knowledgeable and good with recommendations. 
Just loosen your belts and enjoy this mix of comfort food and gourmet.",2012-03-04 22:54:17,"{'food': ['burgers', 'duck fat fries'], 'drink': ['cloister cocktail', 'morning glory fizz']}"
1H9FoSrXx4kweyKVNM2tdA,PsL6tpRRXE47dsUsbepICg,htO_nlxkEsYHzDrtbiUxew,5,0,0,0,i love their coffee. and also the sparkling water service. :). best coffee in philly!,2012-10-15 01:47:20,"{'food': ['coffee'], 'drink': ['sparkling water']}"
KmqfuETijA5caFBPtPNBCw,2X4yIsAHtPi_UwfgaCCloQ,eFvzHawVJofxSnD7TgbZtg,4,0,0,0,"It's open late!! (Well, relative to other Philly cafes.) That alone is worth two stars.

And there are a ton of tables to work at.

And it's a calm, lovely environment that's nice and spacious. I prefer the decor/feel of the 22nd St location a bit more (it's more homey, cozy), but this one does the job. Now if only I lived closer to this cafe.",2013-02-26 01:28:09,"{'food': ['pizza', 'pasta', 'salad'], 'drink': ['coffee', 'tea', 'soda']}"
Pf1GQ0K6kaAgu7Kv8b9jhQ,JFtxyGW2mKn2Gf6K_P8LzQ,gCcJTKC40CL0XtYYGfcXDw,5,0,0,0,"This place is awesome. ""Thank you for smiling at Smileys. I love your smile."" That made my day. I ordered the beef gyro platter. It was delicious! This place is definitely a must try in a manayunk.  Great food and service.",2014-07-01 15:06:39,"{'food': ['beef gyro platter'], 'drink': []}"
8n62BZNlJlEd6Wxqr8pAvg,vZZC-36QoDZp0o9g8vdwZg,14ZGwnDyydXdSBsLXpSUrA,3,2,2,1,"HEY LoOK HERE!!!! 

Please take the time to listen.  3 stars is just what it says A-OK which this place really is.  It's very clean and the service was great.  However I felt the portions were small.  You must understand I am a big eater I love to pretty much stuff my stomach until its full before the food even settles.  So.. If you are a normal eater the portions will be great however if you like to eat so fast and fall in love with every bite just order an appetizer and you will be fine.  Go ahead try it out, it's the only way you'll know.  Pad Thai is always a safe bet if you are unsure. Trust me.",2010-01-17 07:58:00,"{'food': ['Pad Thai'], 'drink': []}"
4vwWZjTwQCjJCrLfjQspdA,hBmrTb3cLdNdDcLQlG7BMg,4RMHlggaIdNibPUJPVEd6w,1,0,1,0,"After we ordered our beer we noticed our phones were dying, and desperately needed to charge them since our bus tickets were on them. When we asked if they could for just a few minutes the waitress said ""no"" due to policy. Unbelievable, especially since this venue is catered to travelers. This place should be shut down ASAP. There's a great bar called Slainte right across the road so go there instead!",2014-11-15 00:01:10,"{'food': ['beer'], 'drink': ['beer']}"
H_NBf7-ZhqOrbuxc9Yz6Tg,Au58CnEF8fX5memBGDGEFw,DsKzHnkLKnxZTVsFpts4oA,5,0,0,0,Atmosphere was great.... Great and different mix of people! Had drinks and appetizers - overall good... Will be back when I am in Philly!!! Plus an upstairs eating area and a rooftop bar!!! The bartender was great!!!,2012-11-14 07:14:17,"{'food': ['appetizers'], 'drink': ['drinks']}"
hAHmr0brJ5hfiPcevTNgvQ,KHsa9LuymDe5oQr4VSE-3A,u3Krpt7IdsJ26jj83uwNBQ,4,0,0,0,"Very tasty... I ordered the sample special for 15.00 to try different ones. You can pick 6 an additional $1each for the seafood ones. I had the seafood , salmon, cheesesteak, chicken Parmesan ,  general tso's and the Caribbean Jerk rolls. The filing was flavorful and meaty. My favorite was the salmon and chicken Parm. Not bad for a food truck. ... I see a future store front if she keep it up.  I wasn't able to take picture of all of them.  because we were too greedy.",2018-01-26 19:30:01,
m-mPAHllVofuFyyj-nVmzw,MQi0x9wBikORR6-LgMEpJg,OHzX-ZD9qyoeoxR8Z0dlIA,4,0,0,0,"Long ass wait, an hour to be exact, BUT totally freakin worth it!!!! Awesome bbq, maybe best in the city. Plus they hooked us up with a round of free beers for the long wait. Highly recommend!!! Just maybe not on Friday night lol.",2012-01-07 03:51:41,"{'food': ['BBQ'], 'drink': ['free beers']}"
AxpVzUVlKrJ_PuDTRchoFQ,W3qdi5NjJfab0SboT_Q7_A,EtKSTHV5Qx_Q7Aur9o4kQQ,5,0,0,0,"Great spot to sit outside and enjoy a whiskey drink. The burger was very tasty, came here after u read an article that they had the #1 burger in philly. Funny enough, this place is right across from Shake Shack (who won #1 in NY). I would definitely recommend going and trying their burgers and drinks!",2016-08-27 12:25:33,"{'food': ['burger'], 'drink': ['whiskey']}"
DmPNBM_Oq4eRoeGTujpz_Q,YquwlKFkYJw4jWW3DE80iA,C_EtrXTygRX5RTUOKtO6Dg,2,2,0,0,"This was my first visit to the University City location, I'm a big fan of the Copa on South Street. I ordered a local microbrew, a veggie burger and their famous Spanish Fries. 

The food took a while to arrive but I wasn't in a rush. When the food arrived I had two bites, it seemed eddible but cold. I attempted to get my waiters attention for 15-20 minutes just to microwave the food (it's bar food and I'm really not picky) but he was busy attending to other tables. They were way understaffed, there were two servers and no bartender for the entire restaurant.  I overheard another table gripping about the delay.

I can't really comment on the food, it was too cold to eat.",2011-06-02 16:43:05,"{'food': ['veggie burger', 'Spanish Fries'], 'drink': ['local microbrew']}"
M4yh8Z0F4gBSgEHE5d4XDg,3C-AO6U7Qos-vA-8w2Wulg,4SQ5uczVt66-GGGeNQRfEA,2,0,0,0,"My husband and I were ending our night early, but before heading home we stopped in. It took the waitress far too long to come over and take our order. I was dissatisfied. Poor atmosphere and down vibes",2014-11-15 01:35:38,"{'food': ['dish'], 'drink': []}"
SaztyFigJq6pzSIO-G6dOA,-1MF2tosrw2WcCxeVNk81Q,y44MbCvvtmg1FpkNGSWisw,3,1,0,0,"I ordered a Bacon egg and cheese on a roll since they ran out of Texas toast. The roll was decent and was nothing to brag about. The bacon and eggs were the best part of the sandwich since the bacon was not overcooked and it still has a crunchy texture. The eggs were fluffy and fresh, it certainly did not taste like other cardboard eggs. However, I would not recommend the hash brown as it was too greasy for me. Overall, if you're here to grab a quick bite, this place is decent, but that's it.",2015-09-10 12:34:30,"{'food': ['Bacon egg and cheese on a roll', 'Bacon', 'Eggs'], 'drink': []}"
NMW6yoTVPnJTZBE09OeiSA,USD9k93iOIB88v93B5iBcw,mUIBtlWNPD7sz3rGGWQ1RA,5,0,0,0,"Fantastic greek cypriot byob spot! Superb food. The appetizers, entrees, and desserts were amazing. The service is great as well. Recommend this too all that like mediterranean cuisine.",2011-08-26 15:46:52,"{'food': ['appetizers', 'entrees', 'desserts'], 'drink': []}"
i7nPZKl-RHpJVI33Xuk3OQ,lLE9v9rNcciAi6QxAUSWzw,7yPzOek7Af2dKWGYKpcHWA,4,4,0,1,"In our ongoing interest in learning of new cuisines we made our way this afternoon to Khmer Kitchen. We have never before tried Cambodian food and were not familiar with any in the city.  An online search took us to the corner of 6th and Morris in South Philadelphia.  Like several other unusual Asian restaurants this is just a small place, clean, bright and unpretentious. But it did have lovely live roses on the tables.  Our young waiter was a great help to us. My guess is that he is American born and a so a bridge between two worlds.  As such he was a great help to us in selecting our lunch and explaining everything about how to enjoy or afternoon at the table.  One thing to know is that even though the menu at Khmer Kitchen divides dishes into ""appetizers,"" ""traditional,"" ""meats,"" etc. All dishes are served at the same time: a method that is most common in most Asian community restaurants. We have now ceased to try to ask for the soup before the main. It just doesn't happen. Everything is on the table at once and you pick as you go. 
But to our lunch. Our first selection as appetizer (although it arrived with everything else) was the mussels in a ginger sauce.  While we actually did not get to them until a bit later, the mussels appetizer took your tastes to an experience of a sea with salty sweetness and spice: an absolute delight worthy of the finest gourmet kitchen.  From the advice of our serve we also had before us a soup of tiny eggplant, read peppers, celery and chicken in a curried broth and also a dish of ground pork served with a variety of raw vegetables.  The soup surpassed anything you might imagine: an entirely new taste enhanced by wondrously crisp fresh vegetables. The ground pork, our server explained to us, should be eater like a vegetable dip by touching the vegetables into the pork mix. Once again, the crispy raw vegetables mounted with the sweet and salty pork took the tongue to heaven.  By the way, if you prefer spicy, they will give you a little dish of finely sliced red peppers. But beware. One of those mini-slices goes quite a long way.
Now to Khmer (Cambodian) table manners. The first thing we noticed was that the table setting had no chopsticks but only a fork and spoon. This seemed a bit odd. But then we stealthily observed the Khmer families around us. It seemed that you use the fork to push the rice and accompaniment onto your spoon.  Then the spoon, and only the spoon, was raised to the mouth.  It also seemed that for certain things, you could use your fingers.
Cost wise, Khmer Kitchen is slightly more expensive than other community Asian restaurants, but only by a minimal margin. The bill comes to a little more than ten dollars per person, per course. If interesting and different cuisine interest you, make an excursion to Khmer Kitchen. Because of parking I would suggest lunch over dinner.",2014-08-13 21:55:33,"{'food': ['mussels', 'eggplant', 'ground pork'], 'drink': []}"
4VN_kw7oqNlH43IMqvC8uA,iYXQCx7IWJslr_WTLjn6lw,A0F-h3xJm_6gHDKcDQwSrQ,4,0,0,0,"Came here after a meal at a restaurant nearby. They were friendly and let us sample as many as we wanted! We ended up getting the mexican chocolate (really spicy) and hazelnut gelato. I was a little sad cause we ended up getting more of the mexican chocolate than the hazelnut gelato (it was like 20/80).

Good gelato, never fails.",2013-07-17 16:26:33,"{'food': ['mexican chocolate'], 'drink': ['hazelnut gelato']}"
a1kLlNQvA6unw627d_jKug,O0enDRwITAuQUa2iSqJJSw,I5KZm-NnxYeEQsmp6nK5_w,5,0,0,0,"I first went to the  resturant on ew Yea's Eve in 2005 maybe, we had a blast and the food was just delsh. One standout recomedation was the cervecheshrimp which was te best ve ever had.  Wereturned on severl occasions as a couple and brought other friend there, everyone raved about the food an the vry cool tmosphere.  Well iwoul up having my wedding dinner in the privae room on the secnd floor, again another greatime ws had by all.  If you like Mexican food  ths is the place to go, t's adelight in food, ambiance, and pleasure.  wold tellanyon to go there.",2012-04-05 04:34:56,"{'food': ['ceviche', 'ceviche shrimp'], 'drink': []}"
Zt8_TAZPJWQnaJleaPk0xg,-dSBNes6SAT-PC_7cSr-LA,XBdaG2kQ2Iz9VNGPZokjYg,3,0,0,0,Have eaten here a couple times -always just ok.I recently had an salad which was pretty good fresh with good dressing but I can't understand how Italian restaurant can put crappy tomatoes in their salad.Not red slightly yellow tomatoes don't do it for me!Put some good red ripe vine tomatoes in a salad!I use better tomatoes in my homemade salads!I went  back again with the hopes it would be better Had fried calamari it was rubber.Had a pasta special that was  nothing special at all I could of made it at home for half the price.24 bucks for pasta with sausage really ugh !overpriced for average Italian food!,2014-05-31 00:29:44,"{'food': ['salad', 'pasta'], 'drink': []}"
OqYx4RCSxnGUL08Xaj5UHQ,g_e8KQbdE3ckyR3I7YZsYQ,HUp0fqvl0XbZmrCp5FfBjw,5,0,0,0,"I'm just making an account and I figured I'd review the place I ate at most recently! Fresh Gulf Seafood gets fresh seafood daily, and all of their food is also fresh and tasty. They season and bread things themselves before frying it up for you. Things can be served on bread, by itself, or on a platter. They also have great steamed specials which are especially impressive because you get corn on the cob, broccoli and a baked potato with your choice of steamed seafood with garlic butter and old bay (maybe with other spices) sprinkled on top and it is VERY satisfying. 

The cashier and his mother are incredibly nice, which is a plus. They help maintain the look and overall cleanliness of the place which are top notch. 

Not the fanciest place but if you're looking for good take out, this is a good place.",2014-12-21 21:11:33,"{'food': ['Fresh Gulf Seafood', 'Steamed Specials'], 'drink': []}"
5kXpXdybnpUSGVtcALue7g,fi_5tZgRmOrBPsmKfKpjbQ,9gObo5ltOMo6UgsaXaHPWA,5,3,0,0,"Wonderful anniversary dinner, awesome table by the panoramic windows, the most intelligent server (Harrison) ever, and the food!  Amazing lobster salad, veal ""stew"", and pistachio gateau.  Better than most restaurants in Manhattan.",2013-03-25 18:02:01,"{'food': ['lobster salad', 'veal ""stew"", and pistachio gateau'], 'drink': []}"
sWE6Nb93DffPI1HLVMTbhw,TUKj2DlxkYQYXetk5X7Qmw,cXSyVvOr9YRN9diDkaWs0Q,5,0,0,0,"First of all, I wanna thank fellow yelpers from philly for recommending this place. I can't yelp enough about how good the food was. The potato latke (a substitute for potatoes/grits) was delish. Having a sweet tooth, I have to admit the pancakes were my favorite. For the filling you can choose from choc or peanut butter chips, bananas, almonds, walnuts, or pecans. Mad good.",2010-07-18 03:37:40,"{'food': ['potato latke', 'pancakes'], 'drink': []}"
TssTw7Kuq6AjjabVZ-BXcQ,g8vw7MyGXExlIdHCw397Mw,QDvQmizwCiFGf3y0Om9jyA,4,2,0,1,"I work in South Philly not far from the Navy Yard and have been wanting to try the food here for a while. So yesterday, a few of my coworkers and I decided to have lunch here. I had the Prosciutto sandwich with a vinaigrette salad on the side. The sandwich was pre-prepared and could have used a slice more of prosciutto, especially ringing up at $8.25. But the flavor was there and the bread was yummy. 

My one coworker had the HUGE turkey sandwich which was very good and the other had the chicken ceasar wrap which she said she liked a lot. 

We got there right at noon so the lines were not too long, but decent sized. It was a little confusing having to be in one line to order, another line to pick it up and then a third to pay. But it was reminiscent of the college dining hall, with way higher quality food and better dressed people everywhere. 

The view is nice right out to the water with a few huge ships to look at and I love anything URBN, so you know the place was decorated very 'cool'! 

For dessert the 3 of us split a chocolate chip cookie (extra crispy just the way I like and no lack of chips :) and the fruit loop treat (rice crispy treat sub fruit loops) SO GOOD!

All in all it was fun to try a new place and I would definitely return to be a little more adventurous and try some sushi or warm food.",2013-02-01 15:40:22,"{'food': ['Prosciutto sandwich', 'turkey sandwich', 'chicken ceasar wrap', 'chocolate chip cookie', 'fruit loop treat'], 'drink': []}"
ogVINzK8AdXzpV80oKdQSQ,JRqcvqXiQVD2KOXJdpOxdg,4_W5pstoN1166TGjjPOrMg,4,0,0,0,"Great selection of beers (a little too many IPA's on draft for my taste but the bottle selection makes up for it). The food is excellent, we I had Eggs Lancaster with scrapple which was quite good. The seating space is great and you can usually find seating.",2015-10-27 13:12:24,
