review_id,user_id,business_id,stars,useful,funny,cool,text,date,ner_results
A7NoK3Lk92pR-8ru8Qci3w,Y0ymek23PIy8SavJQOLYDQ,htO_nlxkEsYHzDrtbiUxew,2,0,1,0,"We've been enjoying coffee at La Colombe for many years, but lately the baristas seem not to be trained properly.

In the past, my latte would be crowned with a 1/2 to 3/4-inch layer of thick, creamy steamed milk foam. It would be so dense that I could run a spoon through it and it would leave a fairly deep trail. 

But the last several times we've been there, there has been almost no foam - what foam there was consisted of a 1/16th to 1/8th-inch layer - and it was thin not only in depth but also density. I can make coffee with hot milk at home; I don't go to La Colombe for cafe au lait.

This has been extremely disappointing! 

Perhaps they are spending all of their energy elsewhere, like the TV show, or the newly opened shops. Hope someone in management wakes up and trains their baristas better, or we will have to find another place to get our coffee fix.",2014-03-17 19:40:47,"{'food': [], 'drink': ['latte']}"
suyJMUgvUMDjZ_n8DRWo0g,WT36RE4WkUIaEbLDjkPB3g,GUMVStVaJfWmCIpQA4TtHg,1,2,0,0,"Fishy tasting roles served on overly complicated plates. The individual pieces were cut with what looked like a rough knife giving the fish crooked edges and unclean cuts.  Their unique rolls and combinations are too complex and the ingredients aren't exactly ""fresh"".  

The dining room is a super loud room with tables in front of a wall-long bench and chairs on the opposite site, almost too tight for comfort.  

The service is fast, but the food is horrible.  Both my date and myself left with stomach pains and then spent the night in the bathroom.

AVOID THIS PLACE AT ALL COSTS!!!",2015-01-08 00:18:06,"{'food': ['Fishy tasting roles served on overly complicated plates.', 'Their unique rolls and combinations are too complex and the ingredients aren\'t exactly ""fresh"".'], 'drink': []}"
YBch6bnJIgO0-96ttrkQXg,0nAhmMLOEEDODpntfVnPDQ,dO4iyNK2KzLMe1kXLCskbw,3,0,0,0,Just a classic pub. The Chesapeake fries offered a nice change of pace.,2014-08-01 00:52:39,"{'food': ['Chesapeake fries'], 'drink': []}"
B9fEN2qJ4Hu3UIrzriyYAA,rEdnbeWnj0z8NTReTXrB4A,I5KZm-NnxYeEQsmp6nK5_w,2,2,0,0,"The food and the atmosphere here is great but not good enough for the poor service.  Be prepared to be here for awhile if you are coming to eat.  The waitress did not ask for a drink order and every time we needed something we had to track her down.  

I am not a fan of a traditional Mexican restaurant where there is not hot sauce or salsa on the table, you have to ask for it and they charge you a $1.",2009-03-15 21:18:14,"{'food': ['food and atmosphere here is great but not good enough for the poor service.'], 'drink': ['The waitress did not ask for a drink order and every time we needed something we had to track her down.']}"
hZUb5a581ntdaBmUBnDf6Q,DwyevLE3RWfuBzgcJtRFyg,jULIPydhMj18KOI5OHTwfA,5,0,0,0,"I love everything about this place. We were greeted by friendly service, by a guy who helped us order by describing in detail. Ordered four tacos and loved them all equally. Sangria of the month (guava rose) and a beer. The price was on point. We will most definitely be back. I love you Jose!",2015-09-11 19:30:59,"{'food': ['tacos'], 'drink': ['sangria of the month (guava rose)', 'beer']}"
c2ykFoYTgdOactS1WhXAgA,UpQEczoOn0kd05Ez5XAeuQ,4RMHlggaIdNibPUJPVEd6w,4,0,0,1,Great place to eat and drink and can't believe it's in a train station. fantastic beer selection and food somewhat different (good). never expected a good quality eatery as I waited for my train to depart.,2014-05-28 19:06:21,"{'food': ['fantastic beer selection', 'good quality eatery'], 'drink': ['fantastic beer selection']}"
Qpmmy_pz2O390ka9uE8TEg,XFNB9NAHXK3M9yODTv_T_Q,rVfe1LHo55A2fworkm_jVw,2,0,0,0,"Ate here last night and the atmosphere was nice/service was lovely, but the food was underwhelming. Expected more for the price and from a place claiming to be emulating Italian Pizza.",2015-11-22 00:25:06,"{'food': ['Pizza'], 'drink': []}"
6f4JotT7TaCeAuS8O7QWTw,UTKi51WliYHe84zfEPKD-g,7mpYTDb24SywNMRn3yeakQ,5,0,0,0,"We went not quite knowing what to expect, but arrived and told our waiter that we wanted good food. He was very helpful and immediately gave good suggestions. We proceeded with open minds. We ordered several appetizers, a couple of bourbon flights and an entree. All very solid. The chef came out and was eager to hear our feedback which was resoundingly positive.",2013-07-20 17:08:54,"{'food': ['appetizers', 'entree'], 'drink': ['bourbon flights']}"
eHbuhkOtQSBhFpCnUcCHdA,Z6E1NxN6hzyVNdeYMxhl1A,h85b3MFPWyaopMBy8DpBpA,5,0,0,0,"Ron's is my family staple restaurant for Caribbean food. We absolutely love the place. The food is phenominal, the portions are HUGE and no matter how long the line, this is our place for the best Caribbean food. We have friends that are Ron's enthusiast and have made it their number one spot. I'm about to order some catering for an aunt in New Jersey cuz she can't stop thinking about the food she had months ago from Ron's.",2014-11-18 14:54:14,"{'food': ['Caribbean food'], 'drink': []}"
dox0NK0HhIMyE4qF-ntfrw,jXhSMz7KxMixxvcNDMx7Tg,hxEo_CKsmSMGXcHNLR9oow,4,0,0,0,A great little place that turns out excellent dishes. Great service and a full bar. I think it doesn't market itself properly. From the outside it appears as a pizza joint but it is much more than that.,2012-05-06 23:27:07,"{'food': ['dishes'], 'drink': []}"
vCeCRtq6MDpc2R8Vwyakbg,WY45dErkSEoW1m48qYTE4w,DXYhpEv17mWqSqFjau7vhg,1,7,0,0,"Valentine's dinner, $70 a person, Filet mignon was  on the menu when it was served it looked more like pot roast. I called the owner and told him I was disappointed with the meal and said my girlfriend told me not to say anything at the restaurant. Said I didn't want to cause a scene. I didn't enjoy the meal, he said sorry you had a bad experience and hangs up on me. I was getting heated, I agree, but not to the point of complete anger that warranted to be hung up on. I called and said I'll send a picture of the meat. He texts me a picture of (as he says) ""standard grade filet"". I said it's not filet mignon like was stated. In the end he wins, it's not the servers fault the meal was trash, they got my $180 dollars so good for them. I'm sure their food is amazing on any other night, but tonight was supposed to be the tops and what we got was sub par.",2016-02-14 23:20:01,"{'food': ['Filet mignon'], 'drink': []}"
fhdi5zm_CKKalNZGe3zjBQ,nIqvVX27jhUy1PVY5B5vow,U30ggGzFpXvc2NZYwOW3qg,4,0,0,0,"Vegan mango lassi! Good, but too sweet. Actual food was good, also. It's also very decently priced if I remember correctly.",2015-01-07 07:32:04,"{'food': ['vegan mango lassi'], 'drink': []}"
3O0nfXdnole_q-LLV1AOHA,0sgfq4j9kJUTCCqlAo_L3Q,cXSyVvOr9YRN9diDkaWs0Q,5,0,0,1,"This place is our favorite place for pumpkin pancakes( seasonal) I could eat them all year. The place is small (5th st.) and over wanted,(this is a good thing) people line up for what seems to be a block long but if you can wait you won't hate (sooooo gooooood)!

 **update they do have second restaurant at 21st. And south st.**",2013-06-01 17:02:37,"{'food': ['pumpkin pancakes'], 'drink': []}"
vcu06sIURBb2BJ-lQGUSAg,F3_-4dt8c9d2G3TceT3orA,AlxnbBd2JNkozNvI0OvRLQ,5,1,0,0,"I love Murph's. It is a nice, quiet place to get fresh and delicious Italian food. The specials are so hard to choose from because they all sounds amazing. I suggest going with a large group so that you can sample everyone's meal. Tonight I had a sweet potato gnocchi and wanted to strangle the incredibly sweet chef just because I could not stop eating. That did not stop me, however, from trying some gelato dusted in coco powder. The back patio is a great place to eat during good weather, especially with some decent beer on tap.",2015-10-10 21:40:27,"{'food': [""Murph's"", 'sweet potato gnocchi', 'gelato dusted in coco powder'], 'drink': ['beer on tap']}"
yaFN2OXDjr9IBSiaAp0ONA,r3Jx0cQHedSOTv_orV7PUA,wUnLSg_GKfEIQ5CQQ770_g,5,0,0,0,"Omg amazing!! We are foodies from California and self proclaimed wine fanatics and this meal was impressive. Very impressive. Yes I had to make reservations 3 months in advance for this date and time (so glad I did as I'm her just for 2 nights). So worth it. Exceptional service. Amazing wine parings and the food was F***ing fantastic. I don't mean to be vulgar but I can't help it. 

The ""storefront"" was so cute. If you blinked you missed it. The inside was super pleasant. The only drawback was they must have recipients waxed/polished their floors as my high healed shoes provided no traction when I ""skated"" to the bathroom. Kind of embarrassed but yet sooo didn't care because the food and service was THAT GOOD. Ladies just keep this in mind if you recently had your red bottoms rehealed as you'll be skating to the bathroom.....so not elegantly. Lol",2017-10-29 05:58:20,"{'food': ['amazing', 'fantastic'], 'drink': ['wine']}"
2aCcaTqIrJk32eyn4zb1YQ,iwP1y6VF1tAm5AxrpQGDZw,-ATiAtTikuGuqvaW2O6tNA,4,0,0,0,"Went for brunch with a group of 9, called ahead and got a table little to no wait. Sat down and was immediately greeted by our waitress for drink orders. It took her longer to get back to the table to take our food orders but it was also very busy when we first sat down. Food came out about 40 minutes later, but was very delicious. Many staff came over while we ate, checking on drink refills and if anything else was needed, but never felt like they were a bother. When it was time for checks the waitress took extra time to make sure she split everyone's checks correctly and was friendly while doing it. Very reasonably priced. I would go back.",2018-04-29 22:27:05,"{'food': ['brunch', 'food'], 'drink': ['drink', 'drink']}"
f4HzVLDD-bsJ7PXnIJWnlw,oO-9vyJVYAxOWFGvts_YEg,kkcQYuF3w5iHnHMf0EnRhQ,5,0,1,0,"My family and I made it to Joe's Steaks (formerly Chink's) today for the first time ever.  After hearing about the great Chink's Steaks for so many years, I have to say I was NOT disappointed!  I ordered a cheese steak, American cheese, with fried onions.  It was DEE-LISH!!!  Truly.  And I just stuck with my regular Coca-cola, but my husband got a cherry soda, which I sampled.  It was so yummy.  Next time I go back I'll be trying the cherry soda with my cheese steak!",2013-08-18 04:08:13,"{'food': ['cheese steak', 'American cheese', 'fried onions'], 'drink': ['Coca-cola', 'cherry soda']}"
12uSWepEgs7NHTGcZLQZHw,CTV_-A_P2c-2q4c-q1W8LQ,j99PtxlKTW_u5alE4jiqHQ,4,0,0,0,"Take this restaurant at face value--mom n' pop homemade cookin'. It's very scrumptious pasta and sauce dishes--choose your combinations! Be prepared as the ambiance is very 1972 and the bathrooms are 1960'esque. 

My boyfriend enjoyed the chicken Parmesan which was a massive proportion. I would definitely recommend their homemade marinara sauce. 

I will say I didn't care for their bread, but my boyfriend said he loved it. 

It's the oldest family Italian restaurant in the country. Give it a try!",2014-04-24 13:26:58,"{'food': ['pasta', 'sauce dishes'], 'drink': []}"
ek_BQ5j6z3fr4Rgi0fI0rg,S2paEeCwL3nsTQdCYzyeag,rQW9iupvhk6ScPn2VPNLVQ,5,0,0,0,"Haven't been to this truck in some years... rarely downtown at lunch. No menu... no signs... had to be the Falafel Guy. Freshly made falafel with garlic, guy described every topping as falafel fried. Couscous, hummus with poblano, but the most incredible addition... sliced grapes. 
Taste Perfection. $4.",2011-03-26 15:11:33,"{'food': ['falafel', 'couscous', 'hummus', 'poblano', 'grapes'], 'drink': []}"
9cnMwlMJGcVysQEr9UuHag,KtYgR2xmlqFO_1w5VQTryw,Dv6RfXLYe1atjgz3Xf4GGw,5,1,0,0,"I was not in philly long but was glad to find this place. yummy and fast and easy. sweet potato fries were a nice treat and the mock chicken was something i would order again.

Glad to see the vegan options too.",2012-06-06 18:49:37,"{'food': ['sweet potato fries', 'mock chicken'], 'drink': []}"
KQCIdpK0S97BtsyRTJMKcg,ehl9pNdgxOZtejDjIghoEA,Fc_8eLlcq5yy4DzrEeqEaQ,1,0,0,1,"In my one experience here, this place overbooked on reservations so there were two other parties besides ours waiting for the same room. When we got there, the manager told us that they had too many reservations, so when I complained he finally gave in and gave us the room, but at the expense of his other guests. 

The manager was extremely rude when we left, and I advise those who go here to check out other places.",2014-04-06 21:13:04,"{'food': [], 'drink': []}"
ufCQTEL10bjyakDq7PiD2g,EKpuzlcAUkP1aXC4_KuGoQ,krTHKI0YOpASr4gz2CVWFw,5,0,0,0,"Well, I must say I have probably been to every single cosi in Philadelphia. I've been here billions of times it's my favorite/only place to grab quick affordable food. I have had... Pesto chicken bowl , pesto chicken melt 2 million times, adobo bowl once, BBQ chicken flat bread pizza, chicken Caesar salad, Shanghai chicken salad, chicken noodle soup, tomato basil soup which I love, turkey light with spicy honey mustard. And the best white chocolate and pecan cookie you'll ever have in your life. Good quick food. Fresh ingredients my favorite place.",2015-04-18 01:47:56,"{'food': ['pesto chicken bowl', 'pesto chicken melt', 'adobo bowl', 'BBQ chicken flat bread pizza', 'chicken Caesar salad', 'Shanghai chicken salad', 'chicken noodle soup', 'tomato basil soup', 'turkey light with spicy honey mustard'], 'drink': []}"
4MYlyyRWUIa-V3wvxZEaVw,dIKGGMYW2SocsGVqp2ZXCg,EtKSTHV5Qx_Q7Aur9o4kQQ,5,0,0,0,"Best burger I've ever had. Friends convinced me to add the fried egg in addition to my caramelized onion and bleu cheese. Absolute score!
The seasonal beer was an oatmeal brown ale that was fantastic.",2011-01-13 03:47:16,"{'food': ['burger', 'fried egg', 'caramelized onion', 'bleu cheese'], 'drink': ['beer']}"
sc-SvSBQBOYGzHhBDW3_tw,CkrwgoY_Cdbj60IQXH-AQw,GUMVStVaJfWmCIpQA4TtHg,2,0,0,0,"Crazy Sushi is a popular sushi joint located conveniently near the shops of Chestnut St. I have read many reviews of both Crazy Sushi and Vic Sushi (see review) so I decided to try them both.

From the outside, Crazy Sushi looks like a typical sushi hole-in-the-wall. When you enter, it quickly turns a bit fancier. Dim lighting, nice tables, clean bathroom - a solid looking restaurant. I dined in at around 5:00 PM on a Sunday and was the only guest. But, onto the food.

I ordered a spicy tuna crunch roll, a mango/avocado roll, and an order of tamago sashimi. The food came out quickly and the waiter was friendly and polite. The presentation was also beautiful. They served my sashimi on a mountain of ice with the rolls to the side. However, I was rather disappointed with the food, especially after reading the reviews. The spicy tuna roll was incredibly dry. It seemed like it was 85% crunchy, and 15% tuna. The avocado/mango roll was actually very good, but not worth $7. The tamago was just okay, would not order it again from here. 

Although the menu had a plethora of choices, ranging from sushi appetizers (one I recall was spicy tuna wrapped in seabass) to a two page special roll list, the sushi fell short and I do not think I will be returning. These reviews are a bit Crazy.",2017-07-31 00:33:34,"{'food': ['spicy tuna crunch roll', 'mango/avocado roll', 'tamago sashimi'], 'drink': []}"
2VLdgDdLqmj2dIIzBbwV1A,2ODGXqBzeHZWq0rJeEB9PA,u7_3L1NBWgxhBM_B-cmmnA,4,0,0,0,"We visited for dinner on the recommendation of a local; the Salsiccia pizza was delicious - fennel sausage, roasted fennel, slightly charred crust.  A small was the perfect amount for 2 adults to share, although the waitress tried to upsell us on a large (""I can eat a small by myself"").  The salads that we saw nearby patrons eating looked great too. Seating is communal - large picnic tables and bar seating (both by the bar and the pizza oven).  Open view of the pizza oven was entertaining!",2017-05-16 18:10:53,"{'food': ['Salsiccia pizza', 'salads'], 'drink': []}"
E7u03k5SED_OoxD6ieEonA,gFi-a1ibXQqNlYisedAt9g,B-DiQpcSTJ7oMMnwzbAGTQ,5,0,0,0,"So good and cheap. The flavors compete with the best restaurants in the city. My personal favorites are the chicken and sweet potato curry, the short rib taco and chicken satay taco. All are outstanding. When I can make it there I always get 2 tacos to eat for lunch and then an order of curry to put in the drug for dinner.  I only wish that I knew about this truck when my office was around the corner in the Cira centre!",2011-11-01 15:26:58,"{'food': ['chicken and sweet potato curry', 'short rib taco', 'chicken satay taco'], 'drink': []}"
NW7SIXL6IIqTrw1m42ng3w,CPivNJkWGNZQo2zBXrfXqQ,1UNorskttXSWuEcgzKzXcA,5,0,0,0,"Yummy yummy yummy , start with the shrimp tacos , and a side of truffle oil fries 5 the get the short rib enchiladas enough to share for two my new hang out , don't for get the margarita  I'll be back",2018-02-13 02:04:53,"{'food': ['shrimp tacos', 'truffle oil fries', 'short rib enchiladas'], 'drink': ['margarita']}"
KkfJHz1InA9skNztLItrmQ,8rnbgcWT4ygWCGZK7veE1g,D4PD-ZKV06keByyoouJzhg,5,3,1,2,"A Joey Mack's Boardwalk Pizza Haiku:

South Jersey pizza.
In the heart of South Philly??
Too good to be true!

Thank you.",2010-05-21 19:25:17,"{'food': ['South Jersey pizza'], 'drink': []}"
TH0SzF3o74PvRdCOfd8Z-Q,NqBYt9pw7kNoytFQ9ATS-w,-ATiAtTikuGuqvaW2O6tNA,4,0,1,0,"I got the salmon burger, it was pretty good. I'd come back to this place! My friend got the veal meatballs----DELICIOUS!!

I came back again and got the eggs benedict- average but I will keep this at 4 stars because of those meatballs. 

Service was good , friendly.",2013-08-18 21:40:08,"{'food': ['salmon burger', 'veal meatballs'], 'drink': []}"
OeC6lpyhtXi4CIPx7biF9A,zUtaL9RcI1YyYTf14WupQw,rQW9iupvhk6ScPn2VPNLVQ,5,1,0,0,"Amazing. Worth the wait (30-40 min at 12:30 midweek)--it doesn't hurt to bring some friends to pass the time! But hey, you're coming here for the experience. May want to avoid if you're a picky eater because there's no menu, and it seems like he throws in whatever he feels like that day. The food was so much better and more unique/interesting than the other food trucks around, and tasted really fresh! Looks like he puts falafel in everything, and that falafel was incredible. Go for it!",2017-10-04 17:22:01,"{'food': ['falafel'], 'drink': []}"
tRF_k3Q9U_5VCDxM4IGztw,fIzwuX97b14YnqUgRg2fTw,j99PtxlKTW_u5alE4jiqHQ,2,0,0,0,I think they are living off of the reputation of olden days.  The food was just meh.  A lot of history behind the place but could use an overhaul.,2016-11-25 22:20:47,"{'food': ['meh'], 'drink': []}"
npLDIZMRS25qA5yf3qfJVA,odCU0fCCNWxfyp1QcCsrsg,FnEkr6LzjuGsg93Z7fkl7Q,5,0,0,2,"Being open when they say that they will be is helpful!  Pulled pork grilled cheese hit the spot!  Loved the fresh ranch dressing that came with the chicken fingers and really, really enjoyed the Mac n cheese.  We are a happy  pair.",2018-07-28 04:43:07,"{'food': ['pork', 'grilled cheese', 'chicken fingers', 'mac n cheese'], 'drink': []}"
z5RmD0OM19Pa-WIqlfOMMA,VAlw0kMMWj75mkE8aUVfaQ,B-DiQpcSTJ7oMMnwzbAGTQ,5,0,0,1,"Oh me, oh my, the Cap'n Crunch-Coated Tilapia Burrito was well worth the walk across the Schuylkill river and the relatively short wait. Because you see the Cucina Zapata food truck is a well-oiled machine: place your order at the window, join the anticipatory crowd, and before you know it, they're calling out your name. I took my lunch over to the seating area of The Porch, outside of 30th Street Station (see, we do deserve nice things in Philly), and this is where the true magic happened. From first bite until last, it's one mighty, mighty fine burrito. The fish is fresh, it stays crunchy, and it melds perfectly with the other ingredients--without a doubt it's a ""two thumbs up"" burrito.",2017-10-14 13:49:55,
5qa6RlhM9U70uHcoUeQfYQ,kO6BY2Vj_bpO08AfO8YQBg,Dv6RfXLYe1atjgz3Xf4GGw,5,0,0,0,"I loved this place!! Service was bar none from the young lady taking orders and the young man preparing the food. I asked their favorite meal there the young man suggested the classic burger but prepared slightly different. He said don't worry, I'll take care of you. My first bite I knew he DID take care of me. It was so delicious!!! My head's down, mouth full, no time for talking (besides an inaudible murmurs of so good, yum and delicious)- gotta focus on killing this burger with no evidence left behind. Even if you're not vegan try this place. Everything plat based. Even the cups are made from plants. Gotta go back before I head home to California.",2017-12-31 01:58:28,"{'food': ['burger'], 'drink': []}"
f6KmQ5XnKQ9KTulvX0iqOQ,5jKScvMqxW_rzd0D8xgX1A,cXSyVvOr9YRN9diDkaWs0Q,4,1,0,0,"Came here for a quick work meeting this morning and its a nice spot. Couple things: this is not a cafè where you can sit and do work, once you are done your meal, you are getting your check. The place is tiny with maybe 30 seats and if you come here on a weekend you will wait for a long time to get seated. I ordered an omelet with spinach, mushrooms and jack cheese and it was excellent.  The service was fast and great. There is always someone walking around with coffee to make sure you are topped off the minute you need a refill.  In the spring and summer they have outside seating.  There is nothing proprietary about what they serve here and I personally like the place next door better. I would come back here again because The food is good, fairly priced and the staff is friendly.",2014-12-03 06:07:23,"{'food': ['omelet with spinach, mushrooms, and jack cheese'], 'drink': ['coffee']}"
5Dj1drKJBw3sytQCGsTCRg,fOznYzlurOTnfV8cpNUihQ,mUIBtlWNPD7sz3rGGWQ1RA,5,0,0,0,"awesome brunch at Kanella!  The French press coffee is so good - not something you see very often.  I was looking for something sweet like pancakes or waffles.  Unfortunately, their sweets menu did not really appeal to me, so I ordered the Cyprus breakfast.  WOW after eating that, I did not miss the pancakes!  Everything on this plate was delicious, 2 eggs fried in olive oil where they're still a little gooey...lounza which is kind of like Taylor ham, a delicious tomato salad, bread, and ... the best thing on the plate - halloumi cheese - wow is this stuff amazing?!  If you do not get this breakfast, do yourself a favor and order a side of the halloumi.  My husband had the lamb burger which was delicious as well.  Great place, would love to try their dinner.",2014-07-30 20:45:30,"{'food': ['eggs', 'lounza', 'tomato salad', 'bread', 'halloumi cheese'], 'drink': ['French press coffee']}"
zDoGWqYio9Tf79tjNqztoA,XfzgMLd7YBps8rXhKkIQ9A,OHzX-ZD9qyoeoxR8Z0dlIA,4,2,0,0,"Miss the old Khyber however having food later than seven and a full menu is great and going to be awesome.  I just dined there last night.  They only have an introductory menu but they are willing to serve what they have anyway.  I only wanted some fried shrimp and macaroni and cheese and Eric the bartender made that happen.  The macaroni and cheese was fantastic and could be shared the side is large.  My husband had a North Carolina Brisket sandwich with fries and really enjoyed it.  He believed he could bring his friends from the south here to try the brisket.  The fries were quite tasty too.  The beer specials are good however no longer $1 domestics for happy hour, but a $1.50.  However they have doubled their draft selection and increased their bottle selection as  well.  The only beer missing I think is Miller High Life, however I am not sure there are many people missing that.  The staff is extremely helpful with the beer selections, and the menu.",2010-11-29 15:36:10,"{'food': ['fried shrimp', 'macaroni and cheese', 'North Carolina Brisket sandwich', 'fries'], 'drink': ['beer']}"
PxOSlgNMQx0fHyYHFzHc0A,mZrbrAAtQ0Xmt_MMUEs6Kg,bSWL0YxfawjS03_g2kgujA,4,2,0,0,"Gotta give credit where it's due...

It's almost an obligation that every pizza place have some sort of ""premium cheese fries"" ...usually that means cheddar, mozzarella, swiss, bacon, and ranch/ceasar dressing give or take. Everybody has something like this with their own name attached... mega fries, super fries, ultimate fries, and in the case of Allegro... Allegro House Fries. 

Wow... in all my years Allegro is the only place that is SERIOUS about bacon. I really couldn't believe it. It's really cool that they got this right because I guess given the area... its ""college food"" and the only other guys who come anywhere close also had ""college food"" only Temple's campus. I've been out of Temple for years now so that other place is just a memory, but Allegro is here and now... and still in my neck of the woods. I'll have to get back here more often.",2015-04-23 16:39:31,"{'food': ['pizza', 'fries'], 'drink': []}"
_gt_Eas1mCkQoWkCeijkfw,Xpe2QpW-rhnRlvQsDhtaOQ,7mpYTDb24SywNMRn3yeakQ,2,0,0,0,"Not great service. I am fairly certain my salad was never put in because it came out way later than everyone else's entrees and I had to ask the server about it. I got it a few minutes after asking the server. Meanwhile everyone else at my table didn't eat their food as they were waiting for me to get my dish. No one came over and checked on us or noticed that 4/5 people at my table had dishes in front of them and weren't eating. 

The food itself was okay but a little oversalted.",2016-08-17 18:13:50,"{'food': ['salad'], 'drink': []}"
hDwlp2fdT5_5AEm2wW-W8g,qWFhKtzcHfbj6nCJwfTBiA,HTqXI5S2XcSlh_ylx9sE6g,5,0,0,0,Only tried the stuffed buttercream cupcake with sprinkles from here and it was outstanding.  Would come back just for that.,2016-07-19 02:44:26,
