review_id,user_id,business_id,stars,useful,funny,cool,text,date,ner_results
-xt140QILU17bPUSpyWq5Q,_VP9Y7tunpKI82tmK8KJVg,XpTNCVbO5wL1DtDyKzKqfA,4,2,0,1,"Sadly, I felt customer service on the phone and in store when trying to place my order wasn't the greatest. I called a few times and each time felt as if I were annoying them.  I also got that impression when I went in the store.  I probably would have gone with another bakery had I not known what a great job the cake decorator, Evelhyinne, did. She was absolutely wonderful! She responded patiently and kindly to emails.  Thank you, Evelhyinne, for executing what I asked for and making such a delicious cake!!",2015-08-23 01:26:02,"{'food': ['cake'], 'drink': []}"
lThxUMSttA31Cggu50O5hw,G8v02KYaIRk_Ts834bpoYQ,udsU77Rh2wAN7tEOmIUY7w,4,0,0,0,"Great variety, excellent flavours. Unique concept with a sit down cafe style menu and a specialty grocery store",2018-04-29 20:57:41,"{'food': ['Great variety', 'Excellent flavours'], 'drink': []}"
RBSgqjF6Uj7x4D3wvpH_Sg,jwmMWvA_yTjXbzK0ErnEOA,dSPA4yql9vUwnYRxHiVtHA,4,3,2,4,"I want to talk about this place all the time, but sometimes I hesitate.... 1) because I am not sure if I should say ""mah-kee-mah-n"" or ""mah-kee-man"" (as in MAN, I sure is hungry) and 2) I don't want it to get over-run with people. 

No matter, perhaps I shall head over there again to ask the staff... because I will  just take any excuse to go and indulge in their delicious selection of creative rolls that explode crunchy, spicy, creamy avocado-y, savory, sweet, tangy flavors in your mouth.   

Personally, I am a fan of spicy crunchy things so some of my faves include the sixers roll, the mcnabb (def the roll, ambivalent about the football player), the viking (VICTORY~!) roll, and the yellow stallion. 

I like the Spider roll here, but it's not one of my faves. Definitely a solid offering - upside, you get 6 pieces which is more than most sushi places, but downside is it's smaller. IMO, when the softshell crab is that small, you start to lose the flavor of the crab and get more of the soy-based sauce and/or avocado. 

Lovely things: BYOB, attentive and friendly staff, speedy food delivery, takes rezzies, relatively inexpensive for sushi and they don't rush you out. 

Sushi aside, I really enjoyed the agedashi tofu - Makiman's version of this dish comes with a LOT of bonita flakes. However, the dolsot bibimbap was just okay. There was so much sesame oil mixed in that towards the bottom 1/4 of the bowl, there was a pool of spicy oil drowning the remaining veggies and rice.",2011-03-29 18:32:13,"{'food': ['mah-kee-mah-n', 'mah-kee-man', 'sixers roll', 'mcnabb', 'viking roll', 'yellow stallion', 'Spider roll'], 'drink': []}"
_2xYFqtiAGA0fHNW3ULWvQ,IwSI7N6WrUUWM-NJ9cCbxQ,jULIPydhMj18KOI5OHTwfA,5,0,0,0,"My second time here.  Things I like include the friendly staff.  As a pescatarian/part time vegan...it isn't easy finding much variety in delicious Mexican cuisine.  

I love the tequila lime glaze on the Mahi-mahi.  The chips with the salsa are crisp and thin.  The waitress who brings the food out checked on me...twice.  

Great service  and delicious food.",2016-04-17 00:31:10,"{'food': ['Mahi-mahi', 'chips with salsa'], 'drink': []}"
cBbgvY3pzp0wuDWTuQUHnQ,0xEO0EHf9yuNQ0rA59EH1A,Z5po0aTuzKKblek5y6Sp8Q,2,1,0,0,"I was really excited to find that I was two doors down from this place and decided to go here instead of my planned trip to Shake Shack. The first thing I noticed was how small it was. However, this wasn't a problem since I was the only one there. The self service soda fountain is nice. The place was clean and attractive. 

I ordered the 500 burger and regular fries. My better half got the truffle fries. Those two fries are exactly the same except for some spray bottle crap that they barely put on the truffle fries. $1 more for a spray bottle and they didn't taste any different. Other than that, the plain shoestring fries are quite good, nice and crispy. I just don't see what this truffle fries thing is all about.

The burger was super hot and well cooked, but it was served with a cold bun and equally cold toppings. They didn't warm up as you ate it either. The flavor in the meet was acceptable but I've had better. The bread was terrible, super thick and overpowering. 

The shakes were pretty darn good, though. I would stop in for one of those again.

Since the place is small, the kitchen is right there at the seating area. There is no divider other than the soda fountain. The crew that was working there was very loud and annoying. They were ranting about music, singing, rapping, and just being vocally annoying. It was probably the worst part of my visit.",2013-07-22 02:06:11,"{'food': ['500 burger', 'plain shoestring fries'], 'drink': ['shakes']}"
HrhfH2ApAsVHlQiVXc136Q,ZRuDirE3HXPFTGjgmA73HA,Q-prSTdggNlxAEFV88BZOw,4,0,0,1,"This would be for my bar experience and not so much the food. We came here after eating at Supper with family and friends and a total of 9. This place was a lot smaller than I expected. We were able to secure the tables out front of the restaurant, even with the chilly weather it was ok because they had heat lamps underneath the awning, nice touch. They only serve beer and wine here, and what a great beer and wine list it was! They listed the beers in 4 categories:  Invigorating (Victory Prima Pils), Friendly (Yards ESA), Profound (TRAPPISTES ROCHEFORT 8), Extreme (Dogfish Head Immort Ale). I started in the Profound category and went with the Stone Vertical Epic 11.11.11. This is a fantastically flavorful beer made with chilies and cinnamon, probably one of my favorites.  I don't see this beer around very often.

My buddy and I hung out at the counter for a while and just sort of took in the location. It was a very diverse bar but was still very relaxing to be at. Looking behind the counter I noticed a large cheese cloth was covering something. Oh man, it was covering cheese. I didn't even see the cheese menu! Wow, what a great cheese listing. Again, they had some monster selections from all over the world. It was hard to control myself but restrained from purchasing any cheese. 
The wine menu looked stellar as well, great selections from all over the world. Disappointing however, this is another wine bar location that does not offer Virginia wines. I am telling you try a Virginia wine, they are good.

My buddy ordered the grilled asparagus salad and it looked awesome. I don't know how he ate it after the four course dinner we just had, but obviously it was good because he crushed it and licked the plate. 

My next beer selection was....the Saison Dupont. This is farmhouse ale that was crisp and had a good hoppy kick to it. Never had it before, but I will say this, I would get it again.

Overall pretty cool place, the only downside is that it gets packed in there because it is very small.  Next time I definitely plan on jamming on some cheese and enjoying some rarely seen beers!
Cheers!",2012-01-11 18:16:51,"{'food': ['grilled asparagus salad'], 'drink': ['Invigorating (Victory Prima Pils)', 'Friendly (Yards ESA)', 'Profound (TRAPPISTES ROCHEFORT 8)', 'Extreme (Dogfish Head Immort Ale)', 'Saison Dupont']}"
719izmrEtHLiaZOIbOw8pA,hINBeyMFRPgnGzH3kFupKQ,-V0vIgo6196MDn_x3ZaYmA,4,0,0,0,Heavenly crepes.  My favorite place for lunch when I have a lot of time on my hands.  It's a great place to read a book and have a leisurely lunch.  Really recommend the traditional crepes -- the one with mushrooms and eggs is lovely.,2010-04-03 22:02:49,"{'food': ['Heavenly crepes', 'traditional crepes', 'mushrooms', 'eggs'], 'drink': []}"
_jskShlqeesFHV-DhWjC8Q,ws7U_fXwEbjy55MZLd1ylQ,Z5po0aTuzKKblek5y6Sp8Q,4,0,0,0,"I don't consider myself a burger expert like some people, but like the Supreme Court's definition of pornography, I know a great burger when I taste it.  500 Degrees serves a great burger, at a very fair price.  I've had the regular burger and the kobe beef burger, and I highly recommend spending the extra $3 for the kobe.  A few years ago that upgrade would have cost you $40 in some places, so enjoy the bargain.  My kobe burger was beef heaven.  The regular burgers are great also, and the fries are very good. 
     I wouldn't recommend coming here to sit and eat nearly as much as taking out, but you can sit if you're lucky.  This is a great late night takeout spot and a bargain among top notch burgers.",2011-06-20 01:54:21,"{'food': ['burger', 'kobe beef burger'], 'drink': []}"
yN9d5dCdPgagvUT-vdHMqA,g-v8vEf3ZuLK6sl8Wm2e8w,RZtGWDLCAtuipwaZ-UfjmQ,4,0,0,0,"Party of 6 seated right away. The Lasagna was excellent. Served piping hot, a large portion, and the marinara sauce was very good. The Chocolate Cake was also good.",2013-09-20 03:59:57,"{'food': ['Lasagna', 'Chocolate Cake'], 'drink': []}"
Tr9Vu9Q0F3KigVzT-hlBBQ,UTvzWCtc6onT-ORmQUTjhA,OKPUO8zvBBL-OA6-SfDx8Q,5,0,0,0,"Great place and great food.  unexpected to find it in a strip-mall.  service was excellent, only had to ask for a water refill once at the end.  The chef clearly knows what he is doing, each dish was well made and thought out.  My wife's favorite part was the chocolate mint they brought with the check (homemade). this was the icing on the cake, everything from beginning to end was very good.",2012-02-19 05:01:12,
d_tuyVhs7R2-4_SWXmWTnQ,aLtvIGucNiiC1bIuTLpmqQ,2er_V-oAd7IbQ5YTY56r7A,3,0,0,0,"The burgers were interesting.  Nothing that blew me out of the water.  They do have more exotic burgers and I would say of the burgers I ordered (Wiki Wiki, Buckaroo and Grindhouse), the Wiki Wiki is the best.  Add an egg and it brings the flavors together.  Overall, it was meh.  I have had better burgers.",2015-05-20 16:16:59,"{'food': ['burgers', 'Wiki Wiki', 'Buckaroo', 'Grindhouse'], 'drink': []}"
Z11PvRfNcM90wudIsJIpgw,PWrQ5EH-XdX8gaORnfbWKg,FIQZMB4G1pfqOAByuJ1SYA,3,1,0,0,"I went here for dinner with couple of my buddies, got seated right away, ordered our food, it came out in a timely fashion, food was good very convenient, but 2 stars off first of all when our dishes came out,  no rice was served while the staff was literally standing right in front of us, we had to ask for it , it's a given to give rice with dinner or at least ask if we would like to have rice, secondly we asked for water...no show and 3rd but not last we were finished dinner and we were sitting around for like 20 minutes, before we finally decided to ask for the bill.  Needs some improvement",2013-01-16 22:15:14,"{'food': ['dinner', 'food'], 'drink': ['water']}"
kyp_6p92-lesWEnbjZyJJw,fJZCZVjkQ50_wUrOiIIQOA,XahxHmkaFOAwXix2VGRAUQ,5,0,0,0,"Where do I begin? Richies first of all is one of the friendliest, most happening places on Temple University's campus. I ate there nearly every day I attended and when I worked for the university, I ate there often as well.
The food is reasonably priced, which to anyone (college students and employees alike) is wonderful. No corners cut at Richie's whatsoever. He ensures that all food is fresh and prepared to order. Nobody ever leaves unhappy is Richie's motto.

Richie became more than my deli guy. He became one of my great friends when I as in college and is one for life. Go there, you'll keep going back.",2014-03-20 20:15:42,
dKZT-q-9wMbHL1gRE1L3lw,O6hzPzBhIeYNF5DvgMBdoA,PdMXmOWDRHICAx6SLgu1dQ,5,0,0,0,"Great experience.  Have been here twice now and have had great meals both times.  Service has also been spectacular. Tonight, I called at 5:45 and asked for a reservation at around 6:30 for 6 people.  Open table indicated nothing available until 7:45.  Hostess put me on a brief hold and was able to move a few things around to accommodate.  Server, Rodney, was the best. He was attentive, knowledgeable and accommodating but not intrusive.  We ordered the margarita, pepperoni and cauliflower pizzas; 2 salads; and the calamari. All were great. Highly recommend.",2017-07-23 02:03:41,"{'food': ['margarita', 'pepperoni', 'cauliflower pizzas', 'salads', 'calamari'], 'drink': []}"
eGJXK30AhIqxVP73-04lTQ,MdwDxeZK_GdRIN238nSGOA,7yPzOek7Af2dKWGYKpcHWA,5,0,0,0,"I heard about Khmer Kitchen through a friend & was so happy to give it a try! I was definitely impressed with the delicious food & great service!! It is CASH ONLY & I found out after arriving but thankfully I had some cash on hand! Being khmer myself, I would recommend this place to everyone, tasted like a good home cooked meal!",2014-09-14 21:43:45,"{'food': ['Khmer Kitchen'], 'drink': []}"
Yf1j7IvUbZIXgp4ZFIkJ3Q,KatJdPdrN92qH8_M3nPckg,MMRRS6YhVRx_iN5-JhMRYg,2,0,0,0,"The service is not great staff spend talking to each other rather than making sure the customers are taking cared of. 
The food is on a salty side and using too much oil. Not coming back",2015-05-21 12:49:00,"{'food': ['salty side', 'using too much oil'], 'drink': []}"
7qnkoHdwlAtkui_HzYDhkA,9Iid55tPHHwI7WAOVp-Ofw,nsZMsV91PfYQ8w2lbktpjA,1,1,1,0,"Went there and ordered two slices and after I already put my hands on my slice any wife took a bite out of hers the guy tells us 10 dollar minimum on debit cards. Now there was no sign or anything to tell us that, so I had to find some sodas and stuff to make it to 10 bucks. So far I don't even mind the inconvenience even know my wife does...lol. But just when I get done paying and getting ready to leave the delivery guy decides to reach over my slice of pizza with his dusty sweaty arm to grab his next delivery! I was so disgusted after this I threw my slice in the trash and grabbed my sodas and left. I will never go back. If anyone wants great pizza with great service go to Ginos pizza on frankford ave right near cottman. Thanks for your time god bless and have a nice day.",2014-04-07 15:45:22,"{'food': ['pizza'], 'drink': ['sodas']}"
ewZLcx1S6uT0f8Vdi93qfQ,Xi2cgNfkzSho6_SxVjHADw,Abejc-Rwq-73V95830wQPg,3,0,0,0,"I ordered the spicy tofu roll and the Parmesan fries. The bread of the tofu roll was amazing, but the contents of the sandwich were extremely bland. Luckily, I was given a side of hot sauce which made the sandwich a million times better. The Parmesan truffle fries were fantastic given the price. The people who ordered before me had a lobster roll that looked delicious. This establishment is a great addition to the farmers market and I would definitely eat here again!",2017-08-13 12:57:24,"{'food': ['spicy tofu roll', 'Parmesan fries'], 'drink': []}"
_niVGewdDcuhrR_1f6rcAw,GiWD9dVww8ElmBreEJ7dig,10wt8eSXI_PZfl9dRIiWmg,4,0,0,0,"The food was very good, although a bit on the spicy side -- I didn't mind it but a word of warning to anyone who might have issues with that.  The service was also good, but we were the only people in the place so I can't say how it would have been if it was busy.

I did feel that the prices were a bit on the high side, especially the section captioned ""Entrees.""   Unless two people are ordering from that section, rice is extra, at an additional charge of $2.99, which I also feel is too high for a side of rice (considering 32 oz of Basmati is less than $5).  Anyway, that's why I'm rating it 4 starts instead of 5.  Good food, but expensive for Vegetarian Indian Cuisine, IMO.",2014-07-04 13:14:22,"{'food': [""food was very good, although a bit on the spicy side -- I didn't mind it but a word of warning to anyone who might have issues with that.""], 'drink': []}"
xYd2t7d9ZKA_il3XHWpzsg,y9IB39WXl8lPLxtImUHzBg,d_tRshM-w6S4QxE4VVi8tQ,1,0,0,0,"I have reviewed this establishment before and enjoyed several meals there over the years. But that ended tonight. I will never set foot in there again.
We took my daughter on her first train ride into the city and I always liked Jones and since I knew it was family friendly, I thought that would be a nice place to go. It was early Saturday evening and not very busy. I was a little thrown off by how long it was taking them to seat us considering how many open tables there were but didn't think too much of it. The hostess brought us over to a very small table for two and put a high chair next to it. I said to her the table was way to small for three and asked if we could have a booth. She said no, they were reserved. As we waited for our waitress I noticed another family of three seated in a small booth next to us. When our waitress came over I explained to her my feelings and she agreed and got the manager for me. It took him some time to come over and he told me they were all booked for 7pm hence why they could not move us. Noticing it was 5 of 7 and the place was clearing out, I went on to Open Table and showed him how I could and would be happy to make a reservation for 7pm if I had to (ridiculous as that might be). He seemed surprised and said he would check again. He went over and spoke to the hostess and came back and said well we have several reservations at 7 and yes you could make one but we would probably sit you at a small table anyway. Sorry there is nothing I can do. And he simply walked away. So we really had no choice but to leave. It was a little after 7 and there were plenty of empty tables. Clearly they could care less about losing business. Good for them. We spent our money elsewhere that could accommodate a simply request to have enough space to place three plates and three drinks on. Rude hostesses and rude manager. Our waitress was very sweet and apologized.",2017-08-13 03:53:50,"{'food': ['dish'], 'drink': ['drink']}"
5nA5x0TGdL07JkxI3AH4oA,K5_PKlekCcVJW4U8izu1hw,lRbHFOIFuusN2WOR_ypQ_A,5,0,0,0,"Great Food! We went there while on a visit to Philly. The brunch options are delicious. French toast and pancakes are a must.
Prices are good for the quality of food and service they provide. Only take cash but they have an ATM on site.",2016-07-09 15:06:06,"{'food': ['French toast', 'pancakes'], 'drink': []}"
r448dZl9AZgNoKoomg4uRA,FC6FbLHEx-oCKDj4w3wEMA,u7_3L1NBWgxhBM_B-cmmnA,5,0,0,0,"We were taken here while on vacation in Philly. Lucky us! The pizza of the day was exceptionally good -- butternut squash topped with crispy sage. Based on others' reviews, we tried the rotolo and it was delicious, as were the Caesar salad, the red house wine on tap, and the other pizzas we ordered.",2013-12-01 17:53:05,"{'food': ['pizza', 'rotolo', 'Caesar salad'], 'drink': ['red house wine on tap']}"
CVsd8fg5RTalrmw6csHnug,GG0mFsEXb-02_dzFPqRV1Q,F8yozE3NWnImNApHO347gQ,3,1,1,2,"My experience at Marrakesh was good overall. However, this is not somewhere I'd frequent. It's really more of an EVENT than a meal at a restaurant. While it was good to do once, I don't see myself needing to do it again. I'm not going to try to explain the *process* and all of the things that go on here. Some things are good, some things are awkward, (bath towels on your lap, washing your hands at the table, pulling the hot chicken apart with your hands...) because it's really just something you have to go through yourself.

That being said, the food was indeed delicious. The lemon chicken, believe it or not, was a stand out for me. It was really moist and flavorful. One thing that I absolutely despised was this one drink we got. I don't remember what it was called (helpful, right?), but it was like a house special and the waitress highly recommended it. It tasted like...bleck! I can't describle it. Maybe licorice? Not sure. It was grossgrossgross.

Anyway, check it out when you're in the mood for a lengthy/different meal!",2012-01-12 14:00:17,"{'food': ['lemon chicken'], 'drink': ['house special']}"
g9r4NsPHG7rYQpSFGkCUbg,F_5E0rOSH63pLqE6Y2qeCw,SfUgDt8-6GAVTuwBMnedgQ,3,0,0,0,"This Wawa is still the old-style store that hasn't been updated. Overall it's fine, but the parking lot, as per usual at the older Wawas, is an unnecessary challenge. We were back visiting the area and had our hearts set on their delicious breakfast burritos. They changed to egg white burritos, which I guess is fine but they just didn't seem as good as they used to be. We ordered (and paid for) three sides of sour cream with our burritos and didn't receive them. When my husband went back over to have the mistake corrected he was given one sour cream and said that the woman didn't seem to believe that he had paid for three. She eventually relented. Not the best though.

All of this said, the store was clean and well stocked and all of the other workers were pleasant and efficient. A ""just okay"" Wawa is still far better than no Wawa at all!",2015-12-28 03:20:03,"{'food': ['burritos'], 'drink': []}"
pUfmluUBAPpDqv8XpTHKVA,A_M6lTuANTpWEAegbtHW6g,14ZGwnDyydXdSBsLXpSUrA,3,0,0,0,I am a big fan of Thai and this restaurant definitely stayed true to the fresh flavors that make the cuisine so good. Fish and chicken were both tender and well prepared.  The thing is the food had no oomph. Wonton soup looked great bit the base was too sweet. Same with the pan seared tilapia meal.  I ate it all but couldn't savor it the way I've had Thai at other restaurants.,2013-03-03 17:57:57,"{'food': ['Fish', 'Chicken'], 'drink': []}"
gW3vLXxDI_I8W-PZWPQglw,iseyWg56s_qRyLEzZjo-jQ,eFvzHawVJofxSnD7TgbZtg,5,0,0,0,We stumbled on this coffee shop while at the Doubletree next door. Had bagel sandwiches which were good. Iced coffee was excellent.  The weekend staff was very friendly! Will definitely come back when visiting.,2018-09-30 13:17:24,"{'food': ['bagel sandwiches'], 'drink': ['iced coffee']}"
8qucXEm0oNZISIqcSJ_t_g,5kcLlhJPLJL_GLwrAdbZAA,vCHNWdW-ys-nWUx3Cpvk8Q,4,0,0,0,"In my recent Panera review, I say, ""Oh, and if I want something that's a thousand times better than a bear claw, I will go to Swiss Haus Bakery in Center City where they have a delicious almond croissant filled with a huge helping of wonderful almond cream.""

Swiss Haus is my go-to place for a wonderful sweet treat. I absolutely love their pecan diamonds (basically pecan pie bars), raspberry walnut croissants, almond cream croissants, apricot/raspberry twists, and their cookies. They tend to be a little pricey, but it's quality comfort dessert food, so it's worth it. The ladies working behind the counter, owner Jim, and head chef Donna are always nice.

I recently tried their vanilla cronut. I had always been hesitant on getting it because it's $5 and for $4 I could get one of their other wonderful desserts, but I took a chance and I'm glad I did. I had had one other cronut from the now defunct Crumbs bake shop in Rittenhouse Square. I can see why that shop closed. Their cronut was hard and terrible. I don't like kicking something when it's down, but it was such a crappy cronut and I discovered that the place was closed a week later that I didn't bother writing a scathing review for it. To think that Crumbs started in my hometown, too! Blasphemy. Anyways, Swiss Haus' cronut was the complete opposite. The layers were flaky and soft and the outer part crisped perfection. I love the powdered cinnamon and the small amount of vanilla cream on top. Mine could've used a little more custard filling, but what custard I got was a perfect complement to the layers. The entire $5 experience of a Swiss Haus cronut was basically lunch for me. It's a very filling pastry! Try it, try it, try it. You must. Maybe a suggestion for future cronuts... a raspberry filling... mmmm!!!!",2014-03-15 20:05:29,"{'food': ['pecan diamonds', 'raspberry walnut croissants', 'almond cream croissants', 'apricot/raspberry twists', 'cookies'], 'drink': []}"
3tg4_-cCiWmUMhNmXVaVBA,4IAW0D4_gfvN7El4Fj5kMg,d_tRshM-w6S4QxE4VVi8tQ,5,0,0,0,"Atmosphere, service and food were great ! Next time we are in town we will re visit !",2018-04-15 23:32:54,"{'food': ['Atmosphere', 'service', 'food'], 'drink': ['great']}"
cdIlDzC4VQyM5z-IXHKwDA,jwyg6Bo4aYJYvJhz-UHbfg,Mjboz24M9NlBeiOJKLEd_Q,5,0,0,1,Went for the first time in a while very friendly food was made fresh and fast buffalo cheesesteak wrap is so yummy pizza hot and fresh everything was good!,2014-11-22 05:27:25,"{'food': ['buffalo cheesesteak wrap'], 'drink': []}"
NAoTaFp4NgtL36ZBiZcuCQ,a3xEck62-v5g5OrYdWyCpw,cXSyVvOr9YRN9diDkaWs0Q,5,1,1,1,"Came here for brunch and there was no wait and the service was great! =) So far so good! 

I ordered the enfrijoladas (wet breakfast burrito). It was deeeeelish!!! A lot of flavors: saltiness from the feta cheese and beans, balanced with the greens, slight spiciness from the salsa and the red onions. The scrambled eggs were not over-cooked (yay!) and the tortilla was lightly toasted. I made a mistake of ordering it with turkey sausages inside. The turkey sausages were the breakfast-kind and had a sweetness to them. They really threw off the other flavors for me.

I also tried their potato latke. Oh goodness, nice and crispy and oh so yummy!!! I also tried some of their green bean casserole. The onion strings were fresh and crisp and the dish had that homemake yumminess to it.  

If I ever visit Philly again I would definitely go here again! =D",2010-12-07 00:28:05,"{'food': ['enfrijoladas', 'potato latke', 'green bean casserole'], 'drink': []}"
oVA8V92JUHxPBQL28He8Nw,ofHKd8FRpu8jPwK2oR5ygg,eaDZlSuVS0EY67Ke6pRP6Q,3,0,0,0,"Went for take out on a Sunday afternoon. The staff is very friendly and the interior is nice. 

I ordered the first noodle on the menu. The dish is labeled spicy but mine wasnt, but I think this may be due to my not letting them know I wanted and could handle a hot dish. The dish is nice, flat stir fried noodles with bean sprouts, egg, but not particularly memorable. I ate around the shrimp and squid, it was too fishy for my taste. The portion is great end the price is a very reasonable 8.50.

I also ordered the roti canai. 4.50, very cheap. I had a similar dish at Rangoon Burmese and I liked their version better but it was still good.",2015-09-06 16:33:00,"{'food': ['noodle', 'roti canai'], 'drink': []}"
