review_id,user_id,business_id,stars,useful,funny,cool,text,date,ner_results
bUTQmZ41rtjTPvThkZzxdw,goySBsZ3QJfSaElPIDIzLw,U30ggGzFpXvc2NZYwOW3qg,4,2,1,2,"I love orange.  I love orange buildings where they offer orange things to eat and drink, then use the orange fruit pulp to mulch the orange marigolds in the orange-rimmed tree lawns out front.  If Mood Café's ""mood"" is reflected by their color scheme, then that works for me. 

Also the Mood offers vegan lassi in 20+ flavours.  However, the Mood uses almond milk, which tends to overpower the fruit--Maybe switch to rice milk so that we can taste the fruit?

Now all that Baltimore Ave needs are dosas and a proper kati roll and we'll be good to go...",2011-06-03 04:22:08,
STh1SnFDOTqlWy7BdYny6g,LPONBStm1-DyzXulXccsMg,Oun4NN-u5yiHIxDqtJnxgA,5,0,0,0,"Just went for the first time this past Friday. Not sure if the long lines are a thing of the past but we were in and out with no wait (this was around 8 a.m.). We went back for chicken at 11 a.m. with no problem either. I would have gladly waited if I needed to, as the donuts were spectacular. I never had doughnuts made to order until now. It's life changing. The Indian Cinnamon was particularly unique -- sweet, savory, and spicy. And get the pumpkin spice latte doughnut if they have any left. Words can't do it justice.",2013-10-29 03:05:33,"{'food': ['chicken', 'donuts'], 'drink': ['pumpkin spice latte']}"
vLngss7rIN83dCkFBGHlBw,xCJisO0jOB94krpxoqiuzw,IH_ZeeTh13jQURbh31d1Kw,5,1,0,1,"I love everything about Bui's. Food, quality, and service! Yes, service. 

I tend to binge on Bui's depending on what part of the school year I'm in. If I'm busy and lazy, it's Bui's for brunch everyday. Nowhere else on campus (and dare I say...Philly?) will you be able to fill yourself up on such good food with so little money. A foot long sausage egg and cheese sub for $3.50 is absurd in the best way possible. When ordering, don't forget the Bui's sauce! I suspect it's just a mix of mayo and Sriracha, but it's delicious nonetheless.

While Mr. or Mrs. Bui's isn't going to serve you a sub on a silver platter, being able to text your order gives Bui's an A+ for service. Text your order 10-15 minutes in advance and they'll definitely have it for you!",2013-07-18 11:09:55,"{'food': ['sausage egg and cheese sub'], 'drink': []}"
XMQpIt8dNFzosl7JLae6mw,bPwSdACtD1AjQ70fk5Zy-Q,Q-prSTdggNlxAEFV88BZOw,5,0,0,0,"Much better than the one by Rittenhouse! More space, excellent service. Great for drinks with friends or even first dates. Amazing wine selection, small salad plates and cheese options. The panini's are to die for! Ideal for light meals and good conversation.",2013-10-09 00:30:09,"{'food': ['panini', 'salad plates', 'cheese'], 'drink': ['wine']}"
9QpRRfeSJNPNmnvy1RZ2Ww,vs1ozNme3r-GEx-PXQ8MLQ,GUMVStVaJfWmCIpQA4TtHg,4,0,0,0,"I went to Crazy Sushi for dinner last night for the second time.  This is a great place to go to if you are looking for some good and creative sushi in Philadelphia.  The restaurant is BYOB which is a plus.  

My boyfriend and I ordered the gyoza to start and four special rolls - Crunch Kani Roll, Ichiban Roll, M16 Roll and France Roll.  The France Roll is my favorite roll at Crazy Sushi.  All the rolls were presented together very nicely on one large plate with a few decorations.  I highly recommend making reservations for dinner on the weekends as it is usually packed.",2014-11-22 19:39:58,"{'food': ['gyoza', 'Crunch Kani Roll', 'Ichiban Roll', 'M16 Roll', 'France Roll'], 'drink': []}"
DgSVy3_hSjgaedJLEz31IQ,M2czY-QSBZLit_oyCxCQNg,7e4Z9_qGA0Vjb8xlFC61PA,4,0,0,0,the Wok n Walk was worth the price.  Poon is funny and informative.  Visited places in Chinatown I would not have stopped in at.,2012-10-13 22:58:12,"{'food': ['Wok n Walk'], 'drink': []}"
pXN43LgEg-Lfl5V1lAvkOg,SGPCLi-kVZ_pz1w7VJtkeA,4_W5pstoN1166TGjjPOrMg,4,10,5,9,"I feel like I stumbled on a neighborhood secret walking into Sunday brunch here. The vibe at Pro Tap is laid back cool. A tad hipsta but what great brunch place isn't nowadays?

We needed 3 things: carb items for my daughter, eggs and sausage for my son, area proximity due to party proceeding...ok maybe four...bloody marys...always a requirement.

We were greeted with smiles and the wait was nothing (5 mins) compared to other brunch places. Albeit this is a bar but the brunch game is strong my friends.

I definitely recommend getting the Bloody Mary. It's spicy and garnished with homemade pickled veggies. Your choice of vodka.

We ordered a chocolate, caramel donut for the table to try because it was $2 and it was ridiculous. Hot out of the fryer made it crunchy on the outside with a cakey inside and whatever goodness they garnished with was off the plate and devoured within seconds.

Kiddos ordered the chocolate chip pancakes  as well as eggs and sausage. The portions are enormous. The toasted sourdough that comes with egg dishes is superb and you can order as a side. The pile of seasoned fries are a crispy nice addition instead of home fries.

The stunner is the chicken french toast with sunny eggs, kale and cabbage slaw, and peppered maple syrup. The combination of the crunchy kale and cabbage slaw and the saltiness of the fried chicken coupled with the gooey sunnies and peppery sweet maple syrup was insane. I will go back for that lovely dish.

Overall I was really impressed and would recommend!!",2017-03-20 16:48:12,"{'food': ['chocolate chip pancakes', 'chicken french toast', 'sourdough', 'fries'], 'drink': ['Bloody Mary']}"
heN1TA1GUA0m517LVAK8eQ,rqK34d05H30C4KeeC5p7ZQ,9iBlpXwgBFLVnx6RmHsiCQ,3,1,0,1,"Foods on First is a good place to go if you're looking for a cost effective and tasty breakfast with friendly service. I have to say every employee I've encountered there has been so pleasant, friendly, and good at their job. 

Now I think their strong suit is their breakfast. They serve breakfast lunch and dinner all day long but in my opinion the lunch and dinner options are mostly mediocre. 

Off the breakfast menu I would recommend  the French toast for sure! Foods on First french toast is so moist and buttery! It's one of my favorite things on the menu. The pancakes and omelettes are both filling and delicious. If it's on the breakfast menu it's going to be good.",2018-04-09 12:15:44,"{'food': ['French toast', 'Pancakes', 'Omelettes'], 'drink': []}"
4TvLAMdonTMw4g5FB6bAMg,tCXElwhzekJEH6QJe3xs7Q,Z5po0aTuzKKblek5y6Sp8Q,4,2,1,1,"Back in Philly!  Didn't get a chance to try this burger joint the last time I was here.

Food (8.5/10) = Ordered the ""500 burger"" with the truffle fries.  The meat is damn good.  So good, it stands on its own without any sauce.  Of course if you want to contaminate your burger with sauces, go ahead.  They gave me a white sauce and a pink one.  I can't remember what they were exactly.  The pink one was rather salty though.  The sauces were delicious though,...better than the average ketchup and mustard.  All the other components of the burger were great/fresh (the bread, lettuce, mushrooms, bacon, cheese).  The truffle fries were delicious.  Won't say too much about the fries because it is just fries with truffle oil.  It's not hard to make.  They do prepare all their fries with duck fat though.  Very nice.

Ambiance (7.5/10) = nice clean burger joint.

Service (7.5/10) = not much too it.  Place your order, get your food and eat it.

Overall Opinion = These are quality burgers.  Definitely a lot better than the average burger joint.  Bobby Flay should eat at this place and take notes (see my review for Bobby's whatever burger palace).  Although 500 degrees is really good, I still think the burgers at village whiskey are the best.  I would visit 500 degrees again.",2011-10-02 02:26:47,"{'food': ['500 burger', 'truffle fries'], 'drink': []}"
khGvGrUB2O6q8eVEMybQag,McxOeuSswXZeyoFwy_1-yQ,gCcJTKC40CL0XtYYGfcXDw,5,0,0,0,"That was the most delicious greek food I have ever had.  I ordered the beef gyro platter and it was a great price, tons of food AND the worker and owner there are the nicest people.  Such a welcoming atmosphere and a DELICIOUS meal to follow.  Wish I could live here.  Still have baklava to eat, and I cannot wait until I have room in my stomach to eat it.",2014-06-18 00:04:55,"{'food': ['beef gyro platter'], 'drink': []}"
eC7Wwg-1hMAGoTAERb6oGQ,RR9xhIiKZFkmTkEmMNaoJg,EtKSTHV5Qx_Q7Aur9o4kQQ,5,0,0,0,"The BEST BURGER IN PHILLY. Bar none. Far and away. Don't you dare go to Shake Shack if there is a big wait! You're out for a the best burger, this is it!!

I was in school and poor when I was here so I cannot speak to the drink menu BUT the food is amazing!!

You have to get: 
1. Duck Fat Fries w/ Short Rib and Cheddar - why is this so good? I don't know, who cares? Just enjoy the fried deliciousness of the duck fat. I believe th cheese sauce is made with sly fox and who doesn't want fall apart delicious brisket on your fries??

2.  Go with the Village Burger and load it up with additions. Truffle mushrooms, bacon, avocado, and caramelized onions will do you right.",2015-08-01 11:53:33,"{'food': ['Duck Fat Fries w/ Short Rib and Cheddar', 'Go with the Village Burger and load it up with additions.'], 'drink': []}"
zDmLvL7TI8hHw7W6DIiGlQ,1OSARXZ-t1RDY2JgbLY_oQ,bTve2mwLk5Zc01vRKqc2KQ,4,3,0,1,"I really like Red Hook. Whenever I'm in the area to get fabric, I always stop by. The inside is really cute, and has a bay window that would be perfect for reading in, if someone wasn't always sitting there first. The coffee is really good, and they always ask whether you'd like medium or dark roast. I've never had any of their baked stuff, but it looks really good. They could definitely benefit from more seating - there are only a few chairs and a couch. Prices are good, and staff is always friendly.",2008-01-19 22:49:21,"{'food': ['coffee'], 'drink': ['coffee']}"
YaITuxQZrX1zrJKWJ54SHA,8vkrT9ltmJm4cDP_zdLGTg,u-8sFq05DQ6PYCR5HiKZ2w,1,2,0,0,"It's a place that microwave ovens your food for you. Food is meh at best and way overpriced for what it is.

Two words: steer clear.",2013-12-11 07:22:15,"{'food': ['microwave ovens'], 'drink': []}"
EZuuUPF2IhBV-pYsHQb_pw,23W9oI8hA71VcB09NJJb5g,eMiN8nm70jjKg8izikVWDA,3,0,0,0,"The food was pretty good. We had philly nachos, chicken parm sandwich, lobster philly cheesesteak and crab cakes. Everyone was happy with there food. Just make sure you talk to the right hostess as the man at the front thought I couldn't read. He kept telling me me my name wasn't on the list even after I received a text message stating my table was ready. He insisted to the hostess that I must have gotten the initial text message. The funny part was he wouldn't even look at me or speak directly to me although I was right there trying to speak to him. Wonder what that was all about? Our waitress was super friendly and quick.",2013-10-29 01:55:43,"{'food': ['philly nachos', 'chicken parm sandwich', 'lobster philly cheesesteak', 'crab cakes'], 'drink': []}"
L1MrG3VPnyOKeheOJyr1OA,JoYaFsNp7atnYOwABYPYMQ,REns5fQe45Nk_D2UwQyr0w,1,0,0,0,"We went to Barra Friday night after being there a few years ago and enjoying it. Something has gone terribly wrong since then! To start, we were sat in a booth with big holes on the leather seat. When asked to move, we were told that it know turns into Hookah lounge around 10pm with a DJ and that was probably the result of that . This was not what we found 2 years ago. Our waitress brought over a bread basket while we waited for our food. We were starved so we munched on the bread until our food came. It had to be the worse bread we were EVER served. It was hard and stale. We asked for another basket. The second came out warm and stale.
I am a pizza lover, so was excited to try the brick oven pizza that I remember raving about in the past. The oven that I remember burning brightly, was dim and shut down. We were told that they are working on getting a piece for it and they are now making the pizza's upstairs..so we went ahead and ordered 2 pizza and a few other dishes. As the dishes came out 1 by 1, the night proceeded to decline quickly. We got the beets salad and the mussels which were both ok. The cheese and meats board was the farthest from cured meats!! The braised short rib ravioli sounded so good that we couldn't wait to try. When we dug in, we were disappointed to find jarred sauce that clearly spelled preservatives!! Finally on to the anticipated pizza. We each picked up a slice but again to our dismay, it was a lifeless, jarred sauce, uncooked disaster. We called over our waitress that could have not been nicer and apologetic. We asked to speak to the manager. This was probably the worse part of the night if you can imagine. Very kindly we discussed all of our problem from the bread to the ravioli, to the oven, to the pizza. We told him that we were here before and not sure if management changed but maybe consider sticking to the dance party that was supposed to happen instead of advertising it as a restaurant. He picked up the bread and said ""yep it's hard"". He did not reply when asked what kind of sauce that was being used on the ravioli. And we picked up the lifeless pizza. We told him we were not paying for the following items. He just said ""ok"". Never an apology or anything! That is the basic fundamental of customer service. Needless to say, we will never return and will be surprised if the ""restaurant portion of this establishment will be around next year for someone else's bad review....",2015-02-08 13:48:00,"{'food': ['beets salad', 'mussels'], 'drink': []}"
Q8hIbRzdlh7oJmXoPE1kjg,L-YwqsxAdOn4X0Rs_xg4pw,VbItL6RDULtnw4YvB6EhVg,3,1,0,1,"It will do.  

I think you just need to know what this place is.  It is a bar mainly with a fantastic location and view of the South Street action for people watching.  If you want to eat while you are here then you must prepare yourself for painfully SLOW service and mediocre food.  

But we didn't stop in here thinking we were going to be stopped for dress code, have valet parking, and get the surf and turf.  Hello!  We came here because we wanted outdoor seating, to kick back and relax over some drinks and have a leisurely dinner.  Done.  

You better have time on your hands to come here though because I swear that each time we asked our waitress for anything and I do mean anything it would take her about 10 minutes to comply.  10 minutes may be a little on the quick time for her.  

Would I go back?  Probably.  The drinks had alcohol in them, I was feeling nice when we left.  My blackened chicken was a letdown; but that is because I expect all my sinus' to be cleared when I order blackened (guess she thought I was kidding).  My husband's cheesesteak on the other hand was excellent.  

So, yeah, when we find ourselves in the area I would go back if I have time to spare to watch some motorcycle gangs mouth off.  Plus, I want to see some people get towed next time, go PPA :0)",2011-05-30 01:32:13,"{'food': ['blackened chicken', 'cheesesteak'], 'drink': ['alcoholic drinks']}"
cDRXapBcpDQW2ZlvSisgag,8g4YN1WWSq0o1-N1rOptxQ,sdWuLh-auc0nC2Jy6_26AQ,3,0,0,0,"Great location, traditional Irish ambiance ,it brought me back to Dublin for a quick second . The menu is quite simple, your basics pub food, nothing out of the ordinary, a much emphasis on the drinks selection.",2018-02-13 05:13:21,"{'food': [], 'drink': ['beer', 'wine', 'cocktail']}"
tvzmLuHwjtAjagmteyUgVg,RwseYM2pXCTLwPw0g5nzNQ,mbglgx3nbRRPKxh0SxDjNQ,5,3,0,0,"My housemate and I cannot get enough of Parada Maimon!!! This hidden gem has the double benefit of being both cheap and full of good eats. Our go-to dish has always been mofongo (either chicken or pork). Their beef pastelito (beef patty) is solid - nice and flakey, and full of rich flavor. When we last went yesterday, we also decide to try their tostones... omg, why have we not ordered a plate of that before!?!? Plus, did I mention this is a BYOB establishment?!

In essence, if you're craving a homecooked meal of Afro-Caribbean food, Parada Maimon is THE place to go to in all of Philadelphia! Jose (the owner) is a wonderful host and he'll make sure to hook you up with whatever you want. If you want a sample of some things before ordering, he is more than happy to allow you to sample some of their prepared items.",2015-07-30 02:44:42,"{'food': ['mofongo (either chicken or pork)', 'beef pastelito (beef patty)', 'tostones'], 'drink': []}"
HMnZX4YuxBcmHAvkNdt9BQ,JMyoG81cWzgG9rgmHiOu7w,9gObo5ltOMo6UgsaXaHPWA,4,1,0,0,"Went here for a birthday dinner. Food was great, amazing atmosphere. The staff was able to honor our request for a window seat/city view despite the short notice. Only downfall of the evening was the somewhat slow service and small portion of our dessert (we got the pumpkin french toast to share- it was sooo DELICIOUS, but was gone before we had the chance to enjoy it).",2014-11-16 19:46:06,"{'food': ['great', 'amazing atmosphere', 'pumpkin french toast'], 'drink': []}"
wNIB4j1GxwzwFqwi3KmeXw,DqkSHfAfJCwXaOQYiSiwHA,htO_nlxkEsYHzDrtbiUxew,4,0,0,0,"I am personally #TeamMenu but I'll let it slide because I love this place and am  quite adaptable.

I love the coffee, draft lattes, and iced black.  Staff is always super friendly and quick. Even during the morning commute, they get everyone in and out with ease.",2015-09-02 18:27:16,"{'food': ['coffee', 'draft lattes', 'iced black'], 'drink': []}"
W2qhLJsUPYhZ7lnUiret9w,bCmOH5WRgd8MMLsz_jlfQA,B6qHZCAs7Nka-1zdjCzAIQ,5,0,0,0,"We ordered the rib and fish platter we had Mac and cheese, the yams, greens, and cabbage was great.",2016-10-15 18:28:51,"{'food': ['rib', 'fish platter', 'Mac and cheese', 'yams', 'greens', 'cabbage'], 'drink': []}"
URkt-FP50tT5Svhk5QC8ZQ,1x2nLYqAWFHIzXSYQc5oIw,pj8Y-5vfbRitnnm2xJFH9w,4,1,0,1,"I've had food from here in the past and it was good, so I decided to give it another try. I ordered the jumbo shrimp meal to split with my boyfriend and the Jamaican soup for myself because I had a little cold & was looking for something to open me up. First thing I notice upon getting home and opening the food was the shrimp weren't jumbo they were medium sized shrimp. Other than that everything tasted good, the soup wasn't watery which was great. Will be back.",2016-04-26 06:15:57,"{'food': ['jumbo shrimp meal', 'Jamaican soup'], 'drink': []}"
xID5PK0wF1lPtipQZhuSmw,mxZfJDk8_cOO19c7xiMffQ,K8b2MQ5Az59-nzvqUfjJEQ,5,0,0,0,"This was definitely one of the best meals I've had in Philly. Everything we ate was fresh and delicious, service was flawless and the experience was all around pleasant. We had the bloody beet steak, makarel with ramps, and fried sweetbreads to start. The sweetbreads were the clear star of the show but everything else was amazing as well. My husband had the lamb entree and I had the scallops, we devoured both. 

You would think after a meal like that we wouldn't have room for dessert, but alas, we did. The waitress told us they had this amazing salted caramel pretzel ice cream type thing that ended up being out of this world!  And it's BYO? Are you kidding me?! I can't wait to get back to Farm and Fisherman. The decor is simple but elegant and if you get a window seat you are pretty lucky!",2013-08-20 01:38:08,"{'food': ['bloody beet steak', 'makarel with ramps', 'fried sweetbreads', 'lamb entree', 'scallops'], 'drink': []}"
xdMv0Kh8btps5ZKqf0V-zw,rqILxJxcMlIc-RmLvlVDpw,VRnJgj0IvxoksHppE78X2Q,4,1,1,1,"What a hidden little gem.  Lee how fook is a tiny place on north 11th street.  
Something that most spots in Chinatown aren't- this place is clean!! 
Food is always super fresh and not greasy for chinese food.  Pad Thai that is usually a special on the menu is some of the best Pad Thai I have ever had.  Go to staple of General Tso's is best out there  Huge chuncks of white meat and the chicken is not breaded and covered in goopy sauce.  Take out is good, no delivery, but for Chinese food this good it is worth the drive to go pick up. Had to wait a bit longer for take out a couple of weeks ago and the waiter was super accomodating.  Asked where my car was parked and he brought the food out to me when it was done.  couldn't ask for better service... except when they huff and puff when you ask for a fork.  :)",2013-02-26 15:53:29,"{'food': ['Pad Thai', ""Staple of General Tso's""], 'drink': []}"
yw-rZqrDlswBlQrvoL0qFw,DcgKu8u3WTt7EZVeezf4Sw,Xkn6vebYLTY1aCe2J07MfA,5,0,0,0,"I've gotten takeout from here a few times now. They are pretty quick, and the food has been excellent every time. The Diablo quesadilla is fantastic! The interior of the space isn't very inviting, but it's a great takeout spot!",2018-07-11 02:16:07,"{'food': ['Diablo quesadilla'], 'drink': []}"
0max8tvi5g_v0d4aq97QNg,nDiPqLg1XvTxml40bv8wLw,wCluBbW9nzS7MEMFltMwJw,4,3,0,1,"I had fried Shrimp, Fish fried rice, side of Mac & cheese & lemon cake.... Everything was slamming Call ahead the service is slow.....",2014-05-18 02:51:11,"{'food': ['fried Shrimp', 'Fish fried rice', 'side of Mac & cheese'], 'drink': ['lemon cake']}"
R-3CtVoEowTcAMhROvUXfg,PR7XS6OA-6ylu8sLGObUsQ,u7_3L1NBWgxhBM_B-cmmnA,4,0,0,0,"Food: 4
Decor: 3
Ambiance: 3
Service: 2.5
Value: 2.5

The pizza is good, and the fried pizza dough is even better. However, I still find it hard to stomach spending $60+ for 2 at a pizzeria with communal seating.",2016-07-28 18:37:49,
aD7kgQYCp3YybOyc0OM79A,pMlSJNqvUGDC0hqxTfoV6w,_RwlMTw9uFeOkfX9Ctf1HA,1,2,0,0,Not at all the old dinardos ! The food was so basic ! The flounder taste like it was from a bag ! I don't think I will be returning ! Portions were very small ! Don't think I would go again. Don't waster your money or make sure you have a groupon to help with the bill ! Very disappointed!,2016-02-28 06:16:33,"{'food': ['flounder'], 'drink': []}"
GKpOh7i_NwxoJ-QnnJZLHQ,u6z36etqi4RJItDXZHD9ag,cXSyVvOr9YRN9diDkaWs0Q,4,0,1,1,"Hidden in the side streets of Philly is a gem called honeys. Kitt and I both had a chicken quesadilla. Really nice for breakfast- juicy roasted chicken, a crunchy buttered tortilla and a creamy avacado crema bring this magnificent dish together. Served with fresh shredded greens and a perfectly cooked beans. Unfortunately, our waiter had a long night on Saturday and couldn't remember to bring our blueberry pancake. After reminding him about it he brought a plain pancake. Come on brah, I know it's 7 am but it's one lousy pancake! Aside from the pancake mishap honeys is a winner and I would be a regular if I lived in Philly.",2014-11-16 15:58:25,"{'food': ['chicken quesadilla', 'blueberry pancake'], 'drink': []}"
nKyNJR-RDU9VRh0BPtlkMg,o2Qse7dyKmFDqwtPUmLcaQ,Gw7UW0E2BguzL9suQnwDeg,5,0,0,0,"Best cheese fries I've had in such a long time. Fresh cut, double fried, and topped with cheese sauce (not the melted slice cheese nonsense). Almost didn't share the fries with my kid, but she kept eyeing me so...yeah.

Ordered the cheesesteak and that was pretty good. Enough flavor where it doesn't overpower the beefy taste. Loved the caramelized onions. Couldn't finish it though, had to take the other half to go.

Super friendly people that work there. It's not very big inside so seats are limited. FYI, no AC. You have a fan, four walls, and a ceiling shielding you from the sun. Food is worth the open kitchen heat though.

No bougie, no bull, just good food and good people.",2018-09-06 04:44:52,"{'food': ['cheese fries', 'cheesesteak'], 'drink': []}"
qVALcQYH-AKTdp7tq3ygxg,_0LwemzCLchggFtEWHERDA,VbItL6RDULtnw4YvB6EhVg,3,0,0,0,Great location in Philly especially if you want to see south street or penn's landing.  The food is by no means mind-blowing and borders on good but it's a good place for families or large groups. Comparable to TGIFs.  With so many options on south street it's hard to make a serious recommendation but you can always go without having to wait or que like some of the better options.,2011-07-07 02:16:22,"{'food': ['South Street'], 'drink': []}"
NFSpTEuLura0nKIznYFGng,6Pihp3I2C0WG-JzhWrKhLw,2er_V-oAd7IbQ5YTY56r7A,3,1,0,0,"Food was good but definitely a chain. Black bean burger suffered the curse of most and was pretty dry. The wild ride sweet potato burger was falling apart (what can you ask if something vegan and gluten free?) but was really tasty.

Onion rings and sweet potato fries. Get them. They were seriously good. Same with the milkshakes, though I'd recommend against the chocolate if you don't like chocolate chips.

Condiments on the burgers were good. All of the onions they offer have great unique flavours. However, the ketchup at the table was maybe not my favourite thing in the world for fries. Same with the mustard. 

Overall, tasty, but like I said, a chain and there are definitely better places for a burger in Philly.",2014-09-18 02:50:44,"{'food': ['black bean burger', 'wild potato burger'], 'drink': ['milkshakes']}"
7Wupr0qWymU2PjXoHvC4Gw,nqKQFSaodrV5aEL29Ws9Ew,oBhJuukGRqPVvYBfTkhuZA,2,0,0,0,"I thought I'd love this place, but I was wrong!  My partner and I had brunch today with his youngest sister.  We had a great time catching up and spending time together, but I didn't care for the food/service at all.  The service at best was slow.  Maybe I'm being too picky, but I ordered an iced coffee .... I like Kimpton's.  I think their nice.  Nicer than a DD's, right?  They put the milk in it!  Um, do you know how I like my iced coffee?  No.  Just bring me some milk with my IC!  Whatever, I got over it....  I had the Huevos Rancheros and it was BLAND, BLAND, BLAND!!!  Just not a good experience.  I may try it one more time, but def not for brunch.",2012-08-27 00:58:42,"{'food': ['Huevos Rancheros'], 'drink': ['iced coffee']}"
