review_id,user_id,business_id,stars,useful,funny,cool,text,date,ner_results
1tuUIz-MdqsscUF8TUE0VQ,6O0MxTs3Pzzj5cXSHgYmrw,GYAX9mPGYx9VfwDiuIl_9Q,4,1,0,1,"If you want a hoagie that is not laden with enough cholesteral to choke an ox, a Vietnamese hoagie from Cafe Huong Lan is worth a shot.  Good for veg-heads and carnivores alike, there are many different options, some of which Americans may find a little intimidating.  My usual was the vegetarian hoagie because it was so damn yummy.  With seasoned tofu, fresh cilantro, some sort of buttery mayo and jalapeno peppers on a very fresh French baguette, it is so deliciously light and perfect.  If you really want to reduce the fat, get it without the buttery stuff.  It's still good.  I'm also a big fan of their tapioca-like plantain pudding dealie.  I know that's not the proper terminology but that's pretty much what it is.  It's delicious.",2007-02-20 21:37:54,"{'food': ['vegetarian hoagie', 'tapioca-like plantain pudding dealie'], 'drink': []}"
UQLKYT1BUhFeC6W3su3DwA,f7wfm8EC2_byxPLTdU89_g,IH_ZeeTh13jQURbh31d1Kw,4,5,0,0,"Bacon, egg, and cheese. Enough said.

Been at Penn for three years and I come here a couple of times each week for a quick breakfast/lunch/I'm hungry moment.

Bui's has some pretty solid specialty sandwiches (e.g. Ms. Bui), but none of them beat the simple perfection that is their bacon, egg, and cheese. If there is one specialty sandwich I would recommend though, it's the Turkey BLT...the amount of turkey bacon they put in there seems extremely generous.

Quick tip: If you have no idea what the dude is asking you after you place your order, he's most likely asking if you want ""salt, pepper, ketchup"" on your sandwich. :)",2013-07-03 07:21:12,
wxZMPCZ9BOZp1gDvn91ooQ,kaa6i7IHMyYIom7DIul9EQ,Oun4NN-u5yiHIxDqtJnxgA,4,2,2,2,"Finally, I got a chance to make it Federal Street Donuts!  I have been hearing about this place for some time now though various media coverage.   I did not arrive there until 2pm in the afternoon, which led to anticipation and anxiety.  Both of these emotions were from hoping they were open, not sold out of donuts or Fried Chicken, and hoping that the line would not be too long.   They were sold out of their Fancy donuts, but they had plenty of their Hot Fresh donuts, which come in three flavors: Appollonia, Indian Cinnamon, and Vanilla-Lavender.  I was super geeked that they still had chicken.   

I ordered each flavor of the Hot Fresh donuts and I ordered a half of chicken, which consist of a breast split in half, one drumstick, and one thigh.  You have the option of putting a dry rub or a wet rub on your chicken.  Torn between the dry rub and the wet rub, I went with my first inclination and ordered the harrissa dry rub. 

On the surface, chicken and donuts seem like an odd combination, but they pair together well, just like chicken and waffles.   The fried chicken is Korean-style, which made it super crunchy, and the donuts were warm and delicious.  I can see why this place is so popular.  They serve up donuts and chicken that is different from the norm.",2012-06-12 17:48:17,"{'food': ['Hot Fresh donuts', 'Chicken'], 'drink': []}"
AyjlQ2sm77KZty0a84fApw,HjyeYbnxg20fzRK7jyqPHg,d_tRshM-w6S4QxE4VVi8tQ,4,1,0,2,"While in the City for the Chinese Lantern Festival, I needed to find somewhere that would take a walk in group of 5 people for dinner. Jones was happy to accommodate! 

We were seated at a window booth right away, while the booth was comfortable, it was a bit tight for 5 people. Menus were left on the table, so we were able to start looking at their options right away. Jones offers appetizers, dinner salads, sandwiches, soups and a few dinner ""entrees."" 

Our waitress was a bit slow to introduce herself, and slow throughout the night. She didn't didn't check in often, and only refilled the drinks once. She was pleasant enough, but wasn't great. 

I ended up ordering the Grilled Chicken Sandwich which comes with skinny fries. The sandwich and fries were delicious, the fries were perfectly crispy and I loved the basil aioli on the sandwich. 

For dessert my table ended up splitting the Lemon Strawberry Cheesecake and the Deep Dish Chocolate Chip Cookie. Both were delicious.

Overall I enjoyed the food and the atmosphere, I also found the prices reasonable for the city. Jones seems like a great place for a quick dinner.",2018-05-23 13:40:11,"{'food': ['Grilled Chicken Sandwich', 'Lemon Strawberry Cheesecake', 'Deep Dish Chocolate Chip Cookie'], 'drink': []}"
yg5ORvyzea1b8v9UQwJOhg,0KIZVhkv8Fxy-G1OGJZYDg,-CRjqZ4GxZ6lIa_qMj7-yw,1,0,0,0,I only order from here when i forget how bad they are. the wontons are way to doughy and salty. everyonce in awhile i try and give them another chance...then i remember why i get things delivered instead of walking half a  block to pick it up,2009-03-26 06:28:48,"{'food': ['wontons'], 'drink': []}"
oPW9NmpupntQ0baIs_aCxQ,D63tbQkggXGHQB-4t6B3lA,ppFCk9aQkM338Rgwpl2F5A,3,0,0,0,"On one hand I was baffled at how long it took to get our soup given that it wasn't very crowded here.  On the other hand I love the salted caramel coffee drink and that they have packets of honey to take.  Despite taking longish to get it, the soup was piping hot and hit the spot - I really like Wawa's soups!  The staff was friendly.  Not a bad location in a pleasant, walkable area.",2015-05-04 20:32:22,"{'food': ['soup'], 'drink': ['salted caramel coffee drink', 'honey']}"
fl5PotJ1zEePIXPoTFdkVg,WJVedIAJN0FRxDn6M1tLkA,htO_nlxkEsYHzDrtbiUxew,5,1,0,0,"LOVE. 

Hopefully, you're lucky enough to snag a table.  If you are, cozy up with a friend or a good book.  And don't give up your table unless you are ready to leave!  

The coffee is amazing and the baristas are not only super nice, but very quick.  This place is what I picture when I think of a true coffee house.  It's quirky, super busy and inviting.  

I will walk 20 minutes from my apartment for La Colombe.  Even in the summer because their iced coffee is the best, hands down!",2013-04-18 00:57:11,"{'food': ['coffee'], 'drink': ['coffee', 'iced coffee']}"
DzEyKIxao5RKgtY2lA5CyA,G-lnav2PVgVneD9S75qmpQ,7mpYTDb24SywNMRn3yeakQ,3,1,1,1,"Just to preface - this is a Restaurant Week review. 

Pros: waitress was super knowledgeable about drinks. Hostesses were very friendly and accommodating. The food that we did receive was delicious (regardless if it was not what was advertised.) Ambiance is a lot of fun. Tried to make up for mishap. 


Cons: Our meal took 2 hours. Our waitress seemed overextended and stressed out. They ran out of 2 of the options from the Restaurant Week menu. The crawfish Mac and cheese that they are known for literally had a fingernails worth of crawfish compared to the pictures you see on here. Charged for sparkling water without letting us know. 

I would come back here potentially one more time to see if it were just a Restaurant Week issue but to be honest it's not ok to wimp out BECAUSE it's Restaurant Week which seems to be the trend. There are so many places that are doing food and service so top notch that it's hard to recommend but the ambiance here is fun and different. We'll try again.",2015-01-28 19:24:58,"{'food': ['crawfish mac and cheese'], 'drink': ['sparkling water']}"
KyWrYTHvyRJp1QjDZILLCA,qscTV7CcIl_rcOgwni_Gow,7lwe7n-Yc-V9E_HfLAeylg,4,1,1,0,An upscale menu with friendly staff. Sitting outside when the weather is nice is a great option.,2017-06-01 12:22:32,"{'food': ['sitting outside when the weather is nice'], 'drink': []}"
3fmWqs_tijhmiH5NqWD-QQ,0DB3Irpf_ETVXu_Ou9vPow,eFvzHawVJofxSnD7TgbZtg,5,2,0,1,"They take credit card with no limit. Cool spot to hang out. Different vibes than the other one at Fitler Square. Much larger, tons of seating, and a few outlets around the room. Tends to run a little more loud than other shops, but good spot to get work done. Small selection of sandwiches and good fair trade coffee.",2018-03-18 22:08:06,"{'food': ['sandwiches'], 'drink': ['fair trade coffee']}"
Go-f8cocq9ayonmZlYZZ7A,0KIZVhkv8Fxy-G1OGJZYDg,bSWL0YxfawjS03_g2kgujA,1,0,0,0,"i love panninis so when i'm craving and forget about everytime they have messed up my order, i campusfood.com it and they always seem to mess up my order, and whenever i call and ask about it they have no idea what i'm talking about. atleast campus food will normally give me a refund",2009-03-26 05:47:37,"{'food': ['panninis'], 'drink': []}"
kAkppfZX-AGYoep0aUhVUQ,O4CBAPwJQ_43KbqArpFxpQ,Dv6RfXLYe1atjgz3Xf4GGw,4,2,0,3,"As a visitor to Philadelphia, I was excited to try some vegan restaurants here. We were going to be driving down to West Virginia (and there was nothing appetizing at the Reading Market), so I decided to pick up something from a vegan restaurant for the road. After looking at several menus, I settled on Hip City Veg. I called in an
order for a fajita wrap and green lemonade. I was greeted warmly when I walked in
and found my order waiting for me. I decided to add a pumpkin cupcake (total was about $16). The fajita wrap was good but a little heavy on the sauce. I enjoyed the green lemonade and cupcake. I would
consider returning the next time I'm in Philadelphia but might try something else.",2013-10-12 23:38:18,"{'food': ['fajita wrap'], 'drink': ['green lemonade']}"
ShNT-7DmNcfHWLEXF-hJUA,TY0SxAUCjyNaN4stP2UJ-w,U30ggGzFpXvc2NZYwOW3qg,5,0,0,0,"Rarely write a review but gotta do this one. the food with the price is completely perfect. 

Lassi taste super natural, feeling like you're eating real fruit. chaat is perfect for a small dinner. taste delicious

the seat at the corner was quite and beautiful for hanging out, reading, chatting.

owner was super friendly and gave me rice budding as a treat as he knows I'm leaving town.

Definitely remcommend this place and definitely come back to Philly just for this.",2016-09-07 02:43:10,"{'food': ['Lassi', 'chaat'], 'drink': ['rice budding']}"
9DB5tiG9WSBKOm1eonNzTA,dbOh1k-qlVl3zDz4yjuriw,EtKSTHV5Qx_Q7Aur9o4kQQ,4,0,0,0,"Came here with a big party of people, after some moving and juggling we got a table outside, glad they were able to accommodate a large group, since the place is not too big.

The service was a bit questionable, not sure if our big party threw the waiters' chi off but he was a bit all over the place, ill give that a pass since we had 10 people.

The food:
-The pickled beets with toasted bread and goat butter was amazing. Tons of flavor, veggies were pickled just the right amount and the toast and butter were perfect additions to the beets

-The burgers were a bit on the pricy side even for gourmet burgers. To add almost essentially any topping cost 1 to 2 dollars more, putting your burger well above the 15 dollar mark with no side, but as long as it's good what's another buck or two.

-I got the village burger with an egg and split mine with my gf who got a king burger which came with fois gras. Both burgers had tender meat and had overall good flavor, really enjoyed both. However, the one thing i would not get second time is the fois gras burger because it really did not nothing to the burger from a taste perspective.

-The duck fat fries were awesome, should not be missed

-They have a pretty good cocktail menu, some a but sweet but overall good",2015-02-24 21:36:52,"{'food': ['pickled beets with toasted bread and goat butter', 'burgers', 'village burger with an egg', 'duck fat fries'], 'drink': ['cocktails']}"
PajtlzMonVg_xUC_Sv4nFA,Eq4oOZ9bdlnzuPBM0EDoCw,0zWAsCBzvuCI_Ydx7yH1Jw,5,5,0,2,"This was one if my best experience in Chinese cuisine, it only took me one time to get hooked on this place, food is out of the world, I have been there more then six times and have tried many of the dishes they serve (lobster with ginger) is my favorite , soft shelled crabs to die for, and it helps that the size of the dish is very filing and the staff are always attentive and around when you need them, they have a lot of respect for the customer and make u feel right at home, it's one of the best in the city.",2014-01-08 16:10:24,"{'food': ['lobster with ginger', 'soft shelled crabs to die for'], 'drink': []}"
9D4JrLcMzB2nfvSzo0L_4w,x4URaA7rHFdMJ9nI1CphNw,3ZynJ94VpIdDlaArmEp2Rg,1,0,0,0,"Bad service, mediocre food, my food wasn't right when I first got it, and it took shockingly long to fix (replacing grilled chicken with fried chicken on a salad)... I was looking forward to dinner originally and quite frankly was disappointed.",2018-09-07 04:07:42,"{'food': ['grilled chicken', 'fried chicken'], 'drink': []}"
S503Ey9Zwlx4dCxGE1S6UQ,Id4d-dpj_MckGVpQS_q3Xg,B-DiQpcSTJ7oMMnwzbAGTQ,5,0,0,0,"Wooo second review for Cucina!! 
Back at again why? Because they're the best food truck that I have tried, obviously. Who needs more food trucks when you have Cucina?

I'm just going to reiterate what I said before about Cucina Zapata. They are incredibly friendly, won't get mad at you when you take a little too long to decide what sauce you want (hehe, guilty), and their food is prepared with love.

I will willingly wait for half an hour before they open just to have their food early in the late morning/early afternoon.  bon appetit/bon bon feet/bon whatever-floats-your-boat!",2017-02-13 20:25:19,"{'food': ['Cucina Zapata', 'Cucina Zapata'], 'drink': []}"
tRld7kyeU4qXJsh8BRQvYw,7sXypmwqAxVZ2upYrywIAw,mbglgx3nbRRPKxh0SxDjNQ,5,0,0,2,"Stopped into this restaurant as we were passing through Philly based upon the great reviews and ordered the lunch special to go.  It was: Beef stew, yellow rice, black beans, some plantains and a salad.  The lady behind the counter with the curly hair was super sweet and more than generous dishing out our rice.  We are talking heaping spoonfuls!!  She also gave us some extra broth to go and packed everything so well that it wouldn't spill all over the car!  Bonus!  Needless to say, this lunch special was enough to feed two people.  And --- it will only cost you 7 or 8 bucks!!  

The owner overheard us debating which juice to try and gave us a sample of the passion fruit juice and of course we ended up ordering one.   A little on the sweet side, as juices tend to be,  but really refreshing on a warm day!

This place was a great value if you are looking for some authentic and fresh Dominican food in Philly!  It is obvious that the owner puts his heart and soul into this operation.  Support local!!",2017-04-11 20:12:59,"{'food': ['Beef stew', 'Yellow rice', 'Black beans', 'Plantains', 'Salad'], 'drink': ['Passion fruit juice']}"
IO_K8uUxQRihszcD4Cf3Ow,7CDpwBhMhhh9CyCxTDx3Sg,7mpYTDb24SywNMRn3yeakQ,5,1,0,0,"Great place to throw a party! Live music upstairs. There's a separate room with a shuffle board, darts, and a fire place. Two bars with great bourbon and beer lists. The food was delicious as well. I highly recommend the mac and cheese, pulled pork tacos, beef cheeks, and the pork duo.",2013-07-24 20:38:43,"{'food': ['mac and cheese', 'pulled pork tacos', 'beef cheeks', 'pork duo'], 'drink': ['bourbon', 'beer']}"
GWJ_RRMNnvNPvTBQ0uwTsg,UnC8NYY-RRfh70cJVMSHzQ,vCHNWdW-ys-nWUx3Cpvk8Q,4,0,0,0,"I have tried numerous bakeries in and around Philadelphia.  This one ranks up with the top ones.  Great strawberry wheel, coconut lime tart, maple walnut diamond. and so on...

If you find your way on 19th street between Market & Chestnut - stop by as there will probably be a treat for you.",2013-10-25 15:45:28,"{'food': ['strawberry wheel', 'coconut lime tart', 'maple walnut diamond'], 'drink': []}"
UR9jI-e-cL8ftygjEhGDmg,JwpGFZIf5782bwOPgyrZzw,ppFCk9aQkM338Rgwpl2F5A,4,0,0,0,"This Wawa is located in a busy area but the staff seems to handle the pressure well. I dislike the selection of coffee, too much regular. I'm a fan of dark roast but it's usually not available. My advice brew different flavors of coffee and keep it hot.",2015-02-24 15:05:49,"{'food': ['pizza', 'hamburger', 'fries'], 'drink': ['coffee']}"
IEiUmigCaVyRJn7TFDoRKQ,ua6QuBe6mar6pDrhHETzJQ,Q-prSTdggNlxAEFV88BZOw,4,1,0,1,"the beer i mentioned that was great last time (but forgot the name of) was russian river's pliny the elder

went back on a sunday, when they have half-price specials and got the half-priced belgian beer on the menu: also lovely

very crowded and very loud on a sunday - hard to hear your own conversations",2008-10-06 21:28:06,"{'food': ['beer'], 'drink': ['beer']}"
YeKopGJw5TJc6h4EoWItTg,16yfdXvoj6ra0hqFjLu2cQ,uKAbrDSJJzZliY1Yqu5KxQ,2,2,0,0,"I have only been here once because I thought everything was below average. Me and my boyfriend ate here on a Friday at the bar. I really don't like the paper place mats they put down in front of you, but that an aesthetic thing. I ordered the fettuccine in a marinara with a meatball because I was feeling pretty traditional that night and my boyfriend got red mussels over pasta. I was so disappointed. The gravy had so much oil in it, I actually couldn't finish it and the meatball was very hard. My boyfriend had the exact same experience with his gravy as well. 

I have heard from people whose tastes I trust that my experience is outside of the norm, but unfortunately I can only base my review on my dining experience and I have to say I was just generally underwhelmed.",2014-01-26 22:22:00,"{'food': ['fettuccine in a marinara with a meatball'], 'drink': []}"
XD2ksogtTKxsUIlmuxY8XQ,Xa8kFFBBtn_UIINQ6-SumQ,WIv5kTb_P3jnngPkMeRRNw,2,0,0,0,"I ordered through seemless web and it took over an hour. Confirmation email said 30-45 min. I would have been ok with it taking a little longer, if it was actually good. Shumai was cold and the dipping sauce was very thick with a spicy flavor. Green salad was iceberg lettuce with a few cucumber shreds and a fair to poor ginger dressing.  Shrimp tempura roll tasted like it was made 2 days ago. I don't think I will be ordering from here again any time soon.",2011-12-12 02:04:12,"{'food': ['Shumai', 'Green salad'], 'drink': []}"
Td9zsSADb4x4JyIgIZAciQ,KeuhteHe76DxDlXnkWoDwA,eFvzHawVJofxSnD7TgbZtg,2,0,0,0,Friendly enough service. Cold AC. Overly syruped and unremarkable coffee beverage. Flavorless sandwich extremely sparse on the ingredients. No interest in returning.  Meh.,2016-06-15 22:59:56,"{'food': ['sandwich'], 'drink': ['coffee beverage']}"
kK5G8Un_cGkm1Q6aXzdgUA,ALWSjow1qxW4SFFZ0ZNB6Q,YtSqYv1Q_pOltsVPSx54SA,5,1,0,2,"As far as steakhouses go, this was the bees knees.  Lobster Bisque had superb texture and flavor.  Even the salad was good, not overdressed or soggy, fresh and crisp as it should be.  I got a filet which was perfectly cooked and a side of mashed which was shared because it was pretty large.  Dessert was nothing special, I ordered creme brulee which was good and what I expected.  I was in a party of 10, some of which did not speak english very well, everthing was taken care of. by the staff.   I was a bit underdressed, no jacket, but still felt classy and never at any point did I feel uncomfortable.  The staff there made it a great experience, when I sell my firstborn I will go back.",2009-09-04 22:17:25,"{'food': ['Lobster Bisque', 'filet', 'mashed'], 'drink': []}"
gdilWW5QnuU0aSQYajpuRA,iwSNxogOSB1Q0-N_LkhbQg,4S_yN5o0EvXvV6GNvesTKw,4,0,0,0,First time trying this place and I was not disappointed. I ordered the fish platter with mac&cheese and cabbage. The cabbage was a little bland and it seemed as if they threw the entire head of cabbage in the pot without cutting it. Overall great food and great customer service.,2018-07-12 22:40:49,"{'food': ['fish platter', 'mac&cheese', 'cabbage'], 'drink': []}"
XKu7G2VSHl1LvLvV8UHfAA,84lcVCz48xx5Jpfi4rB2Zg,Oun4NN-u5yiHIxDqtJnxgA,5,1,0,0,"Coming from a non coffee drinker, their coffee is straight up remarkable. Get it black to taste the flavor. 

Apparently they add coco nibs and a gazillion other awesome things to the coffee for robustness and wow factor :)",2015-08-03 06:08:25,
bt6db5uVWEcNqsxnyLrxWA,5ImJKL15PZQWaYPtdsOOqg,Dv6RfXLYe1atjgz3Xf4GGw,5,0,0,0,this was the best vegan food i had in a while. the philly cheese stake was the bomb. the manager destinay was so friendly and so was other staff.  the cookies were my favorite,2018-09-16 17:11:45,"{'food': ['vegan food', 'philly cheese stake', 'cookies'], 'drink': []}"
EFjgsi2UURWYcpI8-eggbg,ME_4TOc3brcquaSECrqkbQ,mCo2uVTTGYrEhRrkQW-CMw,1,0,0,0,"The worst beef noodle soup I have ever had. The beef was rough, dry, and cardboard like. The picked veggies was away too sweet. Soup was too salty and full of MSG. It is not Taiwan styles beef noodle soup! Very Misleading and disappointed. Taiwanese meatball supposed to be soft, it was crispy, and hard to chew in the middle. Definitely under cooked.
Oyster omelet was taste awful. The pork buns were terrible!!! 
It is NOT Taiwanese food as it claimed. Don't waste your money!

In addition, the waitress was using her thumb and index fingers holding the water cup lid. Her thumb was soak in our water. That's disgusted! Stay away from this restaurant! It just Chinese takeout qualify. Not worthy to eat.",2016-07-17 00:08:48,
-Nrt6z39lHHvyLt-mdz4ig,k0Oj7z88jaKF1l1Y92fPaA,Q-prSTdggNlxAEFV88BZOw,4,1,0,0,"Excellent appetizers.  Fennel sausage with lentils was delicious as was the truffled egg on toast with fontina.  Service was quick, friendly and knowledgable.  Great spot for lunch (not too crowded) and nice views out onto the street.

Thumbs up for:  service, food, taste, price, atmosphere.  Would return.",2015-09-04 02:23:31,
gGakRbw2zLzZFmTYmNyRkA,iI4JyhpXHbNUW8cXSI1bIQ,3BJxm-HnvzdwD1zjmSbmyQ,4,1,0,0,This place has some lackluster reviews but I do have to say the food was really cheap and prettty damn good. Probably will be my new goto Chinese Food place in the area.,2010-05-27 15:35:06,"{'food': ['cheap', 'good'], 'drink': []}"
mteAZP3JNa0oew2L9urgOA,IzdTfnyokc0f80RSXaz9BA,DsKzHnkLKnxZTVsFpts4oA,4,0,0,0,"We first had lunch here and it was very good. 2 mornings later we came back for breakfast,  again very good. And the freshly squeezed orange juice.... OMG it was soo soo good. I wanted to tell them, just leave the pitcher on the table.  We are going back in the morning for some OJ, and yes we will also get some breakfast while there.",2017-02-13 05:56:52,"{'food': ['lunch', 'breakfast'], 'drink': ['orange juice']}"
6kdZ95Ar-qplnbchccEkSQ,sMdLDRyFeRHVK9qiNm6dnA,qHCfhWPyb1GXpzq9Wk3Vkg,1,2,1,0,The wait was very long and the waitress threw the credit card at me and practically threw the pizza too. Pizza was just OK.,2012-02-15 14:12:06,"{'food': ['Pizza'], 'drink': []}"
9XK_0A_nn78uGNepok_Q6Q,MZ2iV8gKaRY1s1wm8oyvaQ,1UNorskttXSWuEcgzKzXcA,2,0,0,0,"Went here 01/18/2014 Waitress was playing a role of someone who know nothing. Took 20 min. to get a drink. Out of a few items on the menu, reservations were for 8 o'clock. Guess they under estimated on that meal. Ordered a fight of high end tequila she tried to get it from the bar but took way too long. Her response was maybe next time you can sample the flight (NEXT TIME DON""T THINK SO) people at the bar were regulars which seemed to have no problem getting served. Guess I will spend my money somewhere else.",2014-01-22 21:16:12,"{'food': ['fight of high end tequila'], 'drink': ['tried to get it from the bar', ""next time don't think so""]}"
6zaadSXR9bVVZI7TqqsF-w,Aznus7BHe6MF0pzPkmmxyA,eqNutOMnPqKa9QDAY6KfEw,5,0,0,0,"As French people we can say that this is the best place for French patisserie, bread, and other kind of vienoiseries!!!
Perfect employees very friendly and respectful !!
Thanks a lot",2018-06-12 19:19:49,"{'food': ['French patisserie', 'bread'], 'drink': ['vienoiseries']}"
e2ssLTVDMRb73eklATDdVQ,oOv4KnpXlwbzHJcqssZpmw,fKDV_dlDhXd7P5kZi97Kng,1,0,0,0,"I ordered buffalo chicken fingers, and asked several times during the order for blue cheese to come with it.  I mean, come on, what's buffalo chicken without blue cheese, right?  Well, they arrived without the blue cheese.  This kind of thing happens sometimes, I think the important thing is how the restaurant handles it when they forget to send something.  When I called the woman reluctantly asked if I wanted her to send the blue cheese, with a tone that suggested the unreasonableness of that request.  I asked if she would send it, and at this point it's been over an hour and a half since I called, and no completion of my order.

Judging by the other comments on here, it seems that The Spot routinely messes up orders, has poor customer service, and is not diligent in correcting their mistakes by giving customers what they ask and pay for.",2012-10-20 02:10:09,"{'food': ['buffalo chicken fingers'], 'drink': []}"
