review_id,user_id,business_id,stars,useful,funny,cool,text,date,ner_results
KoXoYPQQ0WQrwVm4UylHgQ,_8lf3XJRyeekB1jfBnuTNQ,MMRRS6YhVRx_iN5-JhMRYg,4,0,0,0,"YUM. TASTY. SPICY. *Disclaimer I am a weenie when it comes to capsaicin. Also worth noting that a former English teacher in China says this is the most authentic Chinese food he has come across stateside.

The appetizers are really, really delicious, namely the dan-dan noodles (even though I thought they were spicy as all hell, I couldn't stop shoveling them into my face hole).

The entrees did not impress me as much as the apps we ordered, but on the upside--depending on who you ask--they are less spicy by far. The meat is sort of squishy, which is something I expect from cheap Chinese places, but not an upscale one. The string beans with minced pork were awesome though.

They were playing the Eagles game behind the bar (Thursday night football), which pleased the boys in our group. Beer menu was good (maybe 6-8 on tap plus a large selection of bottles).

We spent more than we intended to. That said, we took home several meals' worth of leftovers and each had 2+ beers.",2013-09-21 01:47:03,"{'food': ['dan-dan noodles', 'string beans with minced pork'], 'drink': ['beer']}"
1rxMJxTExY4hMQNAeX8eKQ,NNRVUjU3lO2Rh14V2iCqBg,7mpYTDb24SywNMRn3yeakQ,5,0,2,0,"Stopped in after a dance session with friends. Daniel's gorgeous blue eyes had us in a trance. He was such an awesome host. We even checked out his website (he's an artist). We couldn't get enough of him. I can't even remember our waitress' name since we kept calling for him. Anyhoo I guess I should write something about the food.  The steak & eggs were delicious!  My friends had the fried chicken with sweet potato waffles, stuffed french toast, & crabcakes. They also enjoyed their meals. Will definitely be back, & not just to get lost in Daniel's eyes. LOL",2014-06-01 16:58:45,"{'food': ['Steak & eggs', 'Fried chicken with sweet potato waffles', 'Stuffed french toast', 'Crabcakes'], 'drink': []}"
S9FBIdDVYqIHrVvrTw7sXA,rSlEoKWAvd3PtUcAxzP2GA,wUnLSg_GKfEIQ5CQQ770_g,5,0,0,0,"Expensive but worth it for a special occasion. The complimentary glass of asti was a wonderful touch. Didnt eat all day in preparation for this and was not dissappointed. The homemade pastas were the star of the show, would go every week if I could afford it :)",2015-03-24 22:02:59,"{'food': ['homemade pastas'], 'drink': ['asti']}"
qGZOPFK3YJiMpn2xol01Ig,ZMzaOGUlCXY6kWXEnHZbvQ,U30ggGzFpXvc2NZYwOW3qg,5,0,0,0,"This place already has way too many reviews saying how wonderful it is, but here's one more. I've been here twice -- the first time Hassan made all the yummy chaats for my group and let us sample various lassis. He was very personable and asked us for feedback on our chaats as well. The second time I came here, someone else made my chaat. It wasn't as good as when Hassan made it but still great nonetheless. Make sure you get a lassi! They have the best mango lassis I've ever had in my life, made with fresh mango. It's pretty small and quiet, which is great for enjoying yummy food with a few friends.",2014-11-03 22:11:27,"{'food': ['chaats', 'lassis'], 'drink': ['lassis']}"
l14gsutVnwLvPpEYwtwL1w,jcpXtu1mhCZdinqs29x0fQ,7lwe7n-Yc-V9E_HfLAeylg,5,1,0,0,"Churchill burger best burger in city! 
However everything I ate was incredible! It's been several months since I was there and I'm still thinking about the great food.
ORZO mac and cheese was so good and i was very impressed with the beer list. I cannot wait to return!",2011-06-13 17:47:15,"{'food': ['Churchill burger', 'ORZO mac and cheese'], 'drink': ['beer']}"
tjj0ZgHwldVro5lnPK6BJA,J63IrZx0f_ZwrG1ha2Aypw,x03j48hmv0R7NQcUjD0MQg,5,1,0,1,"I went in to try the new shop, and I was blown away by the food. The pita was soft and had the right texture, and the garlic sauce and chicken were seasoned perfectly. You definitely need to try this new business. The employees were very patient and kind to me.",2017-09-22 02:05:30,"{'food': ['pita', 'garlic sauce', 'chicken'], 'drink': []}"
fX81eW3iPNPpDszqBGgEWw,7RvN1nKBR2FcaW2ImlKfJg,SIoCIxjn4jLt2O-4DajWJw,4,0,0,0,"Fantastic draft and bottle lists.  Get Mac's fries - braised short ribs, gravy, and provolone is perfection.  Leave the chili alone - spicy in a 'I spiced this to be spicy, not flavorful' way.  Chicken tenders were very good, but only 3 pieces to an order.  Good ambiance, it's definitely a sports bar but still old-city-classy.",2013-01-03 02:17:31,"{'food': ['Fantastic draft and bottle lists', 'Fries', 'Braised short ribs', 'Gravy', 'Provolone'], 'drink': ['Chicken tenders']}"
-Zye4VHR_FTCdkaH3vSegw,xhHRsOoE8pHCuJGBwus_Hw,NeY1bH6IKJxnn4YAixibsQ,1,0,0,0,"It's a Cosi. There are lots of them in the area so you may think to yourself ""I know what I'm getting into"" you're wrong!! This place is terrible!! Worse Cosi I've ever been to. They manage to somehow always have the worse tasting food AND their employees are the unfriendliest bunch of people I've ever encountered! And just in case you needed more reasons to stay away it's always dirty with the most confusing food ordering system imaginable. It's not even a system, just chaos.",2015-10-27 19:59:27,"{'food': ['Cosi'], 'drink': []}"
7OcU_AF_zfn958_wirdINg,nX5d6CZfIeerRsQ6jM0AQA,cXSyVvOr9YRN9diDkaWs0Q,3,0,0,0,"People were always talking about Honey's so we finally met a friend there for breakfast/brunch in the summer. And I was impressed mostly. The menu offers plenty of options for vegetarians and meat-eaters alike and the food is top-quality and yummy. I think it's a bit pricey but I guess you pay for the locally grown high-quality ingredients. I had pancakes and they were very tasty. My friends ordered the Huevos Rancheros and they raved and raved about them. 

If it's a nice day out, it is great to sit outside if you can snag a table. The service is pretty good, but if you get there after 9 or 10 you'll probably have a little while to wait, especially if the weather is nice. I would recommend Honey's if you want a good hearty breakfast and are in the area, but my favorite breakfast spot in the city is Morning Glory, hands down!",2010-01-25 17:36:47,"{'food': ['pancakes'], 'drink': []}"
TYnlb3YEpMe1JxwsbIG48w,R8q1YC2cwbRAKw8MLZ2zdA,7mpYTDb24SywNMRn3yeakQ,5,0,0,0,Driving from Maryland to Philadelphia for a birthday dinner at The Twisted Tail. I have to say the food was phenomenal. Please when you come ask for the server Shawn he is absolutely wonderful.,2018-04-08 04:25:52,"{'food': ['pizza', 'wings', 'chicken wings'], 'drink': ['beer', 'wine']}"
QQp34_H4wwVAiAIRp_oByQ,h8dJ-6jCcobe2HMcES6TCQ,1I58IN0Ar5Qd3WnE1smgVg,2,1,0,0,I would love to give this place at least 4 stars because the seafood is great! However the staff and their customer service sucks big time. It's a hit or miss who's in a bad mood today and if you will get an attitude or not. And the phone - you can forget it after 6pm!!!! I love getting them to steam and season my crabs.,2017-09-12 15:56:27,"{'food': ['seafood'], 'drink': []}"
7yeLNGrZ6PULIJ4o0CJqNQ,prpyhhJBEsCnvFGQl6H8aw,Q-prSTdggNlxAEFV88BZOw,5,0,0,0,I frequently visit the Tria on 18th St and love it but I was looking to try one of their other locations. I'm a big fan of their Claudio Panini but this time I ordered their Prosciutto Cotto Panini and it was just okay. It was a little bit spicy and I definitely felt like I was missing out on something. Other than that the atmosphere at Tria is wonderful and I will always go back!,2013-02-01 01:36:39,"{'food': ['Claudio Panini', 'Prosciutto Cotto Panini'], 'drink': []}"
cawW2bWmzeCL6dB0KRlDhw,CwxU45Cw0-_jc7GJPmDScw,9gObo5ltOMo6UgsaXaHPWA,5,2,0,1,"My husband and I have heard terrific things about R2L for years. Growing up near Philly, we have admired the building from afar. As we rode the private elevator to the 137th floor, our expectations were high - and the staff didn't let us down! 

The Valentines Dinner was a set menu. The servers asked that we order our appetizer, entree, and dessert at the same time. With so many guests for the holiday, it was a wise decision for the evening. It was difficult to choose because everything sounded so delicious. Where else can you get shrimp cocktail AND lobster for your appetizer? I could have ate just that and been satisfied. The courses came out in a timely fashion, everything was the right temperature and cooked exactly how we asked. My husband had the veal and I had the steak. We caught each other chewing with our eyes closed and a big smile after every delicious bite to fully enjoy every moment. 

During our meal, we received a complimentary appetizer and dessert. This was way more than expected and I was especially excited because I had trouble choosing between two desserts. The free dessert was actually my second choice, which I happily devoured as well. The Assistant General Manager, Brittney, approached our table and asked about our experience. With full bellies and smiles from ear to ear, we could not stop talking about how amazing the food and service was. But there was one problem - we wanted to get a photo of us with the beautiful Philadelphia skyline below, but we did not want to interrupt other customers dinners. When we mentioned this to Brittney, she personally took us to a private room so that we could get our picture taken. Just like how everything else in the restaurant was above and beyond, Brittney took the time to take several photos with and without flash, horizontal and vertical, just to make sure we were happy. I must say, we are more than happy! We were treated like we were the only guests in the restaurant and we are already talking about coming back for happy hour ASAP! 

FYI if you are considering reservations for  next year - The reservation process for Valentines Dinner was different than I have experienced. When we called in December, we were put on a list of callbacks for when they opened the books   for 2/14 in January. When we were called back, we were asked to make a $50 deposit to reserve a table (which went to our total bill at the end). That is totally understandable considering the type of place and popularity of the night! 

Also there is a full-size mirror in the restrooms so that you can snap a selfie in your fancy attire. If I could give this restaurant 10 stars, I would. You'll feel like a celebrity as soon as you walk off the elevator.",2017-02-20 22:41:38,"{'food': ['shrimp cocktail', 'lobster'], 'drink': []}"
r277IdGdYAFOOEcL8GlggQ,FkaBNfCc2dRyQ2qXhsXXtg,Q-prSTdggNlxAEFV88BZOw,5,0,0,1,"i looooooove this place.  Great food and drink, not bad prices, and most importantly: the kindest, most attentive, but not annoying staff ever.  I can't wait to go back.",2010-10-14 13:18:07,"{'food': ['Great food'], 'drink': ['not bad prices']}"
jUIIUHIV4NA2QNN6VqEW4g,Houkdf1HYH3R5R2KNCwQcA,1DkolDhbc0kydORZCIp7Fw,1,1,0,0,"I really wanted to like this (Northern Liberties version!) Too many people and not enough trucks. Service so slow! Left a food event hungry - WTF?

Oh and they were charging $15 to park in the usually free lot!",2012-05-31 00:31:48,"{'food': ['I really wanted to like this (Northern Liberties version!)', 'Too many people and not enough trucks.'], 'drink': ['Service so slow!', 'Left a food event hungry - WTF!']}"
mHYHt6o4y7NstHvfFj1s3A,KjlYa3Wlr60j-PSUZ-KfOg,3lBooCffgkW7tVSG5kILBA,3,1,0,1,"Very mediocre, even more so after having to wait 20 minutes after our reservation time to be seated on a weeknight. No where to stand either, so we had to wait outside. 

Bruchetta was probably the highlight of the meal. The proscuitto was average quality at best. The ""salad"" with it was a ball of mixed greens with dressing? Really? 

The pasta with a porcini sauce, was really an incredibly rich white sauce with porcini mushrooms (which in total, probably was a single cap, very skimpy). 

The crab was very fishy (needed salt & lemon for sure, some pepper wouldn't have hurt) and overcooked. The portions of this dish were 1/5 pasta, 1/5 crab and 3/5 tomato sauce.... 

Honestly, I had heard this place was a nice cozy authentic Italian BYOB. 

Also, the host mid-way through our meal turned on the radio behind my GF and it was literally the radio and not on a station. It kept going back & forth between music and static. 

Pay a bit more and go to Melograno. Raddichio's food is 10x better for the same price. La Viola is better than Porcini and cheaper as well...",2011-12-02 20:35:02,"{'food': ['Bruchetta', 'Pasta with a porcini sauce', 'Crab'], 'drink': []}"
Ue9hCgfh7p9xGseDsLhrYw,zduCtI6XAMvrcdr7wR_5kw,3lBooCffgkW7tVSG5kILBA,4,0,0,0,"We showed up without a reservation, and the maitre d' had no problem seating us.  He was cheerful and attentive.  Seems like most of the patrons are regulars!  Food was delicious, and plus we got free desserts for checking-in on Yelp!  The pastry dessert was divine.  I would skip the tiramisu.

Entree wise, I had the squid ink pasta ~ tasty, but not the best I ever had.  My hubby had the ravioli, and that was delicious.

If you want a no fuss good dinner, then give this place a try!",2013-10-27 22:14:06,"{'food': ['squid ink pasta', 'ravioli'], 'drink': []}"
zBnHHuclJL-Ic6bViTVbrQ,OsEe3-Tz32cJHDME2ygRKg,dSPA4yql9vUwnYRxHiVtHA,5,0,0,0,Went here with a group of 11 for my birthday and couldn't have been happier. The service was excellent and they were very accommodating with our larger party. We ended doing the larger sushi boat and got some extras to go with it. Sushi was great and especially loved the seaweed salad. Awesome that it's BYOB. They even gave me a free t-shirt!,2013-10-06 18:56:08,"{'food': ['sushi', 'seaweed salad'], 'drink': ['beer']}"
bHArMgS2ORBrIgarjIi8vg,4_IJKLhoyof73pvRal4Exw,jULIPydhMj18KOI5OHTwfA,5,0,0,0,"The third time I've been here, I finally tried the fish. I had one fried (you have the option fried or tequila lime glaze) Mahi Mahi. It was great. The Chipotle Remoulade didn't overpower the flavor if the fish. They're bigger than the carne, carnitas, and pollo tacos, too. 

The only problem is that the Mahi Mahi was piping hot, but my carne and carnitas were cold. I figure this is because it might take longer to make the fried fish tacos, but if that's the case, they shouldn't make them all at the same time. They should start the fish, wait, and then cook the meats. 

I also noticed there was less meat and more toppings on the carne and carnitas than the other times I've been here. This could be because those times it was dead, and this time it was sort of crowded (10 or so customers already eating, then another 5-10 came in after I ordered).

But still, this isn't enough for me to deduct a star (they're a true 4.5 but I rounded up). Buena Onda is the best.",2016-08-09 23:49:33,"{'food': ['Mahi Mahi', 'Carne', 'Carnitas'], 'drink': []}"
k94GWmRk25YG6GBh3LJmLA,CJXkxjoV4VbJ3fagz2ZnqQ,7yPzOek7Af2dKWGYKpcHWA,5,2,0,2,"This is my favorite Cambodian restaurant! Grant it, I've never been to any other Cambodian spot, but I can tell the food here is 5 star quality. 

The entire kitchen and FOH staff are family! I remember talking to the waiter/cashier/everything guy (lol) telling me who made each dish we ordered. One from his grandmother, another from his brother and the last from his mom. I thought that was so cool! 

The food is always fresh and tasty and flavors are balanced. Be careful with ordering spicy unless you can REALLY handle it. I'm a spicy eater, trust I eat the Korean Spicy Noodles just because. Unlike that, these peppers take over your mouth like no other. So just a warning!

To wrap it up, this place is definitely a hidden gem! BYOB! Small and family owned feel. Casual. 

Favorite dishes:
Cha Kr' ung (chicken)
Prah-Hak Kateeh",2016-07-28 17:11:06,"{'food': [""Cha Kr' ung (chicken)"", 'Prah-Hak Kateeh'], 'drink': []}"
OBSExxc3OUDa0mrtk1T2XQ,08YOy57WjXTOSMt5iMppVg,gq4zw-ru_rkZ2UBIanaZFQ,1,0,0,0,This is one of the worst McDonalds on ever been to it's so dirty the food is horrible customer service is the pits it is one of the worst worst McDonald's ever been into very unsanitary don't eat here,2017-02-24 01:02:10,"{'food': ['food'], 'drink': []}"
uy02K8KjWnIU8L4P8tVRPg,NDNOyZXfjMBJTjGPC0kODw,7yPzOek7Af2dKWGYKpcHWA,5,1,0,0,"This place is truly one of the best restaurants in Philadelphia.

The food comes straight from the cooking talents of a Cambodian grandmother and is, fresh, unique, and ultimately incredibly delicious. There are so many dishes that are absolutely fantastic that it is hard to narrow down and recommend one over the other. I really enjoy the papaya salad each time I go, but it's the primary entrees that steal the show.

It is not the biggest place in the world, but the service is OUTSTANDING, and the family atmosphere with which the ownership runs the business is really great. We went with a group of 7 recently and had to wait for a half hour or so, but it was a weekend and the fact that it is BYO made our wait very easy to get through. 

This place is worth going to regardless of where you live in or outside of the city. I love Khmer Kitchen and will miss it when we leave Philly.",2015-12-07 19:35:35,"{'food': ['papaya salad', 'primary entrees'], 'drink': []}"
lzweuH_YNpP10v10AHCUcg,u8EgqDkF24x26DCQA6KYQA,_RwlMTw9uFeOkfX9Ctf1HA,2,7,1,2,"Remember Alice's Diner?  It feels that way when you go to Dinardo's...  1970s wood paneling, gaudy fish and fishing ecoutrements on the walls, and crotchety old lady waitresses.  I went with a group of 10, and every dish was basted in butter, covered with garlic, and soaked in crab meat.  You'd think that would be good, but it's coated with a pound of Old Bay seasoning.  To make matters worse, it's horribly expensive for food that doesn't taste that great.  I took a chance on this place, and I'll never make that mistake again!  Red Lobster serves better fish than DiNardo's.  Avoid it like the plague!!",2008-08-26 16:11:08,"{'food': ['fish', 'crab meat'], 'drink': []}"
Ef3PSnhmJ42Nge2MEc_7Mg,EWWTRZ2BgzzIY1Bbt-AGFQ,y_JZFlF-4fwSIn4RJ2vMGw,3,2,0,1,"Been coming here for 20+ years. Used to be the best in the world, but...it's not the same anymore. Had my first chance to get over here this season a few weeks back. Ordered cherry and lemon. Both tasted sub-par. Texture wasn't what it used to be, there used to be chunks of lemon rind and fresh cherry...no more.

Honestly, my wife and I went to John's right after just to be sure our taste buds weren't tainted.

I hope they get this turned around, otherwise a sad end to a timeless memory.",2016-08-05 01:39:29,"{'food': ['cherry', 'lemon'], 'drink': ['cherry and lemon']}"
RLkbqCW-KvIG3Dm8eERdZw,f9XqfJCRxCoAXy1N08qr8Q,3lBooCffgkW7tVSG5kILBA,3,0,0,0,"small place. looks charming from the outside. bit of a mess once you're inside. Porcini is a labor of love (or family ties) so it's not unusual to hear shouts and crashes coming from the kitchen.

the owners are characters. They usually hang around a table or two and crack jokes and bump into the waiter while he's trying to pour drinks. when we went they chose another table, so we could enjoy the crazy ambiance of the place without much work. I could see them really annoying certain people though. 

food is good, and presented well but don't come expecting modo mio or anything. Please don't.

it's good for what it is. 

if this is your kind of family restaurant, you'll want to come ""home"" to this place from time to time. If it's not your thing, you'll probably just try it the once. 

We had a reservation and they were ready for us.

BYOB.",2013-05-31 16:13:33,"{'food': ['Porcini'], 'drink': []}"
94hicSN8Ubb1n0rGcnuOlA,qrEQKNuWgblUtUeaXxviHg,K8b2MQ5Az59-nzvqUfjJEQ,5,0,0,0,Elegant BYOB + delicious food = winning combination!  Really loved the bloody beet steak and the pork belly.  The dishes are very creative and the presentation is beautiful.  I really can't compare the quality or originality to anything i've ever had before.  The service was attentive and friendly.  I loved everything about it.  I can't wait until the next time i'm in Philly so I can eat here again.,2011-08-01 21:15:22,"{'food': ['bloody beet steak', 'pork belly'], 'drink': []}"
1k9AxD50SpVSw_2trg3NDQ,CB5ogb0l1oCBxh5TdhQevA,eaDZlSuVS0EY67Ke6pRP6Q,4,0,0,1,Extensive menu and great Malay food. There is definietely a shortage of Malaysian restaurants.,2013-07-18 22:59:00,"{'food': ['Malay food'], 'drink': []}"
7qlyGIx1i_GIEbsXBk3PxQ,cQi5KWvQ3cbWqWTTwa7fxQ,WRMlifrYLjRY8q5YUUbfZA,3,0,0,0,"I dont wanna be mean but theres a lot of hipsters if you know what I mean by that..... doctorate degree in arts those types of people.... and that's a fact! Always If you go to south philly around Washington square, you'll find alot kite asians with way more better pho at a good price. When you first walk in you are greeted by a waiter and you are given water and menu. I ordered the goi cuon as my app. It was like your normal tasting goi cuon. For my pho, I ordered pho dac biet. The wait time was about 20 minutes because there was only one guy working in the back so I felt empathy for the guy and I didn't want to bother the waiter. When the pho came out, it looked good. The key thing for a pho is the broth. You can have waygu beef but if the broth is not good then be ready to file for bankruptcy lol. This place broth didn't have that sweet broth to it. Kinda tasted watery. The meat was actually very good but again, the broth has to be good. The prices for these bowls is not what you'll find at a normal pho place. Price for large is $11 and the bowl is not big. With more hipsters moving into fairmount ruining pho, expect overpriced, tasteless broth, good meat, and tiny bowls. Service here is actually better than other pho restaurants which is pretty rare in philly for pho. Overall rating: 3/5. Could've went to 2 but service and the meat saved it.",2018-10-03 01:53:59,"{'food': ['goi cuon', 'pho dac biet'], 'drink': []}"
HoSdaxZrwr2SIjxYhso99Q,z0Je7Af24xgv-WZOOaOCzg,Q-prSTdggNlxAEFV88BZOw,4,0,0,0,"I would not argue with 490 4-star ratings for Tria - it's good. I take exception to the $$ rating for cost tho - Tria is $$$! 

A light and tasty late dinner for 2 - wine, sparkling water, the cheese special ($4), and 2 salads, came to $71 before tip. In my book that is STEEEEP. 

We went because it was late and we are staying nearby.  And no complaints; the special wine (a French rosé) and cheese (Castelrosso, an aged Italian chèvre) were yummy.  The salads of smoked salmon and cold beef were good. All portions were quite modest, but we were mostly satisfied (except for a 3 oz glass of wine for $13; that is just chintzy.)  The service was pleasant and prompt.  And the atmosphere and the crowd is sophisticated and hip.  

Just know that you will pay for your pleasure. And YELP SHOULD ADD A $ SIGN: $$$",2018-05-21 03:28:09,"{'food': ['wine', 'sparkling water', 'cheese', 'salads'], 'drink': ['wine']}"
o8RmpZ_AeTxYj6Tamh9Svw,ig5IJbIuq-gopoPIEUlm1w,c8rjE6NcfeyzLB_aU1GdMA,4,2,1,2,"stopped in here to grab a drink with an old friend.  Live music, friendly bartenders.  Cheap drinks, and pretty clean for an irish pub.

open later than world cafe live, and felt pretty safe.

two asian men, two black men, a white boy from ATL, and an asian jew in five inch heels walk into a bar playing Rob Thomas music...

there's not punch line.  That sums up my evening ;)",2010-05-21 18:52:04,
8ufTX7PqjWWCPMcmkGLQjw,Zr4VzcOr8pRlxaRDIroEhw,kq5Ghhh14r-eCxlVmlyd8w,5,1,0,0,"I love the Coventry Deli.  Like another reviewer mentioned, it should be called a cafeteria just because of the selection they offer.  And everyone really is great, very kind, and helpful.  

My go-to is the sandwich counter.  I had consulted Yelp before I ever walked in and decided there was no way a ""half"" sandwich would suffice for my lunch despite what was said in several reviews.. and I was wrong.  First, and foremost, the half sandwiches are just smaller portions of full sandwiches, not actually half a sandwich.  For example, if you order a whole egg salad sandwich, you're going to have a 4"" tall egg salad sandwich on your hands, whereas a half egg salad sandwhich is a more managable 2-3"" tall.  I eat a lot, and the half sandwich is plenty.  The sandwiches also come with a side.  I recommend the spicy potato salad personally, but all their side salads are pretty good, and you can also get a piece of fruit or chips.  

The interesting assortment of brownies and cake slices strategically placed at the cash registers are quite tasty and usually won't dissapoint.  

I found the oatmeal selection in the mornings to be too sweet for my taste, but it seems quite popular.  

Overall, this is a great place for a to-go lunch (and on occasion breakfast) where -you'll have lots of options and friendly folks.",2012-05-10 16:27:45,"{'food': ['sandwich', 'spicy potato salad', 'chips'], 'drink': []}"
eKUGxm8YwV5Oqbv-9KSUiQ,8uYyFhE81qm2pD16yN1yTg,pj8Y-5vfbRitnnm2xJFH9w,2,6,1,1,"Years ago this place was much different.. now you have all this bone in your platter, and the prices are ridiculous. I can definitely agree with people about the service... its terrible. The people roll their eyes, and don't hide at all they're anger that you even exist. I just go once in a extremely blue moon for take out bc they're curry isn't super spicy like some places.. the quality isn't as good as it used to be though. I'd say, save your money for elsewhere on South st.
Oh and the bathroom is around the block... how ridiculous! That should be illegal for a restaurant. I wash my hands before I eat, and i have to travel around the block and reenter the restaurant, by that time I'm contaminated again!!!",2015-06-26 03:35:57,"{'food': ['platter', 'curry'], 'drink': []}"
