review_id,user_id,business_id,stars,useful,funny,cool,text,date,ner_results
yXy0tsIXiNeIcaukj8Ozuw,HB5trhLKarXUXWCGz-SEyQ,2SYEGA2fZLdzZQ9lmIfM5Q,4,0,0,0,Food was very good and fast. Great bar if you like beer if you are looking for a cocktail not a good spot. Very nice neighbourhood and cute building,2017-11-07 18:58:49,"{'food': ['Food was very good and fast.'], 'drink': ['Great bar if you like beer if you are looking for a cocktail not a good spot.']}"
SpTEQkGF2n9AItUDYAXMUw,mu-CUxLMuOIeDPYxSKyfdg,dChRGpit9fM_kZK5pafNyA,4,0,0,0,"I stopped by for a last minute Sunday brunch not expecting The Love to go beyond my expectations. The interior is clean and inviting and the staff are friendly and helpful. We ordered a number of side dishes, the burger, and some eggs and they all came out great. If you're looking for true southern food, I wouldn't say this is it, but I still found their menu appetizing and delicious. I would recommend this and will be returning.",2018-09-04 00:01:58,"{'food': ['burger', 'eggs'], 'drink': []}"
yxW1CfY5e03INc8FJ6pOxw,eAjTEqqzps0yMJBrNz_fjg,SIoCIxjn4jLt2O-4DajWJw,4,0,0,0,"After multiple lunch visits, I must increase my rating and add another star. The place is great; sandwiches are awesome (try the veggie burger with bacon--that's no typo!). They've also started having a ""specials"" menu. We had some spicy, super tasty gazpacho last week. 

Service is always prompt and attentive, they are always playing great tunes from the 90s. I would love to spend the whole afternoon there, but alas...there's work to be done.",2012-05-31 14:45:12,"{'food': ['sandwiches', 'veggie burger with bacon'], 'drink': ['gazpacho']}"
1JTCYSU7tOHStindHaRT8w,RaI8HKo59jzPXetnrbdWgg,AWJyivVwe3t9BO-k8D0ynQ,1,0,0,0,"We were disappointed to learn that Cafe Square One would be closing at 6 today, but such is life; it's summer after all. 

... that is, until I looked at my watch and learned that in addition to posting a sign that they'd be closed at 6, it was a bit after 5 and the doors were already locked. The young staff sat idly while deliberately ignoring us and others outside. 

Um, isn't it silly to close earlier than the time at which you've posted you'll be closing early? Just saying. 

One star for the rude staff.",2015-08-08 21:48:22,"{'food': ['Cafe Square One'], 'drink': []}"
ZSd4A5A6NX2YfeKYKBLMCA,-QmEKJ_CzZnT9biZHddfZQ,MMRRS6YhVRx_iN5-JhMRYg,4,0,0,0,"I remember a few years ago, when this restaurant just opened up and EVERYONE made dinner plans at this location as the go-to place for friendship. A few years later, the buzz has died down a little, but Han is still the place to go for more authentic, less Americanized Chinese food in UCity. Plus, the spice is never a bad thing!

Some things are VERY delicious here--I love how flexible the menu is, with different spice levels and choices of meat for each type of dish. Especially noteworthy are the Dan Dan Noodles (of course), the cold sesame noodles, and the garlic chicken. 

Unfortunately, the oiliness of the food has increased significantly in the past few years. We ordered the crispy rice chicken (as my boyfriend does not handle spice), and I didn't eat any of it based on the sourness of the thick, oily sauce. I also tried my friend's chili oil dumplings, but were disappointed in the oil and flavor as well; they seemed more like wontons than dumplings. In addition, many things are very pricey (although portions are HUGE and usually you can bring some back home. 

Finally, the service is the best I've received at a non-fancy restaurant, they continuously refill the white rice, and the dishes come out quickly. Just be careful of spending too much money; I recommend sharing dishes with friends family-style.",2015-05-14 05:29:32,"{'food': ['Dan Dan Noodles', 'Cold Sesame Noodles', 'Garlic Chicken'], 'drink': []}"
dP5eGJpCQxuql2NtUfltbw,ARaEe_UYU4YiLd_jYJ6KyA,DJJtybSWY0BygESsSrabqg,5,3,1,1,"Me and my partner in crime went here after a hazy day of wandering around South Philly and eating everything in site. I got the Texas, I was not expecting the split wiener and was pleased with the result. i will be back again. 

Old School atmosphere and make sure to get a Hanks Root Beer with your wiener.",2013-02-26 00:58:34,"{'food': ['Texas', 'wiener'], 'drink': ['Hanks Root Beer']}"
cwCNMnvrxMgwbg9gQbsxcg,KRS_0bUdbmhogb0Ou7LewA,GNnDvJwtA9C1XFf-yv4KVA,5,0,0,1,I'm a CCP student and this food truck is amazing. $2 for a giant taco and they even include a little thing of chips and salsa! The cook/cashier always has a smile on his face and makes excellent food!,2014-10-31 16:15:51,"{'food': ['taco', 'chips and salsa'], 'drink': []}"
xCaGIECHwtGt4ztTEtDSWw,sgK8_cpe6FTk2HD0P27K0g,Oun4NN-u5yiHIxDqtJnxgA,5,0,0,0,"Amazing fried chicken.

Amazing donuts.

A must-eat in Philly.",2015-07-19 15:00:06,"{'food': ['Amazing fried chicken'], 'drink': []}"
xq_j1nKmJlIpzoJQwKV5VA,JOwThWdv2KZCO_u9MieR1g,M-qVYCSpKlNlxKWEq6vraw,4,6,2,5,"Good morning/afternoon soul food!  Came here on a Sunday around 1pm for their all you can eat brunch.  For about $18 a person, you get coffee/tea/juice/bloody mary (i think), and all you can eat.  Great fried chicken.  Tasty fried catfish.  Jambalaya.  Cajun shrimp.  Ribs.  Vegetables.  Mac and cheese.  And the best thing there was the waffle bar.  Really moist belgian waffles with maple syrup and yummy fruit fixins.  

Overall - terrible for your heart, fantastic for your stomach and hangover.",2008-08-31 06:21:15,"{'food': ['fried chicken', 'fried catfish', 'jambalaya', 'Cajun shrimp', 'ribs', 'vegetables', 'mac and cheese'], 'drink': ['coffee/tea/juice/bloody mary']}"
Z9rNb46TXEzIT3CzgtcBhQ,V9n2Qyr-dvNg00BwMWqquQ,1DkolDhbc0kydORZCIp7Fw,2,1,1,0,"The South Street Night Market was just another nail sealing me in my ""I'm officially too old for this sort of thing"" coffin.

I made the mistake of not getting there until after 8:00, by which time the crowds barely allowed one to move down the street.  I stood in a 45-minute line to get a grilled cheese sandwich.  It was expensive, not very large and not very good.  I was still hungry, but so done with the event.

One of the perks of being old is the ability to bail (with my old person money) to a nice restaurant where I sat at a table and had other people bring food to me.  I will be leaving future night markets to the kids, who did seem to be having a lot of fun.",2013-08-20 20:18:24,"{'food': ['grilled cheese sandwich'], 'drink': []}"
J1EsT6W43_qxgHUVggSTpQ,-Rf0O7PW53azxnb5pygV6g,RZtGWDLCAtuipwaZ-UfjmQ,4,0,0,0,Ton of food.  Solid quality.  Average wait time for lunch.  No complaints.,2015-07-30 17:26:34,"{'food': ['Ton of food'], 'drink': []}"
gT1fnuBB3DupyUYSVG78pA,PkDR6ZVKh0bX6PgYEkWmnQ,9iBlpXwgBFLVnx6RmHsiCQ,3,0,0,0,"Looks like a dive from the outside, but it's a very clean, well-kept place with friendly, prompt service.  And like most all diners, a large menu with lots of choices. 

As a visitor from out of state, I was looking for scrapple. Just can't get that anywhere else. As a visitor from the south, I was surprised to see grits on the menu (but didn't try them). They have Tabasco sauce, too. A great addition to any breakfast. In my humble, Louisiana influenced opinion. 

The scrapple was fried super crispy and piping hot.  It's sliced pretty thin and almost all crust. Could be a little thicker. Everything was hot and fresh cooked. Eggs in the omelette were just a little overdone, but not yet rubbery. ""Home fries"" are good, with a crispy crust, but more a pile of potatoes somewhere between mashed and small chunks. But still pretty good. 

The only distraction here is the bickering among the staff. With an open kitchen, there's just no place to hide. 

Overall, a good, standard diner with a good breakfast. Unless you are looking for yogurt and fruit. None of that nonsense on the menu here.",2018-05-21 12:31:58,"{'food': ['scrapple', 'omelette', 'eggs', 'home fries'], 'drink': []}"
CA04-YIWs-yljiU1qEnmsg,Oo-Sim3XTQXb0oVHJJem8w,u7_3L1NBWgxhBM_B-cmmnA,3,1,0,0,"This place is alright.  They make nice fresh pizzas with some tasty toppings.  I wasn't a fan of needing to walk through the kitchen to get to the restroom.  They also do shared tables inside, just an fyi.  The pizza was good, but I've had just as good pizza elsewhere.  The pizza of the day (if it was to your taste) seemed like a good deal if you needed a quick dinner. Considering the name on the door, I think I just expected a little more that would make it stand out.",2014-06-13 00:03:07,"{'food': ['pizza'], 'drink': []}"
cL09KbLXPNImlJhYaLZr5Q,WJVedIAJN0FRxDn6M1tLkA,AWJyivVwe3t9BO-k8D0ynQ,3,1,0,0,"You know when someone tries to do so many things that they can't really do any of them well? That's exactly how I feel about Cafe Square One. 

Their menu is super extensive and they boast that you can pretty much make any accommodation you wish, which is nice for those picky souls. I've had an array of items here from salads to bagels and I wasn't very impressed with any of them. Service is friendly, but very slow, even when you're the only customer. 

The smoothies are a solid 4-stars though and I will certainly return for those.",2015-07-18 17:29:14,"{'food': ['salads', 'bagels'], 'drink': ['smoothies']}"
ITgAE-hgWdd_msAotBYZSQ,wI-V57Abyb2xW5-OguSnxg,NMtUD873aWrNjljt3VOcFA,5,0,0,0,"I am not one to listen to reviews when it comes to restaurants or movies and I am glad I didn't. I went with a friend to the restaurant and from the minute we sat down we couldn't have been more impressed. We started with the clams casino which were the best I ever tasted. Caesar salad table side was perfectly executed and tasted delicious. Our waiter Tom was one step ahead of us the whole time and never missed a beat when it came to meeting our every request. Kevin Spraga knew what he was doing when he hired Tom. Scallops with parsnip purée were perfectly done. The restaurant is beautiful. Great bar and lots of Gin to choose from. I am so glad, once again, that  I chose to not listen to reviews and try for myself. Don't miss this restaurant, it's a keeper!",2015-04-11 11:50:33,"{'food': ['clams casino', 'scallops with parsnip purée'], 'drink': ['Gin']}"
3d_m7U-jxRF9YTP6DbOhMw,UIIYBGntm11bDKyYup3qzg,eFvzHawVJofxSnD7TgbZtg,5,0,0,0,"This cafe was one of the reasons I moved to Philly. Cozy, great coffee, stellar sandwiches and soups - really friendly staff. Plus: later than your average-cup-of-joe-place hours! Anything coconut is excellent. Colonel Mustard (sandwich) is a must try. I've also gone on date here before so, you know, it's a good meeting place too",2016-02-17 00:47:51,"{'food': ['sandwich', 'soup'], 'drink': ['coffee']}"
mbEH56bMwyyoVYpRPO92ug,qs9_yIgen2NUxQCS-LiR_Q,d_tRshM-w6S4QxE4VVi8tQ,3,0,0,0,"First time here...service, as always in a Starr restaurant was excellent...wife had the hamburger which was excellent...the roll was a bit pedestrian but good...French fries were very good...thin and cooked perfectly...I had a blt which was very tasty and came with a good salad...holding back on the 4th star till my next visit",2014-03-01 22:07:15,"{'food': ['hamburger', 'French fries', 'blt'], 'drink': []}"
JK6dB4-8EHVXMf0ePploXQ,vQTwBHj8S4QJ-IxgEp_6xw,O6hY9yenifuRXrpc4TfgsQ,4,0,0,0,"Played John Byrne and randomly found this place. 

Food was great. Burger was delicious. Only knock is that Burger doesn't come with fries and have to order separately. Come on is this North Korea?

Otherwise, great restaurant and would recommend after a day on the golf course.",2015-10-18 02:46:45,"{'food': ['Burger'], 'drink': []}"
MiU_TnD5OapbxLn34zgcBg,HxyLRaoH9PS09M6R3rV-EQ,3kiB39JzdovdlOhQj-nMCw,3,0,0,0,"Came back here to try a few more dishes & was pleased.

Pho with different kinds of meat (steak, tendon, tripe, fatty flank): the broth was very flavourful.  Noodles were slightly undercooked for me -- they weren't uncooked in general but just not soft enough for how I like my pho.  I didn't get as much variety of herbs as I would have liked, but the bowl was nice & comforting, all in all.

Lemongrass beef slices: very tasty, great flavour, well-grilled, fragrant with scallions on top.  The menu described the dish as having ""Fresh Vegetables"" but it was just some shreds of lettuce at the bottom of the plate.  Kind of annoying, because I wanted veggies, but I'll just have to come back next time & ask for more info while ordering.

Service is efficient.

3+ stars",2012-05-31 17:14:21,"{'food': ['Pho with different kinds of meat (steak, tendon, tripe, fatty flank)', 'Lemongrass beef slices'], 'drink': []}"
3XQgiysijxy8v_Srromspg,nKmutKWTs6CVceM2hEs6_g,X3pLW1Fq9SlbrUFsxgynwA,5,0,0,0,The best in town!! Yum yum yum!! Soooooo good!! Yum yum! Delicious!! Yum!! Definitely recommend it!!,2016-07-05 02:36:42,
Z66DGsKTy7m6119yPbte7w,J0tcgDJnRp7oSa2Zjb8uIg,rVfe1LHo55A2fworkm_jVw,5,0,0,0,"As blasphemous as it is, I don't really like pizza. It was never my thing. My reasoning is that I had too much of the bland, school lunch pizzas that I never really sought them out. 
My friends tried to change my mind, and as I have more and more experience with good pizza, I can see the appeal, but was never too impressed. 
But my oh my, Capofitto totally blew me away. I was just searching for a brunch place to catch up with a friend and this popped up. Gelato and pizza sounds interesting, so we decided on this one, 
You walk in and the gelato is in the front, it's very cute, and continuing in the back is the restaurant. The lighting is dim, especially compared to the gelato parlor which has huge windows. It's very cozy and comfortable. 
We decided on a San Lorenzo pizza to share and got the bread pudding for dessert (it's a bit too cold today for gelato). Both items were to share. The pizza crust is thin with the perfect spread of toppings. I have a huge appetite, but even half of the pizza was incredibly filling. It looked so thin too. I prefer savory foods over sweets, but the bread pudding was really good. It was warm and dense. The bread is not overly sweet, and has a relatively strong egg taste (that I really like and enjoy). The syrup drizzled over top enhances the bread, and with the spice and baked apple slices, the perfect autumn dessert. 
In my journey to find ""good"" pizza, to understand the obsession over it, I've tried a lot. I have been on the road to conversion and I am completely converted now.As I was eating, I was already planning a return trip. The journey is over, and is one of the best, if not not THE best places for pizza in Philadelphia. I prefer it over other established and popular pizzerias. I can't wait to go back!",2015-10-18 06:45:47,"{'food': ['pizza', 'bread pudding'], 'drink': []}"
TLoG54Rhy4z-t3saZVD1Cg,jJyDV0oIfN6Av5RlSFvwMg,Q-prSTdggNlxAEFV88BZOw,5,0,0,0,"One of the few places where I have had really fine tasting dishes. The chicken liver mousse, duck salad and chocolate dessert were brilliant.",2016-03-18 20:30:07,"{'food': ['chicken liver mousse', 'duck salad', 'chocolate dessert'], 'drink': []}"
RBW7jtWH_vii2xgEV4r5pA,yBHMWksiTkRNjmMEW5t9Mg,-OIUunijjcq_ZzyyQhPPFQ,4,1,0,0,Food was good and service was fine. I wish I had gotten the gyro platter bc the gyro sandwhich just comes with the sandwhich and I could have eaten a bit more.,2013-01-28 21:53:26,"{'food': ['gyro platter'], 'drink': []}"
zxHirhz23zKrv0Qap2S8Yg,epI0mzwF1-2kq_037Yy_Wg,y44MbCvvtmg1FpkNGSWisw,3,1,0,0,"First cheese steak and I regret having it at the airport and not some famous place that claimed to have invented it. 

Still, wasn't bad. Price is not exaggerated, the bread was fresh and soft. Plenty of meat inside and I let them pick out Swiss cheese. Grilled onions and nothing more. I'll start with the basic and later on advance to more toppings inside. 

It's not 5 start because I wasn't overwhelmed. 
It's not 4 because throughout the sandwich I had a couple of bites that hit something hard. I figure it was bone or something but it wasn't meat, cheese, onions or bread. Didn't investigate too much.",2017-12-17 04:57:37,"{'food': ['cheese steak', 'Swiss cheese'], 'drink': []}"
WkV7xOSHeNHuNsSUfguslQ,y1Fspo7QwiOvGgsJXAx3Kw,4S_yN5o0EvXvV6GNvesTKw,5,1,5,2,"Initially I was overcome by grief due to the fact that the Chef had achieved such a perfect  Butter to Pancake ratio...I honestly ate half of my girlfriend's pancakes before she or I could put syrup on her pancakes...I should have went with Pancakes. But I didn't, and that's okay because the Salmon platter w/grits was phenomenal. The service was great, the bean pie was even greater. I'll be back for lunch...pancakes changed my life",2015-07-04 16:08:35,"{'food': ['pancakes', 'salmon platter with grits'], 'drink': []}"
Vo5L5qSZwt8ZizsZp0NrvQ,_BcWyKQL16ndpBdggh2kNA,PW6C4OMpPQ_Zm7oiwNIVgw,2,4,3,2,"I'm sorry - but ANJOU is WEAK!!!

From the outside it looks appealing.  The menu sounds like it's gonna be good - if a bit pricey.

MEH.  MEH. MEH.

Sorry.  Nothing special here.  Go to Pizzicato, Mizu, Uzu or some other nearby place.  There are oodles of them to choose from.",2008-08-24 16:19:42,
8u_AF5V8ndmridFcgQ4ZWg,7-mA5iLgHJt6LRbi8ex09Q,9gObo5ltOMo6UgsaXaHPWA,5,1,0,0,"The food here is amazing--everything was absolutely perfect. Obviously the view was fantastic and it was a clear night. Our waiter was very knowledgeable and able to explain everything on the menu while not being overtly salesy. I liked him a lot. The bartender also was very friendly and knowledgeable; we liked her a lot too.

I had four courses: the cheese tasting plate at the bar while waiting, the tuna tartar (awesome), the salmon frites (awesome), and the pear almond tart (awesome). I don't think I needed the dessert, but the boyfriend insisted. He, on the other hand ordered the lobster bisque, pork porterhouse, and vanilla ice cream. I'm not really a pork person, but I did try a piece, and I thought it was good. He was happy with his meal.

That week, they were also trying out a new type of bread, an herbed bread, which is amazing. I hope they stick with it. The pastry chef is (all the chefs are) superb.

When we save up enough money again (haha), we will definitely return for special occasions.

Keep up the good work!",2017-01-15 16:43:53,"{'food': ['cheese tasting plate at the bar while waiting', 'tuna tartar', 'salmon frites', 'pear almond tart'], 'drink': ['lobster bisque', 'pork porterhouse', 'vanilla ice cream']}"
ayn3K9Z2AE6D4PqGZ_w09g,wBrbSsK8U8CXE3hqe5EIWA,bTve2mwLk5Zc01vRKqc2KQ,3,5,0,0,"So I must first admit: I don't drink coffee.  Never had a drop in my life.  Finding a coffee shop that caters as much to the non-coffee drinkers can be a challenge.  I was expecting to go elsewhere on this hot Sunday afternoon, but it was closed for the holiday weekend.  Yelp helped me find Red Hook.  Like another reviewer, I noticed that the staff was sitting chatting with friends when I walked in, but she stood right up to assist me.  She offered her recommendation for an Earl Grey with Caramel Latte.  It was a great choice.  Good flavor... and something I never would've considered on my own.

My one (maybe two) issues with Red Hook is that the place feels a bit like visiting a college kid's shared house.  The mismatched furniture is cute, but worn and dirty.  There was dust and dirt everywhere.  And, probably due to the heat outside and frequent door openings, lots of bugs.  They also didn't have air conditioning.  My fault for ordering a hot drink, but still... a coffee shop should feel cozy: warm in the winter and cool in the summer.

I may come back for additional drinks, but probably not for sitting for any length of time.",2011-05-28 21:59:33,"{'food': ['Earl Grey with Caramel Latte'], 'drink': ['Earl Grey with Caramel Latte']}"
YsCAt5Pcuwey3Mai4kon_A,RMrWegRjr3gn_g7fOLxHRA,xCXGV3wEvYd4xBGx8ZRFQA,4,2,0,0,"I was killing time around 21st and South last night (a neighborhood I don't often find myself in) and I chose La Va because it was open past 7pm. There was no one in there that late so it was nice and quiet for some reading.

When I walked up to the register, I found out they were out of bagels (I mean, it was 7pm so I don't blame 'em). I told the barista that I was just in the mood to munch on something so she gave me several suggestions which I appreciated and decided to get a mushroom & onion bureka which I had never had before. 

While I waited for her to heat it up I lounged in some seriously cool chairs in the corner and sipped on my iced coffee (which I think was La Colombe so it was good) and read. When the bureka was ready, she brought it over to me which was super nice. She was basically super nice the entire time. 

Overall, nice quiet option for a little coffee & reading on a nice little corner that's also good for some people watching.",2015-05-27 19:23:48,"{'food': ['mushroom & onion bureka'], 'drink': ['iced coffee']}"
or8snRiUZWDt2lkb0EwRlg,FIRe0QRtpxXN0MAK8MsKqQ,QvjY9esYNRMe_5kvT6TC5g,5,4,0,0,"Chaat and Chai is an awesome new addition to South Philly!!! LOVED the chai and the daal, but everything was delicious. A+ decor, music, food, service, and overall fabulous experience!!! EAT HERE!!!",2016-01-31 19:31:20,"{'food': ['chai', 'daal'], 'drink': []}"
gOFXePUXRBA0g_pcClm9Cg,Cvi8nZTwDVaQkqmmgQwQMw,Z5po0aTuzKKblek5y6Sp8Q,3,0,0,0,"Wow, this is crazy, indulgent, greasy, hangover-approved food. I think I got the Humpty Dumpty burger, which was literally loaded with everything and anything, including a drippy egg on top. It was good, but the simple burger with lettuce and tomato that my boyfriend had was nothing special. It was especially disappointing because of the pretty penny he paid for it. 

In conclusion, it seems like the ""special"" burgers are the way to go to get a good deal at 500 degrees. I wouldn't even bother with the fries since they are around $4 each and super overseasoned, IMO.",2013-05-10 13:31:05,"{'food': ['Humpty Dumpty burger', 'simple burger with lettuce and tomato'], 'drink': []}"
oXMriF4WxUAomssM3kbllw,iwBJ6E_2Q6ybYuoYezS4hQ,cXSyVvOr9YRN9diDkaWs0Q,4,0,0,0,"Really awesome food. Very affordable pricing and they were really open about taking out dairy, or adding in dairy where we wanted it (I got a different cheese in my eggs.) The latke was really interesting, not sure if I would get it again since the cheese inside kind of threw me off, but the potatoes and how it was cooked was very nice. I got an iced coffee, which was pretty good. Was a little upset they didn't have any shrimp so now I have to go back for their shrimp dishes! Yum. CASH ONLY and a BYO.",2016-09-19 15:42:30,"{'food': ['latke', 'potatoes'], 'drink': ['iced coffee']}"
sViVm-bQJ2_WOSKPtucQAA,YaiKuMh0ydK4iyZBP0ANEQ,EtKSTHV5Qx_Q7Aur9o4kQQ,1,0,0,0,"Service is terrible. Showed up at 4:00 on a Saturday 2 people and a toddler, gave us snotty comments about not being able to give us a highchair, said the wait is over 45 min. Walked out went to Prime Stache. Great service there food is better",2016-01-31 02:12:23,"{'food': ['Prime Stache'], 'drink': []}"
FQN8RiiImF0abJt4vg8PAw,A9epnIhuGu9QuK3Tv1Rg2A,9gObo5ltOMo6UgsaXaHPWA,3,0,0,0,"came here for a corporate dinner, great view and impeccable service, however, the food is mediocre. I had the filet mignon, nothing special. come here to hangout for the view and get a drink, but not for the food.",2012-06-28 06:23:10,"{'food': ['filet mignon'], 'drink': ['get a drink']}"
-4Bc13nY5MuhbijvWtXQ-Q,QLPylO8wa5C4XeY4LhGUuw,OKPUO8zvBBL-OA6-SfDx8Q,4,0,0,0,"I thought this place was pretty good. My husband and I went for brunch on a Sunday. The menu was fresh and diverse. I had an omelette and thought if was prepared well. I'd definitely go here again, when in the area. Service was a bit slow, though.",2014-06-17 10:00:46,"{'food': ['omelette'], 'drink': []}"
IlhVrIiWNFt-0gGIxz1wpw,0PB45lX-ncga1lAeDc9g6w,OHzX-ZD9qyoeoxR8Z0dlIA,5,0,0,0,"The food is above average but below awesome, but the environment and the people working here really make it a 5 star place. It's really cool, relaxed, and had a great choice of beers. Definitely try the gumbo and mac & cheese!",2015-08-11 00:03:12,"{'food': ['gumbo', 'mac & cheese'], 'drink': ['beer']}"
nRs_zCS63TX2gF4xqEzTzg,7TJI7fvpWd3b0CKT06Ucpg,NeY1bH6IKJxnn4YAixibsQ,1,2,0,0,"Horrible service and store layout. I've been to this place multiple times, and each time I have ended up getting someone else's sandwich. I asked the service staff twice to make sure that I got the correct sandwich, but still they messed up the order. Not going to come to this place ever again.",2015-08-31 17:11:38,"{'food': ['sandwich'], 'drink': []}"
7Y47-r1MeCd3wie3Yh8J8w,ppyGrwNhpq_PJASM4ar5OA,cXSyVvOr9YRN9diDkaWs0Q,5,1,1,0,"We finally went to Honey's a few weeks ago and it was amazing.  I am tempted to give it a bad review lest it become more crowded.  Just go, you'll love it.",2007-06-04 20:23:57,"{'food': [""Honey's""], 'drink': []}"
